ffff8801d7ace780 2546362302 C Ii:5:006:2 0:1 8 = 00000000 ffff0000
ffff8801d7ace780 2546371350 S Ii:5:006:2 -115:1 8 <
ffff8801d7ace780 2546378297 C Ii:5:006:2 0:1 8 = 00000000 ffff0000
ffff8801d7ace780 2546379339 S Ii:5:006:2 -115:1 8 <
ffff8801d7ace780 2546404300 C Ii:5:006:2 0:1 8 = 00000000 ffff0000
ffff8801d7ace780 2546405352 S Ii:5:006:2 -115:1 8 <
ffff8801d7ace780 2546408298 C Ii:5:006:2 0:1 8 = 00000100 00000000
ffff8801d7ace780 2546408344 S Ii:5:006:2 -115:1 8 <
ffff8801d7ace780 2546418299 C Ii:5:006:2 0:1 8 = 00000000 ffff0000
ffff8801d7ace780 2546418337 S Ii:5:006:2 -115:1 8 <
ffff8801d7ace780 2546430302 C Ii:5:006:2 0:1 8 = 00000000 ffff0000
ffff8801d7ace780 2546430345 S Ii:5:006:2 -115:1 8 <
ffff8801d7ace780 2546438299 C Ii:5:006:2 0:1 8 = 00000000 ffff0000
ffff8801d7ace780 2546438343 S Ii:5:006:2 -115:1 8 <
ffff8801d7ace780 2546444301 C Ii:5:006:2 0:1 8 = 00000100 00000000
ffff8801d7ace780 2546446358 S Ii:5:006:2 -115:1 8 <
ffff8801d7ace780 2546448299 C Ii:5:006:2 0:1 8 = 00000000 ffff0000
ffff8801d7ace780 2546448341 S Ii:5:006:2 -115:1 8 <
ffff8801d7ace780 2546460301 C Ii:5:006:2 0:1 8 = 00000000 ffff0000
ffff8801d7ace780 2546460338 S Ii:5:006:2 -115:1 8 <
ffff88013d3b4a80 2553172900 S Ci:5:006:0 s 80 06 b600 0001 0008 8 <
ffff88013d3b4a80 2553174525 C Ci:5:006:0 0 8 = 7fffff00 00000102
ffff88013d3b4a80 2553179885 S Ci:5:006:0 s 80 06 b600 0002 0008 8 <
ffff88013d3b4a80 2553180520 C Ci:5:006:0 0 8 = 0032ff00 00011000
ffff88013d3b4a80 2553184894 S Ci:5:006:0 s 80 06 b600 0003 0008 8 <
ffff88013d3b4a80 2553185520 C Ci:5:006:0 0 8 = 0000991a 00350000
ffff88013d3b4a80 2553189920 S Ci:5:006:0 s 80 06 b601 0030 0001 1 <
ffff88013d3b4a80 2553190520 C Ci:5:006:0 0 1 = fb
ffff88013d3b4a80 2553192905 S Ci:5:006:0 s 80 06 b600 0002 0008 8 <
ffff88013d3b4a80 2553193520 C Ci:5:006:0 0 8 = 0032ff00 00011000
ffff88013d3b4a80 2553196883 S Ci:5:006:0 s 80 06 b600 0001 0008 8 <
ffff88013d3b4a80 2553197520 C Ci:5:006:0 0 8 = 30ffff00 00000102
ffff88013d3b4a80 2553200654 S Ci:5:006:0 s 80 06 b600 0001 0008 8 <
ffff88013d3b4a80 2553201520 C Ci:5:006:0 0 8 = 30ffff00 00000102
ffff88013d3b4a80 2553203070 S Ci:5:006:0 s 80 06 b600 0002 0008 8 <
ffff88013d3b4a80 2553203519 C Ci:5:006:0 0 8 = 0032ff00 00011000
ffff88013d3b4a80 2553204897 S Ci:5:006:0 s 80 06 b600 0003 0008 8 <
ffff88013d3b4a80 2553205521 C Ci:5:006:0 0 8 = 0000991a 00350000
ffff8801d7ace780 2559330726 C Ii:5:006:2 0:1 8 = 00000000 ffff0000
ffff8801d7ace780 2559340024 S Ii:5:006:2 -115:1 8 <
ffff8801d7ace780 2559341722 C Ii:5:006:2 0:1 8 = 00000000 ffff0000
ffff8801d7ace780 2559342029 S Ii:5:006:2 -115:1 8 <
ffff8801d7ace780 2559344721 C Ii:5:006:2 0:1 8 = 00000000 ffff0000
ffff8801d7ace780 2559344975 S Ii:5:006:2 -115:1 8 <
ffff8801d7ace780 2559346722 C Ii:5:006:2 0:1 8 = 00000100 00000000
ffff8801d7ace780 2559347153 S Ii:5:006:2 -115:1 8 <
ffff8801d7ace780 2559350723 C Ii:5:006:2 0:1 8 = 00000000 ffff0000
ffff8801d7ace780 2559351021 S Ii:5:006:2 -115:1 8 <
ffff8801d7ace780 2559356721 C Ii:5:006:2 0:1 8 = 00000000 ffff0000
ffff8801d7ace780 2559359003 S Ii:5:006:2 -115:1 8 <
ffff8801d7ace780 2559362721 C Ii:5:006:2 0:1 8 = 00000000 ffff0000
ffff8801d7ace780 2559362956 S Ii:5:006:2 -115:1 8 <
ffff8801d7ace780 2559368723 C Ii:5:006:2 0:1 8 = 00000000 ffff0000
ffff8801d7ace780 2559371024 S Ii:5:006:2 -115:1 8 <
ffff8801d7ace780 2559372721 C Ii:5:006:2 0:1 8 = 00000000 ffff0000
ffff8801d7ace780 2559372953 S Ii:5:006:2 -115:1 8 <
ffff8801d7ace780 2559374722 C Ii:5:006:2 0:1 8 = 00000100 00000000
ffff8801d7ace780 2559374969 S Ii:5:006:2 -115:1 8 <
ffff8801d7ace780 2559378722 C Ii:5:006:2 0:1 8 = 00000000 ffff0000
ffff8801d7ace780 2559379001 S Ii:5:006:2 -115:1 8 <
ffff8801d7ace780 2559382724 C Ii:5:006:2 0:1 8 = 00000000 ffff0000
ffff8801d7ace780 2559382960 S Ii:5:006:2 -115:1 8 <
ffff8801d7ace780 2559388723 C Ii:5:006:2 0:1 8 = 00000000 ffff0000
ffff8801d7ace780 2559391025 S Ii:5:006:2 -115:1 8 <
ffff8801d7ace780 2559396724 C Ii:5:006:2 0:1 8 = 00000000 ffff0000
ffff8801d7ace780 2559399016 S Ii:5:006:2 -115:1 8 <
ffff8801d7ace780 2559402724 C Ii:5:006:2 0:1 8 = 00000000 ffff0000
ffff8801d7ace780 2559402957 S Ii:5:006:2 -115:1 8 <
ffff8801d7ace780 2559410726 C Ii:5:006:2 0:1 8 = 00000100 ffff0000
ffff8801d7ace780 2559411025 S Ii:5:006:2 -115:1 8 <
ffff8801d7ace780 2559416724 C Ii:5:006:2 0:1 8 = 00000000 ffff0000
ffff8801d7ace780 2559419006 S Ii:5:006:2 -115:1 8 <
ffff8801d7ace780 2559424725 C Ii:5:006:2 0:1 8 = 00000000 ffff0000
ffff8801d7ace780 2559427070 S Ii:5:006:2 -115:1 8 <
ffff8801d7ace780 2559438725 C Ii:5:006:2 0:1 8 = 00000000 ffff0000
ffff8801d7ace780 2559439008 S Ii:5:006:2 -115:1 8 <
ffff88013d3b4a80 2562171053 S Ci:5:006:0 s 80 06 b600 0002 0008 8 <
ffff88013d3b4a80 2562172821 C Ci:5:006:0 0 8 = 0032ff00 00011000
ffff88013d3b4a80 2569404993 S Ci:5:006:0 s 80 06 b601 007f 0001 1 <
ffff88013d3b4a80 2569406057 C Ci:5:006:0 0 1 = fb
