ffff88012d5ba780 1628799866 S Ci:5:004:0 s 80 06 b600 0001 0008 8 <
ffff88012d5ba780 1628801616 C Ci:5:004:0 0 8 = 7fffff00 00000102
ffff88012d5ba780 1628804858 S Ci:5:004:0 s 80 06 b600 0002 0008 8 <
ffff88012d5ba780 1628805612 C Ci:5:004:0 0 8 = 0032a419 1d011000
ffff88012d5ba780 1628808848 S Ci:5:004:0 s 80 06 b600 0003 0008 8 <
ffff88012d5ba780 1628809607 C Ci:5:004:0 0 8 = 0000991a 00350000
ffff88012d5ba780 1628814853 S Ci:5:004:0 s 80 06 b601 0030 0001 1 <
ffff88012d5ba780 1628815611 C Ci:5:004:0 0 1 = fb
ffff88012d5ba780 1628818852 S Ci:5:004:0 s 80 06 b600 0002 0008 8 <
ffff88012d5ba780 1628819608 C Ci:5:004:0 0 8 = 0032a419 1d011000
ffff88012d5ba780 1628823851 S Ci:5:004:0 s 80 06 b600 0001 0008 8 <
ffff88012d5ba780 1628824608 C Ci:5:004:0 0 8 = 30ffff00 00000102
ffff88012d5ba780 1628825681 S Ci:5:004:0 s 80 06 b600 0001 0008 8 <
ffff88012d5ba780 1628826610 C Ci:5:004:0 0 8 = 30ffff00 00000102
ffff88012d5ba780 1628827464 S Ci:5:004:0 s 80 06 b600 0002 0008 8 <
ffff88012d5ba780 1628827610 C Ci:5:004:0 0 8 = 0032a419 1d011000
ffff88012d5ba780 1628834858 S Ci:5:004:0 s 80 06 b600 0003 0008 8 <
ffff88012d5ba780 1628835607 C Ci:5:004:0 0 8 = 0000991a 00350000
