ffff8801f4df8a80 4078047235 S Ci:5:002:0 s 80 06 b600 0001 0008 8 <
ffff8801f4df8a80 4078049075 C Ci:5:002:0 0 8 = 30ffff00 00000102
ffff8801f4df8a80 4078050164 S Ci:5:002:0 s 80 06 b600 0002 0008 8 <
ffff8801f4df8a80 4078051069 C Ci:5:002:0 0 8 = 0032a419 1d011000
ffff8801f4df8a80 4078052178 S Ci:5:002:0 s 80 06 b600 0003 0008 8 <
ffff8801f4df8a80 4078053069 C Ci:5:002:0 0 8 = 0000991a 00350000
ffff88014b457e40 4078445730 S Ci:5:002:0 s 80 06 b600 0001 0008 8 <
ffff88014b457e40 4078447086 C Ci:5:002:0 0 8 = 30ffff00 00000102
ffff88014b457e40 4078448741 S Ci:5:002:0 s 80 06 b600 0002 0008 8 <
ffff88014b457e40 4078449082 C Ci:5:002:0 0 8 = 0032a419 1d011000
ffff88014b457e40 4078450678 S Ci:5:002:0 s 80 06 b600 0003 0008 8 <
ffff88014b457e40 4078451081 C Ci:5:002:0 0 8 = 0000991a 00350000
ffff88014b457e40 4078452695 S Ci:5:002:0 s 80 06 bf01 0001 0001 1 <
ffff88014b457e40 4078453082 C Ci:5:002:0 0 1 = fb
ffff8801f4df8a80 4078585725 S Ci:5:002:0 s 80 06 b502 1a00 0001 1 <
ffff8801f4df8a80 4078612093 C Ci:5:002:0 0 1 = fb
ffff8801f4df8a80 4078614712 S Ci:5:002:0 s 80 06 b504 1900 0001 1 <
ffff8801f4df8a80 4078615088 C Ci:5:002:0 0 1 = fb
ffff8801f4df8a80 4078616725 S Ci:5:002:0 s 80 06 b504 1d01 0001 1 <
ffff8801f4df8a80 4078617087 C Ci:5:002:0 0 1 = fb
ffff8801f4df8a80 4078618741 S Ci:5:002:0 s 80 06 b504 ff02 0001 1 <
ffff8801f4df8a80 4078619088 C Ci:5:002:0 0 1 = fb
ffff8801f4df8a80 4078620678 S Ci:5:002:0 s 80 06 b504 ff03 0001 1 <
ffff8801f4df8a80 4078621088 C Ci:5:002:0 0 1 = fb
ffff8801f4df8a80 4078622692 S Ci:5:002:0 s 80 06 b504 ff04 0001 1 <
ffff8801f4df8a80 4078623088 C Ci:5:002:0 0 1 = fb
ffff8801f4df8a80 4078624711 S Ci:5:002:0 s 80 06 b504 ff05 0001 1 <
ffff8801f4df8a80 4078625088 C Ci:5:002:0 0 1 = fb
ffff8801f4df80c0 4078626726 S Ci:5:002:0 s 80 06 b504 ff06 0001 1 <
ffff8801f4df80c0 4078627090 C Ci:5:002:0 0 1 = fb
ffff8801f4df80c0 4078628740 S Ci:5:002:0 s 80 06 b504 ff07 0001 1 <
ffff8801f4df80c0 4078629089 C Ci:5:002:0 0 1 = fb
ffff8801f4df80c0 4078630678 S Ci:5:002:0 s 80 06 b504 0008 0001 1 <
ffff8801f4df80c0 4078631088 C Ci:5:002:0 0 1 = fb
ffff8801f4df80c0 4078632693 S Ci:5:002:0 s 80 06 b504 0109 0001 1 <
ffff8801f4df80c0 4078633088 C Ci:5:002:0 0 1 = fb
ffff8801f4df80c0 4078634711 S Ci:5:002:0 s 80 06 b504 000a 0001 1 <
ffff8801f4df80c0 4078635088 C Ci:5:002:0 0 1 = fb
ffff8801f4df80c0 4078636724 S Ci:5:002:0 s 80 06 b504 000b 0001 1 <
ffff8801f4df80c0 4078637089 C Ci:5:002:0 0 1 = fb
ffff8801f4df80c0 4078638740 S Ci:5:002:0 s 80 06 b504 040c 0001 1 <
ffff8801f4df80c0 4078639089 C Ci:5:002:0 0 1 = fb
ffff8801f4df80c0 4078640678 S Ci:5:002:0 s 80 06 b504 000d 0001 1 <
ffff8801f4df80c0 4078641088 C Ci:5:002:0 0 1 = fb
ffff8801f4df80c0 4078642693 S Ci:5:002:0 s 80 06 b504 020e 0001 1 <
ffff8801f4df80c0 4078643088 C Ci:5:002:0 0 1 = fb
ffff8801f4df80c0 4078644711 S Ci:5:002:0 s 80 06 b504 000f 0001 1 <
ffff8801f4df80c0 4078645089 C Ci:5:002:0 0 1 = fb
ffff8801f4df80c0 4078646724 S Ci:5:002:0 s 80 06 b504 1710 0001 1 <
ffff8801f4df80c0 4078647091 C Ci:5:002:0 0 1 = fb
ffff8801f4df80c0 4078648744 S Ci:5:002:0 s 80 06 b504 0011 0001 1 <
ffff8801f4df80c0 4078649090 C Ci:5:002:0 0 1 = fb
ffff8801f4df80c0 4078650678 S Ci:5:002:0 s 80 06 b504 2112 0001 1 <
ffff8801f4df80c0 4078651089 C Ci:5:002:0 0 1 = fb
ffff8801f4df80c0 4078652694 S Ci:5:002:0 s 80 06 b504 0013 0001 1 <
ffff8801f4df80c0 4078653089 C Ci:5:002:0 0 1 = fb
ffff8801f4df80c0 4078654711 S Ci:5:002:0 s 80 06 b504 4014 0001 1 <
ffff8801f4df80c0 4078655090 C Ci:5:002:0 0 1 = fb
ffff8801f4df80c0 4078656725 S Ci:5:002:0 s 80 06 b504 4015 0001 1 <
ffff8801f4df80c0 4078657089 C Ci:5:002:0 0 1 = fb
ffff8801f4df80c0 4078658745 S Ci:5:002:0 s 80 06 b504 5016 0001 1 <
ffff8801f4df80c0 4078659090 C Ci:5:002:0 0 1 = fb
ffff8801f4df80c0 4078660677 S Ci:5:002:0 s 80 06 b504 0017 0001 1 <
ffff8801f4df80c0 4078661089 C Ci:5:002:0 0 1 = fb
ffff8801f4df80c0 4078662693 S Ci:5:002:0 s 80 06 b504 2618 0001 1 <
ffff8801f4df80c0 4078663089 C Ci:5:002:0 0 1 = fb
ffff8801f4df80c0 4078664711 S Ci:5:002:0 s 80 06 b504 0019 0001 1 <
ffff8801f4df80c0 4078665089 C Ci:5:002:0 0 1 = fb
ffff8801f4df80c0 4078666724 S Ci:5:002:0 s 80 06 b504 301a 0001 1 <
ffff8801f4df80c0 4078667090 C Ci:5:002:0 0 1 = fb
ffff8801f4df80c0 4078668740 S Ci:5:002:0 s 80 06 b504 001b 0001 1 <
ffff8801f4df80c0 4078669090 C Ci:5:002:0 0 1 = fb
ffff8801f4df80c0 4078670677 S Ci:5:002:0 s 80 06 b504 ff1c 0001 1 <
ffff8801f4df80c0 4078671089 C Ci:5:002:0 0 1 = fb
ffff8801f4df80c0 4078672693 S Ci:5:002:0 s 80 06 b504 ff1d 0001 1 <
ffff8801f4df80c0 4078673089 C Ci:5:002:0 0 1 = fb
ffff8801f4df80c0 4078674710 S Ci:5:002:0 s 80 06 b504 ff1e 0001 1 <
ffff8801f4df80c0 4078675090 C Ci:5:002:0 0 1 = fb
ffff8801f4df80c0 4078676724 S Ci:5:002:0 s 80 06 b504 ff1f 0001 1 <
ffff8801f4df80c0 4078677090 C Ci:5:002:0 0 1 = fb
ffff8801f4df80c0 4078678739 S Ci:5:002:0 s 80 06 b504 fe20 0001 1 <
ffff8801f4df80c0 4078679090 C Ci:5:002:0 0 1 = fb
ffff8801f4df80c0 4078680677 S Ci:5:002:0 s 80 06 b504 2b21 0001 1 <
ffff8801f4df80c0 4078681090 C Ci:5:002:0 0 1 = fb
ffff8801f4df80c0 4078682693 S Ci:5:002:0 s 80 06 b504 fe22 0001 1 <
ffff8801f4df80c0 4078683090 C Ci:5:002:0 0 1 = fb
ffff8801f4df80c0 4078684710 S Ci:5:002:0 s 80 06 b504 2b23 0001 1 <
ffff8801f4df80c0 4078685090 C Ci:5:002:0 0 1 = fb
ffff8801f4df80c0 4078686723 S Ci:5:002:0 s 80 06 b504 fe24 0001 1 <
ffff8801f4df80c0 4078687089 C Ci:5:002:0 0 1 = fb
ffff8801f4df80c0 4078688739 S Ci:5:002:0 s 80 06 b504 2b25 0001 1 <
ffff8801f4df80c0 4078689090 C Ci:5:002:0 0 1 = fb
ffff8801f4df80c0 4078690678 S Ci:5:002:0 s 80 06 b504 fe26 0001 1 <
ffff8801f4df80c0 4078691090 C Ci:5:002:0 0 1 = fb
ffff8801f4df80c0 4078692693 S Ci:5:002:0 s 80 06 b504 2b27 0001 1 <
ffff8801f4df80c0 4078693090 C Ci:5:002:0 0 1 = fb
ffff8801f4df80c0 4078694711 S Ci:5:002:0 s 80 06 b504 f928 0001 1 <
ffff8801f4df80c0 4078695090 C Ci:5:002:0 0 1 = fb
ffff8801f4df80c0 4078696725 S Ci:5:002:0 s 80 06 b504 2b29 0001 1 <
ffff8801f4df80c0 4078697091 C Ci:5:002:0 0 1 = fb
ffff8801f4df80c0 4078698739 S Ci:5:002:0 s 80 06 b504 f82a 0001 1 <
ffff8801f4df80c0 4078699091 C Ci:5:002:0 0 1 = fb
ffff8801f4df80c0 4078700677 S Ci:5:002:0 s 80 06 b504 2b2b 0001 1 <
ffff8801f4df80c0 4078701090 C Ci:5:002:0 0 1 = fb
ffff8801f4df80c0 4078702693 S Ci:5:002:0 s 80 06 b504 402c 0001 1 <
ffff8801f4df80c0 4078703090 C Ci:5:002:0 0 1 = fb
ffff8801f4df80c0 4078704711 S Ci:5:002:0 s 80 06 b504 002d 0001 1 <
ffff8801f4df80c0 4078705091 C Ci:5:002:0 0 1 = fb
ffff8801f4df80c0 4078706724 S Ci:5:002:0 s 80 06 b504 402e 0001 1 <
ffff8801f4df80c0 4078707090 C Ci:5:002:0 0 1 = fb
ffff8801f4df80c0 4078708740 S Ci:5:002:0 s 80 06 b504 002f 0001 1 <
ffff8801f4df80c0 4078709091 C Ci:5:002:0 0 1 = fb
ffff8801f4df80c0 4078710678 S Ci:5:002:0 s 80 06 b504 0030 0001 1 <
ffff8801f4df80c0 4078711091 C Ci:5:002:0 0 1 = fb
ffff8801f4df80c0 4078712694 S Ci:5:002:0 s 80 06 b504 0031 0001 1 <
ffff8801f4df80c0 4078713091 C Ci:5:002:0 0 1 = fb
ffff8801f4df80c0 4078714711 S Ci:5:002:0 s 80 06 b504 4032 0001 1 <
ffff8801f4df80c0 4078715091 C Ci:5:002:0 0 1 = fb
ffff8801f4df80c0 4078716725 S Ci:5:002:0 s 80 06 b504 0033 0001 1 <
ffff8801f4df80c0 4078717091 C Ci:5:002:0 0 1 = fb
ffff8801f4df80c0 4078718740 S Ci:5:002:0 s 80 06 b504 0034 0001 1 <
ffff8801f4df80c0 4078719091 C Ci:5:002:0 0 1 = fb
ffff8801f4df80c0 4078720678 S Ci:5:002:0 s 80 06 b504 0035 0001 1 <
ffff8801f4df80c0 4078721091 C Ci:5:002:0 0 1 = fb
ffff8801f4df80c0 4078722693 S Ci:5:002:0 s 80 06 b504 4036 0001 1 <
ffff8801f4df80c0 4078723091 C Ci:5:002:0 0 1 = fb
ffff8801f4df80c0 4078724711 S Ci:5:002:0 s 80 06 b504 0037 0001 1 <
ffff8801f4df80c0 4078725091 C Ci:5:002:0 0 1 = fb
ffff8801f4df80c0 4078726724 S Ci:5:002:0 s 80 06 b504 0038 0001 1 <
ffff8801f4df80c0 4078727091 C Ci:5:002:0 0 1 = fb
ffff8801f4df80c0 4078728740 S Ci:5:002:0 s 80 06 b504 0039 0001 1 <
ffff8801f4df80c0 4078729092 C Ci:5:002:0 0 1 = fb
ffff8801f4df80c0 4078730678 S Ci:5:002:0 s 80 06 b504 403a 0001 1 <
ffff8801f4df80c0 4078731092 C Ci:5:002:0 0 1 = fb
ffff8801f4df80c0 4078732693 S Ci:5:002:0 s 80 06 b504 003b 0001 1 <
ffff8801f4df80c0 4078733091 C Ci:5:002:0 0 1 = fb
ffff8801f4df80c0 4078734711 S Ci:5:002:0 s 80 06 b504 003c 0001 1 <
ffff8801f4df80c0 4078735092 C Ci:5:002:0 0 1 = fb
ffff8801f4df80c0 4078736724 S Ci:5:002:0 s 80 06 b504 003d 0001 1 <
ffff8801f4df80c0 4078737092 C Ci:5:002:0 0 1 = fb
ffff8801f4df80c0 4078738740 S Ci:5:002:0 s 80 06 b504 403e 0001 1 <
ffff8801f4df80c0 4078739092 C Ci:5:002:0 0 1 = fb
ffff8801f4df80c0 4078740678 S Ci:5:002:0 s 80 06 b504 003f 0001 1 <
ffff8801f4df80c0 4078741092 C Ci:5:002:0 0 1 = fb
ffff8801f4df80c0 4078742693 S Ci:5:002:0 s 80 06 b500 9a00 0001 1 <
ffff8801f4df80c0 4078744092 C Ci:5:002:0 0 1 = fb
ffff8801f4df80c0 4078745971 S Ci:5:002:0 s 80 06 b501 1a00 0002 2 <
ffff8801f4df80c0 4078746094 C Ci:5:002:0 0 2 = 191d
ffff8801f4df8a80 4078747742 S Ci:5:002:0 s 80 06 b501 1a01 0002 2 <
ffff8801f4df8a80 4078748094 C Ci:5:002:0 0 2 = ffff
ffff8801f4df8a80 4078749673 S Ci:5:002:0 s 80 06 b501 1a02 0002 2 <
ffff8801f4df8a80 4078750093 C Ci:5:002:0 0 2 = ffff
ffff8801f4df8a80 4078751686 S Ci:5:002:0 s 80 06 b501 1a03 0002 2 <
ffff8801f4df8a80 4078752092 C Ci:5:002:0 0 2 = ffff
ffff8801f4df8a80 4078753702 S Ci:5:002:0 s 80 06 b501 1a04 0002 2 <
ffff8801f4df8a80 4078754092 C Ci:5:002:0 0 2 = 0001
ffff8801f4df8a80 4078755718 S Ci:5:002:0 s 80 06 b501 1a05 0002 2 <
ffff8801f4df8a80 4078756093 C Ci:5:002:0 0 2 = 0000
ffff8801f4df8a80 4078757734 S Ci:5:002:0 s 80 06 b501 1a06 0002 2 <
ffff8801f4df8a80 4078758093 C Ci:5:002:0 0 2 = 0400
ffff8801f4df8a80 4078759673 S Ci:5:002:0 s 80 06 b501 1a07 0002 2 <
ffff8801f4df8a80 4078760093 C Ci:5:002:0 0 2 = 0200
ffff8801f4df8a80 4078761685 S Ci:5:002:0 s 80 06 b501 1a08 0002 2 <
ffff8801f4df8a80 4078762092 C Ci:5:002:0 0 2 = 1700
ffff8801f4df8a80 4078763701 S Ci:5:002:0 s 80 06 b501 1a09 0002 2 <
ffff8801f4df8a80 4078764092 C Ci:5:002:0 0 2 = 2100
ffff8801f4df8a80 4078765719 S Ci:5:002:0 s 80 06 b501 1a0a 0002 2 <
ffff8801f4df8a80 4078766093 C Ci:5:002:0 0 2 = 4040
ffff8801f4df8a80 4078767733 S Ci:5:002:0 s 80 06 b501 1a0b 0002 2 <
ffff8801f4df8a80 4078768093 C Ci:5:002:0 0 2 = 5000
ffff8801f4df8a80 4078769672 S Ci:5:002:0 s 80 06 b501 1a0c 0002 2 <
ffff8801f4df8a80 4078770093 C Ci:5:002:0 0 2 = 2600
ffff8801f4df8a80 4078771686 S Ci:5:002:0 s 80 06 b501 1a0d 0002 2 <
ffff8801f4df8a80 4078772093 C Ci:5:002:0 0 2 = 3000
ffff8801f4df8a80 4078773701 S Ci:5:002:0 s 80 06 b501 1a0e 0002 2 <
ffff8801f4df8a80 4078774093 C Ci:5:002:0 0 2 = ffff
ffff8801f4df8a80 4078775718 S Ci:5:002:0 s 80 06 b501 1a0f 0002 2 <
ffff8801f4df8a80 4078776094 C Ci:5:002:0 0 2 = ffff
ffff8801f4df8a80 4078777732 S Ci:5:002:0 s 80 06 b501 1a10 0002 2 <
ffff8801f4df8a80 4078778093 C Ci:5:002:0 0 2 = fe2b
ffff8801f4df8a80 4078779672 S Ci:5:002:0 s 80 06 b501 1a11 0002 2 <
ffff8801f4df8a80 4078780093 C Ci:5:002:0 0 2 = fe2b
ffff8801f4df8a80 4078781686 S Ci:5:002:0 s 80 06 b501 1a12 0002 2 <
ffff8801f4df8a80 4078782093 C Ci:5:002:0 0 2 = fe2b
ffff8801f4df8a80 4078783701 S Ci:5:002:0 s 80 06 b501 1a13 0002 2 <
ffff8801f4df8a80 4078784093 C Ci:5:002:0 0 2 = fe2b
ffff8801f4df8a80 4078785719 S Ci:5:002:0 s 80 06 b501 1a14 0002 2 <
ffff8801f4df8a80 4078786093 C Ci:5:002:0 0 2 = f92b
ffff8801f4df8a80 4078787733 S Ci:5:002:0 s 80 06 b501 1a15 0002 2 <
ffff8801f4df8a80 4078788094 C Ci:5:002:0 0 2 = f82b
ffff8801f4df8a80 4078789672 S Ci:5:002:0 s 80 06 b501 1a16 0002 2 <
ffff8801f4df8a80 4078790094 C Ci:5:002:0 0 2 = 4000
ffff8801f4df8a80 4078791685 S Ci:5:002:0 s 80 06 b501 1a17 0002 2 <
ffff8801f4df8a80 4078792093 C Ci:5:002:0 0 2 = 4000
ffff8801f4df8a80 4078793701 S Ci:5:002:0 s 80 06 b501 1a18 0002 2 <
ffff8801f4df8a80 4078794093 C Ci:5:002:0 0 2 = 0000
ffff8801f4df8a80 4078795719 S Ci:5:002:0 s 80 06 b501 1a19 0002 2 <
ffff8801f4df8a80 4078796094 C Ci:5:002:0 0 2 = 4000
ffff8801f4df8a80 4078797732 S Ci:5:002:0 s 80 06 b501 1a1a 0002 2 <
ffff8801f4df8a80 4078798094 C Ci:5:002:0 0 2 = 0000
ffff8801f4df8a80 4078799672 S Ci:5:002:0 s 80 06 b501 1a1b 0002 2 <
ffff8801f4df8a80 4078800094 C Ci:5:002:0 0 2 = 4000
ffff8801f4df8a80 4078801685 S Ci:5:002:0 s 80 06 b501 1a1c 0002 2 <
ffff8801f4df8a80 4078802094 C Ci:5:002:0 0 2 = 0000
ffff8801f4df8a80 4078803701 S Ci:5:002:0 s 80 06 b501 1a1d 0002 2 <
ffff8801f4df8a80 4078804094 C Ci:5:002:0 0 2 = 4000
ffff8801f4df8a80 4078805717 S Ci:5:002:0 s 80 06 b501 1a1e 0002 2 <
ffff8801f4df8a80 4078806094 C Ci:5:002:0 0 2 = 0000
ffff8801f4df8a80 4078807731 S Ci:5:002:0 s 80 06 b501 1a1f 0002 2 <
ffff8801f4df8a80 4078808094 C Ci:5:002:0 0 2 = 4000
ffff8801f4df8a80 4078809672 S Ci:5:002:0 s 80 06 b504 0000 0001 1 <
ffff8801f4df8a80 4078810094 C Ci:5:002:0 0 1 = fb
ffff8801f4df8a80 4078811685 S Ci:5:002:0 s 80 06 b504 0001 0001 1 <
ffff8801f4df8a80 4078812094 C Ci:5:002:0 0 1 = fb
ffff8801f4df8a80 4078813701 S Ci:5:002:0 s 80 06 b504 ff02 0001 1 <
ffff8801f4df8a80 4078814094 C Ci:5:002:0 0 1 = fb
ffff8801f4df8a80 4078815719 S Ci:5:002:0 s 80 06 b504 ff03 0001 1 <
ffff8801f4df8a80 4078816095 C Ci:5:002:0 0 1 = fb
ffff8801f4df8a80 4078817764 S Ci:5:002:0 s 80 06 b504 ff04 0001 1 <
ffff8801f4df8a80 4078818095 C Ci:5:002:0 0 1 = fb
ffff8801f4df8a80 4078819672 S Ci:5:002:0 s 80 06 b504 ff05 0001 1 <
ffff8801f4df8a80 4078820095 C Ci:5:002:0 0 1 = fb
ffff8801f4df8a80 4078821686 S Ci:5:002:0 s 80 06 b504 ff06 0001 1 <
ffff8801f4df8a80 4078822094 C Ci:5:002:0 0 1 = fb
ffff8801f4df8a80 4078823701 S Ci:5:002:0 s 80 06 b504 ff07 0001 1 <
ffff8801f4df8a80 4078824094 C Ci:5:002:0 0 1 = fb
ffff88014b457e40 4078825720 S Ci:5:002:0 s 80 06 b504 ff08 0001 1 <
ffff88014b457e40 4078826095 C Ci:5:002:0 0 1 = fb
ffff88014b457e40 4078827732 S Ci:5:002:0 s 80 06 b504 ff09 0001 1 <
ffff88014b457e40 4078828094 C Ci:5:002:0 0 1 = fb
ffff88014b457e40 4078829673 S Ci:5:002:0 s 80 06 b504 ff0a 0001 1 <
ffff88014b457e40 4078830094 C Ci:5:002:0 0 1 = fb
ffff88014b457e40 4078831685 S Ci:5:002:0 s 80 06 b504 ff0b 0001 1 <
ffff88014b457e40 4078832095 C Ci:5:002:0 0 1 = fb
ffff88014b457e40 4078833701 S Ci:5:002:0 s 80 06 b504 fe0c 0001 1 <
ffff88014b457e40 4078834095 C Ci:5:002:0 0 1 = fb
ffff88014b457e40 4078835764 S Ci:5:002:0 s 80 06 b504 2b0d 0001 1 <
ffff88014b457e40 4078836095 C Ci:5:002:0 0 1 = fb
ffff88014b457e40 4078837732 S Ci:5:002:0 s 80 06 b504 fe0e 0001 1 <
ffff88014b457e40 4078838094 C Ci:5:002:0 0 1 = fb
ffff88014b457e40 4078839673 S Ci:5:002:0 s 80 06 b504 2b0f 0001 1 <
ffff88014b457e40 4078840095 C Ci:5:002:0 0 1 = fb
ffff88014b457e40 4078841689 S Ci:5:002:0 s 80 06 b504 fe10 0001 1 <
ffff88014b457e40 4078842095 C Ci:5:002:0 0 1 = fb
ffff88014b457e40 4078843701 S Ci:5:002:0 s 80 06 b504 2b11 0001 1 <
ffff88014b457e40 4078844095 C Ci:5:002:0 0 1 = fb
ffff88014b457e40 4078845716 S Ci:5:002:0 s 80 06 b504 fe12 0001 1 <
ffff88014b457e40 4078846095 C Ci:5:002:0 0 1 = fb
ffff88014b457e40 4078847731 S Ci:5:002:0 s 80 06 b504 2b13 0001 1 <
ffff88014b457e40 4078848095 C Ci:5:002:0 0 1 = fb
ffff8801f4df8a80 4078849677 S Ci:5:002:0 s 80 06 b504 fe14 0001 1 <
ffff8801f4df8a80 4078850097 C Ci:5:002:0 0 1 = fb
ffff8801f4df8a80 4078851686 S Ci:5:002:0 s 80 06 b504 2b15 0001 1 <
ffff8801f4df8a80 4078852095 C Ci:5:002:0 0 1 = fb
ffff8801f4df8a80 4078853701 S Ci:5:002:0 s 80 06 b504 fe16 0001 1 <
ffff8801f4df8a80 4078854095 C Ci:5:002:0 0 1 = fb
ffff8801f4df8a80 4078855717 S Ci:5:002:0 s 80 06 b504 2b17 0001 1 <
ffff8801f4df8a80 4078856096 C Ci:5:002:0 0 1 = fb
ffff8801f4df8a80 4078857733 S Ci:5:002:0 s 80 06 b504 fe18 0001 1 <
ffff8801f4df8a80 4078858096 C Ci:5:002:0 0 1 = fb
ffff8801f4df8a80 4078859673 S Ci:5:002:0 s 80 06 b504 2b19 0001 1 <
ffff8801f4df8a80 4078860097 C Ci:5:002:0 0 1 = fb
ffff8801f4df8a80 4078861688 S Ci:5:002:0 s 80 06 b504 fe1a 0001 1 <
ffff8801f4df8a80 4078862096 C Ci:5:002:0 0 1 = fb
ffff8801f4df8a80 4078863702 S Ci:5:002:0 s 80 06 b504 2b1b 0001 1 <
ffff8801f4df8a80 4078864096 C Ci:5:002:0 0 1 = fb
ffff8801f4df8a80 4078865717 S Ci:5:002:0 s 80 06 b504 fe1c 0001 1 <
ffff8801f4df8a80 4078866097 C Ci:5:002:0 0 1 = fb
ffff8801f4df8a80 4078867733 S Ci:5:002:0 s 80 06 b504 2b1d 0001 1 <
ffff8801f4df8a80 4078868095 C Ci:5:002:0 0 1 = fb
ffff8801f4df8a80 4078869673 S Ci:5:002:0 s 80 06 b504 fe1e 0001 1 <
ffff8801f4df8a80 4078870096 C Ci:5:002:0 0 1 = fb
ffff8801f4df8a80 4078871685 S Ci:5:002:0 s 80 06 b504 2b1f 0001 1 <
ffff8801f4df8a80 4078872096 C Ci:5:002:0 0 1 = fb
ffff8801f4df8a80 4078873715 S Ci:5:002:0 s 80 06 b504 fc20 0001 1 <
ffff8801f4df8a80 4078874098 C Ci:5:002:0 0 1 = fb
ffff8801f4df8a80 4078875719 S Ci:5:002:0 s 80 06 b504 2b21 0001 1 <
ffff8801f4df8a80 4078876097 C Ci:5:002:0 0 1 = fb
ffff8801f4df8a80 4078877734 S Ci:5:002:0 s 80 06 b504 fb22 0001 1 <
ffff8801f4df8a80 4078878096 C Ci:5:002:0 0 1 = fb
ffff8801f4df8a80 4078879673 S Ci:5:002:0 s 80 06 b504 2b23 0001 1 <
ffff8801f4df8a80 4078880097 C Ci:5:002:0 0 1 = fb
ffff8801f4df8a80 4078881686 S Ci:5:002:0 s 80 06 b504 fc24 0001 1 <
ffff8801f4df8a80 4078882097 C Ci:5:002:0 0 1 = fb
ffff8801f4df8a80 4078883702 S Ci:5:002:0 s 80 06 b504 2b25 0001 1 <
ffff8801f4df8a80 4078884096 C Ci:5:002:0 0 1 = fb
ffff8801f4df8a80 4078885717 S Ci:5:002:0 s 80 06 b504 fb26 0001 1 <
ffff8801f4df8a80 4078886096 C Ci:5:002:0 0 1 = fb
ffff8801f4df8a80 4078887732 S Ci:5:002:0 s 80 06 b504 2b27 0001 1 <
ffff8801f4df8a80 4078888096 C Ci:5:002:0 0 1 = fb
ffff8801f4df8a80 4078889672 S Ci:5:002:0 s 80 06 b504 fc28 0001 1 <
ffff8801f4df8a80 4078890097 C Ci:5:002:0 0 1 = fb
ffff8801f4df8a80 4078891685 S Ci:5:002:0 s 80 06 b504 2b29 0001 1 <
ffff8801f4df8a80 4078892097 C Ci:5:002:0 0 1 = fb
ffff8801f4df8a80 4078893700 S Ci:5:002:0 s 80 06 b504 fb2a 0001 1 <
ffff8801f4df8a80 4078894097 C Ci:5:002:0 0 1 = fb
ffff8801f4df8a80 4078895715 S Ci:5:002:0 s 80 06 b504 2b2b 0001 1 <
ffff8801f4df8a80 4078896098 C Ci:5:002:0 0 1 = fb
ffff8801f4df8a80 4078897731 S Ci:5:002:0 s 80 06 b504 fc2c 0001 1 <
ffff8801f4df8a80 4078898097 C Ci:5:002:0 0 1 = fb
ffff8801f4df8a80 4078899673 S Ci:5:002:0 s 80 06 b504 2b2d 0001 1 <
ffff8801f4df8a80 4078900097 C Ci:5:002:0 0 1 = fb
ffff8801f4df8a80 4078901685 S Ci:5:002:0 s 80 06 b504 fb2e 0001 1 <
ffff8801f4df8a80 4078902097 C Ci:5:002:0 0 1 = fb
ffff8801f4df8a80 4078903701 S Ci:5:002:0 s 80 06 b504 2b2f 0001 1 <
ffff8801f4df8a80 4078904097 C Ci:5:002:0 0 1 = fb
ffff8801f4df8a80 4078905716 S Ci:5:002:0 s 80 06 b504 fc30 0001 1 <
ffff8801f4df8a80 4078906097 C Ci:5:002:0 0 1 = fb
ffff8801f4df8a80 4078907732 S Ci:5:002:0 s 80 06 b504 2b31 0001 1 <
ffff8801f4df8a80 4078908097 C Ci:5:002:0 0 1 = fb
ffff8801f4df8a80 4078909673 S Ci:5:002:0 s 80 06 b504 fb32 0001 1 <
ffff8801f4df8a80 4078910097 C Ci:5:002:0 0 1 = fb
ffff8801f4df8a80 4078911685 S Ci:5:002:0 s 80 06 b504 2b33 0001 1 <
ffff8801f4df8a80 4078912098 C Ci:5:002:0 0 1 = fb
ffff8801f4df8a80 4078913701 S Ci:5:002:0 s 80 06 b504 ff34 0001 1 <
ffff8801f4df8a80 4078914097 C Ci:5:002:0 0 1 = fb
ffff8801f4df8a80 4078915717 S Ci:5:002:0 s 80 06 b504 ff35 0001 1 <
ffff8801f4df8a80 4078916097 C Ci:5:002:0 0 1 = fb
ffff8801f4df8a80 4078917732 S Ci:5:002:0 s 80 06 b504 ff36 0001 1 <
ffff8801f4df8a80 4078918097 C Ci:5:002:0 0 1 = fb
ffff8801f4df8a80 4078919673 S Ci:5:002:0 s 80 06 b504 ff37 0001 1 <
ffff8801f4df8a80 4078920098 C Ci:5:002:0 0 1 = fb
ffff8801f4df8a80 4078921685 S Ci:5:002:0 s 80 06 b504 ff38 0001 1 <
ffff8801f4df8a80 4078922098 C Ci:5:002:0 0 1 = fb
ffff8801f4df8a80 4078923701 S Ci:5:002:0 s 80 06 b504 ff39 0001 1 <
ffff8801f4df8a80 4078924098 C Ci:5:002:0 0 1 = fb
ffff8801f4df8a80 4078925717 S Ci:5:002:0 s 80 06 b504 ff3a 0001 1 <
ffff8801f4df8a80 4078926098 C Ci:5:002:0 0 1 = fb
ffff8801f4df8a80 4078927732 S Ci:5:002:0 s 80 06 b504 ff3b 0001 1 <
ffff8801f4df8a80 4078928098 C Ci:5:002:0 0 1 = fb
ffff8801f4df8a80 4078929673 S Ci:5:002:0 s 80 06 b504 ff3c 0001 1 <
ffff8801f4df8a80 4078930098 C Ci:5:002:0 0 1 = fb
ffff8801f4df8a80 4078931685 S Ci:5:002:0 s 80 06 b504 ff3d 0001 1 <
ffff8801f4df8a80 4078932098 C Ci:5:002:0 0 1 = fb
ffff8801f4df8a80 4078933701 S Ci:5:002:0 s 80 06 b504 ff3e 0001 1 <
ffff8801f4df8a80 4078934098 C Ci:5:002:0 0 1 = fb
ffff8801f4df8a80 4078935716 S Ci:5:002:0 s 80 06 b504 ff3f 0001 1 <
ffff8801f4df8a80 4078936098 C Ci:5:002:0 0 1 = fb
ffff8801f4df8a80 4078937733 S Ci:5:002:0 s 80 06 b500 9a20 0001 1 <
ffff8801f4df8a80 4078939098 C Ci:5:002:0 0 1 = fb
ffff8801f4df8a80 4078941129 S Ci:5:002:0 s 80 06 b501 1a20 0002 2 <
ffff8801f4df8a80 4078942100 C Ci:5:002:0 0 2 = 0000
ffff8801f4df8a80 4078943701 S Ci:5:002:0 s 80 06 b501 1a21 0002 2 <
ffff8801f4df8a80 4078944098 C Ci:5:002:0 0 2 = ffff
ffff8801f4df8a80 4078945717 S Ci:5:002:0 s 80 06 b501 1a22 0002 2 <
ffff8801f4df8a80 4078946098 C Ci:5:002:0 0 2 = ffff
ffff8801f4df8a80 4078947740 S Ci:5:002:0 s 80 06 b501 1a23 0002 2 <
ffff8801f4df8a80 4078948099 C Ci:5:002:0 0 2 = ffff
ffff88014b457e40 4078949677 S Ci:5:002:0 s 80 06 b501 1a24 0002 2 <
ffff88014b457e40 4078950100 C Ci:5:002:0 0 2 = ffff
ffff88014b457e40 4078951688 S Ci:5:002:0 s 80 06 b501 1a25 0002 2 <
ffff88014b457e40 4078952099 C Ci:5:002:0 0 2 = ffff
ffff88014b457e40 4078953702 S Ci:5:002:0 s 80 06 b501 1a26 0002 2 <
ffff88014b457e40 4078954099 C Ci:5:002:0 0 2 = fe2b
ffff88014b457e40 4078955717 S Ci:5:002:0 s 80 06 b501 1a27 0002 2 <
ffff88014b457e40 4078956099 C Ci:5:002:0 0 2 = fe2b
ffff8801f4df8a80 4078957739 S Ci:5:002:0 s 80 06 b501 1a28 0002 2 <
ffff8801f4df8a80 4078958099 C Ci:5:002:0 0 2 = fe2b
ffff8801f4df8a80 4078959674 S Ci:5:002:0 s 80 06 b501 1a29 0002 2 <
ffff8801f4df8a80 4078960099 C Ci:5:002:0 0 2 = fe2b
ffff8801f4df8a80 4078961686 S Ci:5:002:0 s 80 06 b501 1a2a 0002 2 <
ffff8801f4df8a80 4078962099 C Ci:5:002:0 0 2 = fe2b
ffff8801f4df8a80 4078963701 S Ci:5:002:0 s 80 06 b501 1a2b 0002 2 <
ffff8801f4df8a80 4078964099 C Ci:5:002:0 0 2 = fe2b
ffff8801f4df8a80 4078965718 S Ci:5:002:0 s 80 06 b501 1a2c 0002 2 <
ffff8801f4df8a80 4078966099 C Ci:5:002:0 0 2 = fe2b
ffff8801f4df8a80 4078967733 S Ci:5:002:0 s 80 06 b501 1a2d 0002 2 <
ffff8801f4df8a80 4078968099 C Ci:5:002:0 0 2 = fe2b
ffff8801f4df8a80 4078969668 S Ci:5:002:0 s 80 06 b501 1a2e 0002 2 <
ffff8801f4df8a80 4078970099 C Ci:5:002:0 0 2 = fe2b
ffff8801f4df8a80 4078971685 S Ci:5:002:0 s 80 06 b501 1a2f 0002 2 <
ffff8801f4df8a80 4078972100 C Ci:5:002:0 0 2 = fe2b
ffff8801f4df8a80 4078973701 S Ci:5:002:0 s 80 06 b501 1a30 0002 2 <
ffff8801f4df8a80 4078974099 C Ci:5:002:0 0 2 = fc2b
ffff8801f4df8a80 4078975717 S Ci:5:002:0 s 80 06 b501 1a31 0002 2 <
ffff8801f4df8a80 4078976099 C Ci:5:002:0 0 2 = fb2b
ffff8801f4df8a80 4078977733 S Ci:5:002:0 s 80 06 b501 1a32 0002 2 <
ffff8801f4df8a80 4078978100 C Ci:5:002:0 0 2 = fc2b
ffff8801f4df8a80 4078979672 S Ci:5:002:0 s 80 06 b501 1a33 0002 2 <
ffff8801f4df8a80 4078980100 C Ci:5:002:0 0 2 = fb2b
ffff8801f4df8a80 4078981684 S Ci:5:002:0 s 80 06 b501 1a34 0002 2 <
ffff8801f4df8a80 4078982100 C Ci:5:002:0 0 2 = fc2b
ffff8801f4df8a80 4078983700 S Ci:5:002:0 s 80 06 b501 1a35 0002 2 <
ffff8801f4df8a80 4078984100 C Ci:5:002:0 0 2 = fb2b
ffff8801f4df8a80 4078985716 S Ci:5:002:0 s 80 06 b501 1a36 0002 2 <
ffff8801f4df8a80 4078986100 C Ci:5:002:0 0 2 = fc2b
ffff8801f4df8a80 4078987733 S Ci:5:002:0 s 80 06 b501 1a37 0002 2 <
ffff8801f4df8a80 4078988100 C Ci:5:002:0 0 2 = fb2b
ffff8801f4df8a80 4078989670 S Ci:5:002:0 s 80 06 b501 1a38 0002 2 <
ffff8801f4df8a80 4078990099 C Ci:5:002:0 0 2 = fc2b
ffff8801f4df8a80 4078991686 S Ci:5:002:0 s 80 06 b501 1a39 0002 2 <
ffff8801f4df8a80 4078992100 C Ci:5:002:0 0 2 = fb2b
ffff8801f4df8a80 4078993701 S Ci:5:002:0 s 80 06 b501 1a3a 0002 2 <
ffff8801f4df8a80 4078994100 C Ci:5:002:0 0 2 = ffff
ffff8801f4df8a80 4078995719 S Ci:5:002:0 s 80 06 b501 1a3b 0002 2 <
ffff8801f4df8a80 4078996100 C Ci:5:002:0 0 2 = ffff
ffff8801f4df8a80 4078997733 S Ci:5:002:0 s 80 06 b501 1a3c 0002 2 <
ffff8801f4df8a80 4078998100 C Ci:5:002:0 0 2 = ffff
ffff8801f4df8a80 4078999670 S Ci:5:002:0 s 80 06 b501 1a3d 0002 2 <
ffff8801f4df8a80 4079000100 C Ci:5:002:0 0 2 = ffff
ffff8801f4df8a80 4079001685 S Ci:5:002:0 s 80 06 b501 1a3e 0002 2 <
ffff8801f4df8a80 4079002101 C Ci:5:002:0 0 2 = ffff
ffff8801f4df8a80 4079003701 S Ci:5:002:0 s 80 06 b501 1a3f 0002 2 <
ffff8801f4df8a80 4079004100 C Ci:5:002:0 0 2 = ffff
ffff8801f4df8a80 4079005716 S Ci:5:002:0 s 80 06 b504 0000 0001 1 <
ffff8801f4df8a80 4079006100 C Ci:5:002:0 0 1 = fb
ffff8801f4df8a80 4079007737 S Ci:5:002:0 s 80 06 b504 5001 0001 1 <
ffff8801f4df8a80 4079008101 C Ci:5:002:0 0 1 = fb
ffff8801f4df8a80 4079009671 S Ci:5:002:0 s 80 06 b504 4d02 0001 1 <
ffff8801f4df8a80 4079010101 C Ci:5:002:0 0 1 = fb
ffff8801f4df8a80 4079011685 S Ci:5:002:0 s 80 06 b504 cd03 0001 1 <
ffff8801f4df8a80 4079012101 C Ci:5:002:0 0 1 = fb
ffff8801f4df8a80 4079013701 S Ci:5:002:0 s 80 06 b504 8904 0001 1 <
ffff8801f4df8a80 4079014101 C Ci:5:002:0 0 1 = fb
ffff8801f4df8a80 4079015716 S Ci:5:002:0 s 80 06 b504 cc05 0001 1 <
ffff8801f4df8a80 4079016101 C Ci:5:002:0 0 1 = fb
ffff8801f4df8a80 4079017735 S Ci:5:002:0 s 80 06 b504 8d06 0001 1 <
ffff8801f4df8a80 4079018101 C Ci:5:002:0 0 1 = fb
ffff8801f4df8a80 4079019671 S Ci:5:002:0 s 80 06 b504 cd07 0001 1 <
ffff8801f4df8a80 4079020101 C Ci:5:002:0 0 1 = fb
ffff8801f4df8a80 4079021685 S Ci:5:002:0 s 80 06 b504 ce08 0001 1 <
ffff8801f4df8a80 4079022101 C Ci:5:002:0 0 1 = fb
ffff8801f4df8a80 4079023701 S Ci:5:002:0 s 80 06 b504 ce09 0001 1 <
ffff8801f4df8a80 4079024101 C Ci:5:002:0 0 1 = fb
ffff8801f4df8a80 4079025715 S Ci:5:002:0 s 80 06 b504 d10a 0001 1 <
ffff8801f4df8a80 4079026101 C Ci:5:002:0 0 1 = fb
ffff8801f4df8a80 4079027735 S Ci:5:002:0 s 80 06 b504 d20b 0001 1 <
ffff8801f4df8a80 4079028101 C Ci:5:002:0 0 1 = fb
ffff8801f4df8a80 4079029671 S Ci:5:002:0 s 80 06 b504 d80c 0001 1 <
ffff8801f4df8a80 4079030101 C Ci:5:002:0 0 1 = fb
ffff8801f4df8a80 4079031685 S Ci:5:002:0 s 80 06 b504 d80d 0001 1 <
ffff8801f4df8a80 4079032102 C Ci:5:002:0 0 1 = fb
ffff8801f4df8a80 4079033701 S Ci:5:002:0 s 80 06 b504 a00e 0001 1 <
ffff8801f4df8a80 4079034101 C Ci:5:002:0 0 1 = fb
ffff8801f4df8a80 4079035716 S Ci:5:002:0 s 80 06 b504 000f 0001 1 <
ffff8801f4df8a80 4079036101 C Ci:5:002:0 0 1 = fb
ffff88014b457e40 4079037739 S Ci:5:002:0 s 80 06 b504 a110 0001 1 <
ffff88014b457e40 4079038102 C Ci:5:002:0 0 1 = fb
ffff88014b457e40 4079039670 S Ci:5:002:0 s 80 06 b504 0011 0001 1 <
ffff88014b457e40 4079040101 C Ci:5:002:0 0 1 = fb
ffff88014b457e40 4079041686 S Ci:5:002:0 s 80 06 b504 a212 0001 1 <
ffff88014b457e40 4079042101 C Ci:5:002:0 0 1 = fb
ffff88014b457e40 4079043701 S Ci:5:002:0 s 80 06 b504 0013 0001 1 <
ffff88014b457e40 4079044101 C Ci:5:002:0 0 1 = fb
ffff88014b457e40 4079045716 S Ci:5:002:0 s 80 06 b504 a314 0001 1 <
ffff88014b457e40 4079046102 C Ci:5:002:0 0 1 = fb
ffff88014b457e40 4079047734 S Ci:5:002:0 s 80 06 b504 0015 0001 1 <
ffff88014b457e40 4079048103 C Ci:5:002:0 0 1 = fb
ffff88014b457e40 4079049670 S Ci:5:002:0 s 80 06 b504 a416 0001 1 <
ffff88014b457e40 4079050101 C Ci:5:002:0 0 1 = fb
ffff88014b457d80 4079051693 S Ci:5:002:0 s 80 06 b504 0017 0001 1 <
ffff88014b457d80 4079052103 C Ci:5:002:0 0 1 = fb
ffff88014b457d80 4079053701 S Ci:5:002:0 s 80 06 b504 a518 0001 1 <
ffff88014b457d80 4079054102 C Ci:5:002:0 0 1 = fb
ffff88014b457d80 4079055716 S Ci:5:002:0 s 80 06 b504 4819 0001 1 <
ffff88014b457d80 4079056102 C Ci:5:002:0 0 1 = fb
ffff88014b457d80 4079057735 S Ci:5:002:0 s 80 06 b504 ff1a 0001 1 <
ffff88014b457d80 4079058103 C Ci:5:002:0 0 1 = fb
ffff88014b457d80 4079059670 S Ci:5:002:0 s 80 06 b504 ff1b 0001 1 <
ffff88014b457d80 4079060102 C Ci:5:002:0 0 1 = fb
ffff88014b457d80 4079061685 S Ci:5:002:0 s 80 06 b504 ff1c 0001 1 <
ffff88014b457d80 4079062103 C Ci:5:002:0 0 1 = fb
ffff88014b457d80 4079063702 S Ci:5:002:0 s 80 06 b504 ff1d 0001 1 <
ffff88014b457d80 4079064102 C Ci:5:002:0 0 1 = fb
ffff88014b457d80 4079065716 S Ci:5:002:0 s 80 06 b504 ff1e 0001 1 <
ffff88014b457d80 4079066102 C Ci:5:002:0 0 1 = fb
ffff88014b457d80 4079067899 S Ci:5:002:0 s 80 06 b504 ff1f 0001 1 <
ffff88014b457d80 4079068103 C Ci:5:002:0 0 1 = fb
ffff88014b457d80 4079069671 S Ci:5:002:0 s 80 06 b504 fe20 0001 1 <
ffff88014b457d80 4079070103 C Ci:5:002:0 0 1 = fb
ffff88014b457d80 4079071685 S Ci:5:002:0 s 80 06 b504 2b21 0001 1 <
ffff88014b457d80 4079072102 C Ci:5:002:0 0 1 = fb
ffff88014b457d80 4079073701 S Ci:5:002:0 s 80 06 b504 fe22 0001 1 <
ffff88014b457d80 4079074102 C Ci:5:002:0 0 1 = fb
ffff88014b457d80 4079075716 S Ci:5:002:0 s 80 06 b504 2b23 0001 1 <
ffff88014b457d80 4079076103 C Ci:5:002:0 0 1 = fb
ffff88014b457d80 4079077744 S Ci:5:002:0 s 80 06 b504 0224 0001 1 <
ffff88014b457d80 4079078102 C Ci:5:002:0 0 1 = fb
ffff88014b457d80 4079080679 S Ci:5:002:0 s 80 06 b504 2525 0001 1 <
ffff88014b457d80 4079081103 C Ci:5:002:0 0 1 = fb
ffff88014b457d80 4079082693 S Ci:5:002:0 s 80 06 b504 0226 0001 1 <
ffff88014b457d80 4079083103 C Ci:5:002:0 0 1 = fb
ffff88014b457d80 4079084709 S Ci:5:002:0 s 80 06 b504 2427 0001 1 <
ffff88014b457d80 4079085103 C Ci:5:002:0 0 1 = fb
ffff88014b457d80 4079086724 S Ci:5:002:0 s 80 06 b504 0428 0001 1 <
ffff88014b457d80 4079087103 C Ci:5:002:0 0 1 = fb
ffff88014b457d80 4079088740 S Ci:5:002:0 s 80 06 b504 2529 0001 1 <
ffff88014b457d80 4079089104 C Ci:5:002:0 0 1 = fb
ffff88014b457d80 4079090677 S Ci:5:002:0 s 80 06 b504 042a 0001 1 <
ffff88014b457d80 4079091103 C Ci:5:002:0 0 1 = fb
ffff88014b457d80 4079092693 S Ci:5:002:0 s 80 06 b504 242b 0001 1 <
ffff88014b457d80 4079093103 C Ci:5:002:0 0 1 = fb
ffff88014b457d80 4079094708 S Ci:5:002:0 s 80 06 b504 082c 0001 1 <
ffff88014b457d80 4079095103 C Ci:5:002:0 0 1 = fb
ffff88014b457d80 4079096726 S Ci:5:002:0 s 80 06 b504 252d 0001 1 <
ffff88014b457d80 4079097104 C Ci:5:002:0 0 1 = fb
ffff88014b457d80 4079098738 S Ci:5:002:0 s 80 06 b504 082e 0001 1 <
ffff88014b457d80 4079099104 C Ci:5:002:0 0 1 = fb
ffff88014b457d80 4079100677 S Ci:5:002:0 s 80 06 b504 242f 0001 1 <
ffff88014b457d80 4079101103 C Ci:5:002:0 0 1 = fb
ffff88014b457d80 4079102693 S Ci:5:002:0 s 80 06 b504 1030 0001 1 <
ffff88014b457d80 4079103103 C Ci:5:002:0 0 1 = fb
ffff88014b457d80 4079104709 S Ci:5:002:0 s 80 06 b504 2531 0001 1 <
ffff88014b457d80 4079105104 C Ci:5:002:0 0 1 = fb
ffff88014b457d80 4079106724 S Ci:5:002:0 s 80 06 b504 1032 0001 1 <
ffff88014b457d80 4079107103 C Ci:5:002:0 0 1 = fb
ffff88014b457d80 4079108739 S Ci:5:002:0 s 80 06 b504 2433 0001 1 <
ffff88014b457d80 4079109104 C Ci:5:002:0 0 1 = fb
ffff88014b457d80 4079110677 S Ci:5:002:0 s 80 06 b504 f634 0001 1 <
ffff88014b457d80 4079111103 C Ci:5:002:0 0 1 = fb
ffff88014b457d80 4079112694 S Ci:5:002:0 s 80 06 b504 2b35 0001 1 <
ffff88014b457d80 4079113103 C Ci:5:002:0 0 1 = fb
ffff88014b457d80 4079114709 S Ci:5:002:0 s 80 06 b504 fe36 0001 1 <
ffff88014b457d80 4079115104 C Ci:5:002:0 0 1 = fb
ffff88014b457d80 4079116725 S Ci:5:002:0 s 80 06 b504 2b37 0001 1 <
ffff88014b457d80 4079117104 C Ci:5:002:0 0 1 = fb
ffff88014b457d80 4079118740 S Ci:5:002:0 s 80 06 b504 f038 0001 1 <
ffff88014b457d80 4079119105 C Ci:5:002:0 0 1 = fb
ffff88014b457d80 4079120677 S Ci:5:002:0 s 80 06 b504 e039 0001 1 <
ffff88014b457d80 4079121104 C Ci:5:002:0 0 1 = fb
ffff88014b457d80 4079122693 S Ci:5:002:0 s 80 06 b504 fe3a 0001 1 <
ffff88014b457d80 4079123104 C Ci:5:002:0 0 1 = fb
ffff88014b457d80 4079124708 S Ci:5:002:0 s 80 06 b504 2b3b 0001 1 <
ffff88014b457d80 4079125104 C Ci:5:002:0 0 1 = fb
ffff88014b457e40 4079126727 S Ci:5:002:0 s 80 06 b504 fe3c 0001 1 <
ffff88014b457e40 4079127104 C Ci:5:002:0 0 1 = fb
ffff88014b457e40 4079128740 S Ci:5:002:0 s 80 06 b504 2b3d 0001 1 <
ffff88014b457e40 4079129105 C Ci:5:002:0 0 1 = fb
ffff88014b457e40 4079130677 S Ci:5:002:0 s 80 06 b504 fe3e 0001 1 <
ffff88014b457e40 4079131104 C Ci:5:002:0 0 1 = fb
ffff8801f4df8a80 4079132698 S Ci:5:002:0 s 80 06 b504 2b3f 0001 1 <
ffff8801f4df8a80 4079133105 C Ci:5:002:0 0 1 = fb
ffff8801f4df8a80 4079134710 S Ci:5:002:0 s 80 06 b500 9a40 0001 1 <
ffff8801f4df8a80 4079136105 C Ci:5:002:0 0 1 = fb
ffff8801f4df8a80 4079138068 S Ci:5:002:0 s 80 06 b501 1a40 0002 2 <
ffff8801f4df8a80 4079139105 C Ci:5:002:0 0 2 = 0050
ffff8801f4df8a80 4079140677 S Ci:5:002:0 s 80 06 b501 1a41 0002 2 <
ffff8801f4df8a80 4079141105 C Ci:5:002:0 0 2 = 4dcd
ffff8801f4df80c0 4079142696 S Ci:5:002:0 s 80 06 b501 1a42 0002 2 <
ffff8801f4df80c0 4079143105 C Ci:5:002:0 0 2 = 89cc
ffff8801f4df80c0 4079144709 S Ci:5:002:0 s 80 06 b501 1a43 0002 2 <
ffff8801f4df80c0 4079145105 C Ci:5:002:0 0 2 = 8dcd
ffff8801f4df80c0 4079146724 S Ci:5:002:0 s 80 06 b501 1a44 0002 2 <
ffff8801f4df80c0 4079147106 C Ci:5:002:0 0 2 = cece
ffff8801f4df80c0 4079148741 S Ci:5:002:0 s 80 06 b501 1a45 0002 2 <
ffff8801f4df80c0 4079149106 C Ci:5:002:0 0 2 = d1d2
ffff8801f4df80c0 4079151507 S Ci:5:002:0 s 80 06 b501 1a46 0002 2 <
ffff8801f4df80c0 4079152107 C Ci:5:002:0 0 2 = d8d8
ffff8801f4df80c0 4079153702 S Ci:5:002:0 s 80 06 b501 1a47 0002 2 <
ffff8801f4df80c0 4079154105 C Ci:5:002:0 0 2 = a000
ffff8801f4df80c0 4079155716 S Ci:5:002:0 s 80 06 b501 1a48 0002 2 <
ffff8801f4df80c0 4079156105 C Ci:5:002:0 0 2 = a100
ffff8801f4df80c0 4079157845 S Ci:5:002:0 s 80 06 b501 1a49 0002 2 <
ffff8801f4df80c0 4079158106 C Ci:5:002:0 0 2 = a200
ffff8801f4df80c0 4079159671 S Ci:5:002:0 s 80 06 b501 1a4a 0002 2 <
ffff8801f4df80c0 4079160106 C Ci:5:002:0 0 2 = a300
ffff8801f4df80c0 4079161685 S Ci:5:002:0 s 80 06 b501 1a4b 0002 2 <
ffff8801f4df80c0 4079162105 C Ci:5:002:0 0 2 = a400
ffff8801f4df80c0 4079163701 S Ci:5:002:0 s 80 06 b501 1a4c 0002 2 <
ffff8801f4df80c0 4079164105 C Ci:5:002:0 0 2 = a548
ffff8801f4df80c0 4079165716 S Ci:5:002:0 s 80 06 b501 1a4d 0002 2 <
ffff8801f4df80c0 4079166106 C Ci:5:002:0 0 2 = ffff
ffff8801f4df80c0 4079167743 S Ci:5:002:0 s 80 06 b501 1a4e 0002 2 <
ffff8801f4df80c0 4079168106 C Ci:5:002:0 0 2 = ffff
ffff8801f4df80c0 4079169670 S Ci:5:002:0 s 80 06 b501 1a4f 0002 2 <
ffff8801f4df80c0 4079170106 C Ci:5:002:0 0 2 = ffff
ffff8801f4df80c0 4079171685 S Ci:5:002:0 s 80 06 b501 1a50 0002 2 <
ffff8801f4df80c0 4079172105 C Ci:5:002:0 0 2 = fe2b
ffff8801f4df80c0 4079173702 S Ci:5:002:0 s 80 06 b501 1a51 0002 2 <
ffff8801f4df80c0 4079174105 C Ci:5:002:0 0 2 = fe2b
ffff8801f4df80c0 4079175721 S Ci:5:002:0 s 80 06 b501 1a52 0002 2 <
ffff8801f4df80c0 4079176106 C Ci:5:002:0 0 2 = 0225
ffff8801f4df80c0 4079177760 S Ci:5:002:0 s 80 06 b501 1a53 0002 2 <
ffff8801f4df80c0 4079178106 C Ci:5:002:0 0 2 = 0224
ffff8801f4df80c0 4079179670 S Ci:5:002:0 s 80 06 b501 1a54 0002 2 <
ffff8801f4df80c0 4079180107 C Ci:5:002:0 0 2 = 0425
ffff8801f4df80c0 4079181685 S Ci:5:002:0 s 80 06 b501 1a55 0002 2 <
ffff8801f4df80c0 4079182106 C Ci:5:002:0 0 2 = 0424
ffff8801f4df80c0 4079183701 S Ci:5:002:0 s 80 06 b501 1a56 0002 2 <
ffff8801f4df80c0 4079184106 C Ci:5:002:0 0 2 = 0825
ffff8801f4df80c0 4079185717 S Ci:5:002:0 s 80 06 b501 1a57 0002 2 <
ffff8801f4df80c0 4079186106 C Ci:5:002:0 0 2 = 0824
ffff8801f4df80c0 4079187802 S Ci:5:002:0 s 80 06 b501 1a58 0002 2 <
ffff8801f4df80c0 4079188106 C Ci:5:002:0 0 2 = 1025
ffff8801f4df80c0 4079189670 S Ci:5:002:0 s 80 06 b501 1a59 0002 2 <
ffff8801f4df80c0 4079190107 C Ci:5:002:0 0 2 = 1024
ffff8801f4df80c0 4079191684 S Ci:5:002:0 s 80 06 b501 1a5a 0002 2 <
ffff8801f4df80c0 4079192106 C Ci:5:002:0 0 2 = f62b
ffff8801f4df80c0 4079193701 S Ci:5:002:0 s 80 06 b501 1a5b 0002 2 <
ffff8801f4df80c0 4079194106 C Ci:5:002:0 0 2 = fe2b
ffff8801f4df80c0 4079195717 S Ci:5:002:0 s 80 06 b501 1a5c 0002 2 <
ffff8801f4df80c0 4079196107 C Ci:5:002:0 0 2 = f0e0
ffff8801f4df80c0 4079197731 S Ci:5:002:0 s 80 06 b501 1a5d 0002 2 <
ffff8801f4df80c0 4079198107 C Ci:5:002:0 0 2 = fe2b
ffff8801f4df80c0 4079199670 S Ci:5:002:0 s 80 06 b501 1a5e 0002 2 <
ffff8801f4df80c0 4079200107 C Ci:5:002:0 0 2 = fe2b
ffff8801f4df80c0 4079201685 S Ci:5:002:0 s 80 06 b501 1a5f 0002 2 <
ffff8801f4df80c0 4079202106 C Ci:5:002:0 0 2 = fe2b
ffff8801f4df80c0 4079203701 S Ci:5:002:0 s 80 06 b504 fe00 0001 1 <
ffff8801f4df80c0 4079204106 C Ci:5:002:0 0 1 = fb
ffff8801f4df80c0 4079205717 S Ci:5:002:0 s 80 06 b504 2b01 0001 1 <
ffff8801f4df80c0 4079206107 C Ci:5:002:0 0 1 = fb
ffff8801f4df80c0 4079207736 S Ci:5:002:0 s 80 06 b504 fe02 0001 1 <
ffff8801f4df80c0 4079208106 C Ci:5:002:0 0 1 = fb
ffff8801f4df80c0 4079209670 S Ci:5:002:0 s 80 06 b504 2b03 0001 1 <
ffff8801f4df80c0 4079210108 C Ci:5:002:0 0 1 = fb
ffff8801f4df80c0 4079211685 S Ci:5:002:0 s 80 06 b504 fe04 0001 1 <
ffff8801f4df80c0 4079212107 C Ci:5:002:0 0 1 = fb
ffff8801f4df80c0 4079213702 S Ci:5:002:0 s 80 06 b504 2b05 0001 1 <
ffff8801f4df80c0 4079214107 C Ci:5:002:0 0 1 = fb
ffff8801f4df80c0 4079215717 S Ci:5:002:0 s 80 06 b504 fe06 0001 1 <
ffff8801f4df80c0 4079216107 C Ci:5:002:0 0 1 = fb
ffff8801f4df80c0 4079218192 S Ci:5:002:0 s 80 06 b504 2b07 0001 1 <
ffff8801f4df80c0 4079219107 C Ci:5:002:0 0 1 = fb
ffff8801f4df80c0 4079220203 S Ci:5:002:0 s 80 06 b504 fe08 0001 1 <
ffff8801f4df80c0 4079221107 C Ci:5:002:0 0 1 = fb
ffff8801f4df80c0 4079222218 S Ci:5:002:0 s 80 06 b504 2b09 0001 1 <
ffff8801f4df80c0 4079223107 C Ci:5:002:0 0 1 = fb
ffff8801f4df80c0 4079224234 S Ci:5:002:0 s 80 06 b504 fe0a 0001 1 <
ffff8801f4df80c0 4079225107 C Ci:5:002:0 0 1 = fb
ffff8801f4df89c0 4079226254 S Ci:5:002:0 s 80 06 b504 2b0b 0001 1 <
ffff8801f4df89c0 4079227108 C Ci:5:002:0 0 1 = fb
ffff8801f4df89c0 4079228267 S Ci:5:002:0 s 80 06 b504 fe0c 0001 1 <
ffff8801f4df89c0 4079229109 C Ci:5:002:0 0 1 = fb
ffff8801f4df89c0 4079230203 S Ci:5:002:0 s 80 06 b504 2b0d 0001 1 <
ffff8801f4df89c0 4079231108 C Ci:5:002:0 0 1 = fb
ffff8801f4df89c0 4079232219 S Ci:5:002:0 s 80 06 b504 fe0e 0001 1 <
ffff8801f4df89c0 4079233108 C Ci:5:002:0 0 1 = fb
ffff8801f4df89c0 4079234234 S Ci:5:002:0 s 80 06 b504 2b0f 0001 1 <
ffff8801f4df89c0 4079235108 C Ci:5:002:0 0 1 = fb
ffff8801f4df89c0 4079236250 S Ci:5:002:0 s 80 06 b504 fe10 0001 1 <
ffff8801f4df89c0 4079237108 C Ci:5:002:0 0 1 = fb
ffff8801f4df89c0 4079238269 S Ci:5:002:0 s 80 06 b504 2b11 0001 1 <
ffff8801f4df89c0 4079239109 C Ci:5:002:0 0 1 = fb
ffff8801f4df89c0 4079240203 S Ci:5:002:0 s 80 06 b504 fe12 0001 1 <
ffff8801f4df89c0 4079241108 C Ci:5:002:0 0 1 = fb
ffff8801f4df89c0 4079242218 S Ci:5:002:0 s 80 06 b504 2b13 0001 1 <
ffff8801f4df89c0 4079243109 C Ci:5:002:0 0 1 = fb
ffff8801f4df89c0 4079244234 S Ci:5:002:0 s 80 06 b504 fe14 0001 1 <
ffff8801f4df89c0 4079245108 C Ci:5:002:0 0 1 = fb
ffff8801f4df89c0 4079246249 S Ci:5:002:0 s 80 06 b504 2b15 0001 1 <
ffff8801f4df89c0 4079247108 C Ci:5:002:0 0 1 = fb
ffff8801f4df89c0 4079248267 S Ci:5:002:0 s 80 06 b504 fe16 0001 1 <
ffff8801f4df89c0 4079249108 C Ci:5:002:0 0 1 = fb
ffff8801f4df89c0 4079250203 S Ci:5:002:0 s 80 06 b504 2b17 0001 1 <
ffff8801f4df89c0 4079251108 C Ci:5:002:0 0 1 = fb
ffff8801f4df80c0 4079252222 S Ci:5:002:0 s 80 06 b504 fe18 0001 1 <
ffff8801f4df80c0 4079253110 C Ci:5:002:0 0 1 = fb
ffff8801f4df80c0 4079254235 S Ci:5:002:0 s 80 06 b504 2b19 0001 1 <
ffff8801f4df80c0 4079255109 C Ci:5:002:0 0 1 = fb
ffff8801f4df80c0 4079256249 S Ci:5:002:0 s 80 06 b504 fe1a 0001 1 <
ffff8801f4df80c0 4079257109 C Ci:5:002:0 0 1 = fb
ffff8801f4df80c0 4079258269 S Ci:5:002:0 s 80 06 b504 2b1b 0001 1 <
ffff8801f4df80c0 4079259110 C Ci:5:002:0 0 1 = fb
ffff8801f4df80c0 4079260204 S Ci:5:002:0 s 80 06 b504 fe1c 0001 1 <
ffff8801f4df80c0 4079261109 C Ci:5:002:0 0 1 = fb
ffff8801f4df80c0 4079262219 S Ci:5:002:0 s 80 06 b504 2b1d 0001 1 <
ffff8801f4df80c0 4079263108 C Ci:5:002:0 0 1 = fb
ffff8801f4df80c0 4079264237 S Ci:5:002:0 s 80 06 b504 fe1e 0001 1 <
ffff8801f4df80c0 4079265109 C Ci:5:002:0 0 1 = fb
ffff8801f4df80c0 4079266249 S Ci:5:002:0 s 80 06 b504 2b1f 0001 1 <
ffff8801f4df80c0 4079267109 C Ci:5:002:0 0 1 = fb
ffff8801f4df80c0 4079268267 S Ci:5:002:0 s 80 06 b504 fe20 0001 1 <
ffff8801f4df80c0 4079269109 C Ci:5:002:0 0 1 = fb
ffff8801f4df80c0 4079270203 S Ci:5:002:0 s 80 06 b504 2b21 0001 1 <
ffff8801f4df80c0 4079271109 C Ci:5:002:0 0 1 = fb
ffff8801f4df80c0 4079272218 S Ci:5:002:0 s 80 06 b504 fe22 0001 1 <
ffff8801f4df80c0 4079273109 C Ci:5:002:0 0 1 = fb
ffff8801f4df80c0 4079274233 S Ci:5:002:0 s 80 06 b504 2b23 0001 1 <
ffff8801f4df80c0 4079275109 C Ci:5:002:0 0 1 = fb
ffff8801f4df80c0 4079276248 S Ci:5:002:0 s 80 06 b504 0224 0001 1 <
ffff8801f4df80c0 4079277109 C Ci:5:002:0 0 1 = fb
ffff8801f4df80c0 4079278267 S Ci:5:002:0 s 80 06 b504 2525 0001 1 <
ffff8801f4df80c0 4079279109 C Ci:5:002:0 0 1 = fb
ffff8801f4df80c0 4079280203 S Ci:5:002:0 s 80 06 b504 0226 0001 1 <
ffff8801f4df80c0 4079281109 C Ci:5:002:0 0 1 = fb
ffff8801f4df80c0 4079282218 S Ci:5:002:0 s 80 06 b504 2427 0001 1 <
ffff8801f4df80c0 4079283109 C Ci:5:002:0 0 1 = fb
ffff8801f4df80c0 4079284234 S Ci:5:002:0 s 80 06 b504 0428 0001 1 <
ffff8801f4df80c0 4079285109 C Ci:5:002:0 0 1 = fb
ffff8801f4df80c0 4079286248 S Ci:5:002:0 s 80 06 b504 2529 0001 1 <
ffff8801f4df80c0 4079287109 C Ci:5:002:0 0 1 = fb
ffff8801f4df80c0 4079288267 S Ci:5:002:0 s 80 06 b504 042a 0001 1 <
ffff8801f4df80c0 4079289110 C Ci:5:002:0 0 1 = fb
ffff8801f4df80c0 4079290205 S Ci:5:002:0 s 80 06 b504 242b 0001 1 <
ffff8801f4df80c0 4079291112 C Ci:5:002:0 0 1 = fb
ffff8801f4df80c0 4079292221 S Ci:5:002:0 s 80 06 b504 082c 0001 1 <
ffff8801f4df80c0 4079293109 C Ci:5:002:0 0 1 = fb
ffff8801f4df80c0 4079294234 S Ci:5:002:0 s 80 06 b504 252d 0001 1 <
ffff8801f4df80c0 4079295109 C Ci:5:002:0 0 1 = fb
ffff8801f4df80c0 4079296250 S Ci:5:002:0 s 80 06 b504 082e 0001 1 <
ffff8801f4df80c0 4079297110 C Ci:5:002:0 0 1 = fb
ffff8801f4df80c0 4079298268 S Ci:5:002:0 s 80 06 b504 242f 0001 1 <
ffff8801f4df80c0 4079299110 C Ci:5:002:0 0 1 = fb
ffff8801f4df80c0 4079300204 S Ci:5:002:0 s 80 06 b504 1030 0001 1 <
ffff8801f4df80c0 4079301110 C Ci:5:002:0 0 1 = fb
ffff8801f4df80c0 4079302220 S Ci:5:002:0 s 80 06 b504 2531 0001 1 <
ffff8801f4df80c0 4079303110 C Ci:5:002:0 0 1 = fb
ffff8801f4df80c0 4079304235 S Ci:5:002:0 s 80 06 b504 1032 0001 1 <
ffff8801f4df80c0 4079305110 C Ci:5:002:0 0 1 = fb
ffff8801f4df80c0 4079306251 S Ci:5:002:0 s 80 06 b504 2433 0001 1 <
ffff8801f4df80c0 4079307110 C Ci:5:002:0 0 1 = fb
ffff8801f4df80c0 4079308270 S Ci:5:002:0 s 80 06 b504 f634 0001 1 <
ffff8801f4df80c0 4079309110 C Ci:5:002:0 0 1 = fb
ffff8801f4df80c0 4079310203 S Ci:5:002:0 s 80 06 b504 2b35 0001 1 <
ffff8801f4df80c0 4079311111 C Ci:5:002:0 0 1 = fb
ffff8801f4df80c0 4079312219 S Ci:5:002:0 s 80 06 b504 fe36 0001 1 <
ffff8801f4df80c0 4079313111 C Ci:5:002:0 0 1 = fb
ffff8801f4df80c0 4079314234 S Ci:5:002:0 s 80 06 b504 2b37 0001 1 <
ffff8801f4df80c0 4079315110 C Ci:5:002:0 0 1 = fb
ffff8801f4df80c0 4079316250 S Ci:5:002:0 s 80 06 b504 f938 0001 1 <
ffff8801f4df80c0 4079317110 C Ci:5:002:0 0 1 = fb
ffff8801f4df80c0 4079318268 S Ci:5:002:0 s 80 06 b504 e039 0001 1 <
ffff8801f4df80c0 4079319111 C Ci:5:002:0 0 1 = fb
ffff8801f4df80c0 4079320202 S Ci:5:002:0 s 80 06 b504 fe3a 0001 1 <
ffff8801f4df80c0 4079321110 C Ci:5:002:0 0 1 = fb
ffff8801f4df80c0 4079322218 S Ci:5:002:0 s 80 06 b504 2b3b 0001 1 <
ffff8801f4df80c0 4079323110 C Ci:5:002:0 0 1 = fb
ffff8801f4df80c0 4079324233 S Ci:5:002:0 s 80 06 b504 fe3c 0001 1 <
ffff8801f4df80c0 4079325110 C Ci:5:002:0 0 1 = fb
ffff8801f4df80c0 4079327015 S Ci:5:002:0 s 80 06 b504 2b3d 0001 1 <
ffff8801f4df80c0 4079328110 C Ci:5:002:0 0 1 = fb
ffff8801f4df80c0 4079329195 S Ci:5:002:0 s 80 06 b504 fe3e 0001 1 <
ffff8801f4df80c0 4079330111 C Ci:5:002:0 0 1 = fb
ffff8801f4df80c0 4079331211 S Ci:5:002:0 s 80 06 b504 2b3f 0001 1 <
ffff8801f4df80c0 4079332111 C Ci:5:002:0 0 1 = fb
ffff8801f4df80c0 4079333226 S Ci:5:002:0 s 80 06 b500 9a60 0001 1 <
ffff8801f4df80c0 4079335110 C Ci:5:002:0 0 1 = fb
ffff8801f4df80c0 4079336745 S Ci:5:002:0 s 80 06 b501 1a60 0002 2 <
ffff8801f4df80c0 4079337111 C Ci:5:002:0 0 2 = fe2b
ffff8801f4df80c0 4079338203 S Ci:5:002:0 s 80 06 b501 1a61 0002 2 <
ffff8801f4df80c0 4079339110 C Ci:5:002:0 0 2 = fe2b
ffff8801f4df80c0 4079340204 S Ci:5:002:0 s 80 06 b501 1a62 0002 2 <
ffff8801f4df80c0 4079341111 C Ci:5:002:0 0 2 = fe2b
ffff8801f4df80c0 4079342219 S Ci:5:002:0 s 80 06 b501 1a63 0002 2 <
ffff8801f4df80c0 4079343111 C Ci:5:002:0 0 2 = fe2b
ffff8801f4df80c0 4079344235 S Ci:5:002:0 s 80 06 b501 1a64 0002 2 <
ffff8801f4df80c0 4079345112 C Ci:5:002:0 0 2 = fe2b
ffff8801f4df80c0 4079346253 S Ci:5:002:0 s 80 06 b501 1a65 0002 2 <
ffff8801f4df80c0 4079347114 C Ci:5:002:0 0 2 = fe2b
ffff8801f4df80c0 4079348269 S Ci:5:002:0 s 80 06 b501 1a66 0002 2 <
ffff8801f4df80c0 4079349112 C Ci:5:002:0 0 2 = fe2b
ffff8801f4df80c0 4079350203 S Ci:5:002:0 s 80 06 b501 1a67 0002 2 <
ffff8801f4df80c0 4079351112 C Ci:5:002:0 0 2 = fe2b
ffff8801f4df80c0 4079352219 S Ci:5:002:0 s 80 06 b501 1a68 0002 2 <
ffff8801f4df80c0 4079353112 C Ci:5:002:0 0 2 = fe2b
ffff8801f4df80c0 4079354239 S Ci:5:002:0 s 80 06 b501 1a69 0002 2 <
ffff8801f4df80c0 4079355112 C Ci:5:002:0 0 2 = fe2b
ffff8801f4df80c0 4079356253 S Ci:5:002:0 s 80 06 b501 1a6a 0002 2 <
ffff8801f4df80c0 4079357112 C Ci:5:002:0 0 2 = fe2b
ffff8801f4df80c0 4079358218 S Ci:5:002:0 s 80 06 b501 1a6b 0002 2 <
ffff8801f4df80c0 4079359112 C Ci:5:002:0 0 2 = fe2b
ffff8801f4df80c0 4079360203 S Ci:5:002:0 s 80 06 b501 1a6c 0002 2 <
ffff8801f4df80c0 4079361112 C Ci:5:002:0 0 2 = fe2b
ffff8801f4df80c0 4079362219 S Ci:5:002:0 s 80 06 b501 1a6d 0002 2 <
ffff8801f4df80c0 4079363112 C Ci:5:002:0 0 2 = fe2b
ffff8801f4df80c0 4079364234 S Ci:5:002:0 s 80 06 b501 1a6e 0002 2 <
ffff8801f4df80c0 4079365112 C Ci:5:002:0 0 2 = fe2b
ffff8801f4df80c0 4079366253 S Ci:5:002:0 s 80 06 b501 1a6f 0002 2 <
ffff8801f4df80c0 4079367112 C Ci:5:002:0 0 2 = fe2b
ffff8801f4df80c0 4079368269 S Ci:5:002:0 s 80 06 b501 1a70 0002 2 <
ffff8801f4df80c0 4079369112 C Ci:5:002:0 0 2 = fe2b
ffff8801f4df80c0 4079370203 S Ci:5:002:0 s 80 06 b501 1a71 0002 2 <
ffff8801f4df80c0 4079371114 C Ci:5:002:0 0 2 = fe2b
ffff8801f4df80c0 4079372218 S Ci:5:002:0 s 80 06 b501 1a72 0002 2 <
ffff8801f4df80c0 4079373112 C Ci:5:002:0 0 2 = 0225
ffff8801f4df80c0 4079374234 S Ci:5:002:0 s 80 06 b501 1a73 0002 2 <
ffff8801f4df80c0 4079375112 C Ci:5:002:0 0 2 = 0224
ffff8801f4df80c0 4079376253 S Ci:5:002:0 s 80 06 b501 1a74 0002 2 <
ffff8801f4df80c0 4079377113 C Ci:5:002:0 0 2 = 0425
ffff8801f4df80c0 4079378269 S Ci:5:002:0 s 80 06 b501 1a75 0002 2 <
ffff8801f4df80c0 4079379113 C Ci:5:002:0 0 2 = 0424
ffff8801f4df80c0 4079380203 S Ci:5:002:0 s 80 06 b501 1a76 0002 2 <
ffff8801f4df80c0 4079381113 C Ci:5:002:0 0 2 = 0825
ffff8801f4df80c0 4079382218 S Ci:5:002:0 s 80 06 b501 1a77 0002 2 <
ffff8801f4df80c0 4079383112 C Ci:5:002:0 0 2 = 0824
ffff8801f4df80c0 4079384233 S Ci:5:002:0 s 80 06 b501 1a78 0002 2 <
ffff8801f4df80c0 4079385112 C Ci:5:002:0 0 2 = 1025
ffff8801f4df80c0 4079386253 S Ci:5:002:0 s 80 06 b501 1a79 0002 2 <
ffff8801f4df80c0 4079387113 C Ci:5:002:0 0 2 = 1024
ffff8801f4df80c0 4079388192 S Ci:5:002:0 s 80 06 b501 1a7a 0002 2 <
ffff8801f4df80c0 4079389112 C Ci:5:002:0 0 2 = f62b
ffff8801f4df89c0 4079390210 S Ci:5:002:0 s 80 06 b501 1a7b 0002 2 <
ffff8801f4df89c0 4079391115 C Ci:5:002:0 0 2 = fe2b
ffff8801f4df89c0 4079392220 S Ci:5:002:0 s 80 06 b501 1a7c 0002 2 <
ffff8801f4df89c0 4079393113 C Ci:5:002:0 0 2 = f9e0
ffff8801f4df89c0 4079394234 S Ci:5:002:0 s 80 06 b501 1a7d 0002 2 <
ffff8801f4df89c0 4079395113 C Ci:5:002:0 0 2 = fe2b
ffff8801f4df89c0 4079396253 S Ci:5:002:0 s 80 06 b501 1a7e 0002 2 <
ffff8801f4df89c0 4079397113 C Ci:5:002:0 0 2 = fe2b
ffff8801f4df89c0 4079398192 S Ci:5:002:0 s 80 06 b501 1a7f 0002 2 <
ffff8801f4df89c0 4079399113 C Ci:5:002:0 0 2 = fe2b
ffff8801f4df89c0 4079400204 S Ci:5:002:0 s 80 06 b502 1a80 0001 1 <
ffff8801f4df89c0 4079426115 C Ci:5:002:0 0 1 = fb
ffff8801f4df89c0 4079427262 S Ci:5:002:0 s 80 06 b504 fe00 0001 1 <
ffff8801f4df89c0 4079428113 C Ci:5:002:0 0 1 = fb
ffff8801f4df89c0 4079429196 S Ci:5:002:0 s 80 06 b504 2b01 0001 1 <
ffff8801f4df89c0 4079430114 C Ci:5:002:0 0 1 = fb
ffff8801f4df89c0 4079431213 S Ci:5:002:0 s 80 06 b504 fe02 0001 1 <
ffff8801f4df89c0 4079432115 C Ci:5:002:0 0 1 = fb
ffff8801f4df89c0 4079433227 S Ci:5:002:0 s 80 06 b504 2b03 0001 1 <
ffff8801f4df89c0 4079434114 C Ci:5:002:0 0 1 = fb
ffff8801f4df89c0 4079435243 S Ci:5:002:0 s 80 06 b504 fe04 0001 1 <
ffff8801f4df89c0 4079436114 C Ci:5:002:0 0 1 = fb
ffff8801f4df89c0 4079437258 S Ci:5:002:0 s 80 06 b504 2b05 0001 1 <
ffff8801f4df89c0 4079438116 C Ci:5:002:0 0 1 = fb
ffff8801f4df89c0 4079439196 S Ci:5:002:0 s 80 06 b504 fe06 0001 1 <
ffff8801f4df89c0 4079440115 C Ci:5:002:0 0 1 = fb
ffff8801f4df89c0 4079441210 S Ci:5:002:0 s 80 06 b504 2b07 0001 1 <
ffff8801f4df89c0 4079442114 C Ci:5:002:0 0 1 = fb
ffff8801f4df89c0 4079443257 S Ci:5:002:0 s 80 06 b504 fe08 0001 1 <
ffff8801f4df89c0 4079444114 C Ci:5:002:0 0 1 = fb
ffff8801f4df89c0 4079445241 S Ci:5:002:0 s 80 06 b504 2b09 0001 1 <
ffff8801f4df89c0 4079446115 C Ci:5:002:0 0 1 = fb
ffff8801f4df89c0 4079447258 S Ci:5:002:0 s 80 06 b504 fe0a 0001 1 <
ffff8801f4df89c0 4079448114 C Ci:5:002:0 0 1 = fb
ffff8801f4df89c0 4079449196 S Ci:5:002:0 s 80 06 b504 2b0b 0001 1 <
ffff8801f4df89c0 4079450114 C Ci:5:002:0 0 1 = fb
ffff8801df479800 4079451215 S Ci:5:002:0 s 80 06 b504 fe0c 0001 1 <
ffff8801df479800 4079452115 C Ci:5:002:0 0 1 = fb
ffff8801f4df89c0 4079453230 S Ci:5:002:0 s 80 06 b504 2b0d 0001 1 <
ffff8801f4df89c0 4079454116 C Ci:5:002:0 0 1 = fb
ffff8801f4df89c0 4079455243 S Ci:5:002:0 s 80 06 b504 fe0e 0001 1 <
ffff8801f4df89c0 4079456115 C Ci:5:002:0 0 1 = fb
ffff8801f4df89c0 4079457256 S Ci:5:002:0 s 80 06 b504 2b0f 0001 1 <
ffff8801f4df89c0 4079458115 C Ci:5:002:0 0 1 = fb
ffff8801f4df89c0 4079459197 S Ci:5:002:0 s 80 06 b504 fe10 0001 1 <
ffff8801f4df89c0 4079460115 C Ci:5:002:0 0 1 = fb
ffff8801f4df89c0 4079461210 S Ci:5:002:0 s 80 06 b504 2b11 0001 1 <
ffff8801f4df89c0 4079462116 C Ci:5:002:0 0 1 = fb
ffff8801f4df89c0 4079463226 S Ci:5:002:0 s 80 06 b504 fe12 0001 1 <
ffff8801f4df89c0 4079464115 C Ci:5:002:0 0 1 = fb
ffff8801f4df89c0 4079465243 S Ci:5:002:0 s 80 06 b504 2b13 0001 1 <
ffff8801f4df89c0 4079466115 C Ci:5:002:0 0 1 = fb
ffff8801f4df89c0 4079467260 S Ci:5:002:0 s 80 06 b504 fe14 0001 1 <
ffff8801f4df89c0 4079468116 C Ci:5:002:0 0 1 = fb
ffff8801f4df89c0 4079469196 S Ci:5:002:0 s 80 06 b504 2b15 0001 1 <
ffff8801f4df89c0 4079470116 C Ci:5:002:0 0 1 = fb
ffff8801f4df89c0 4079471211 S Ci:5:002:0 s 80 06 b504 fe16 0001 1 <
ffff8801f4df89c0 4079472116 C Ci:5:002:0 0 1 = fb
ffff8801f4df89c0 4079473227 S Ci:5:002:0 s 80 06 b504 2b17 0001 1 <
ffff8801f4df89c0 4079474115 C Ci:5:002:0 0 1 = fb
ffff8801f4df89c0 4079475242 S Ci:5:002:0 s 80 06 b504 fe18 0001 1 <
ffff8801f4df89c0 4079476115 C Ci:5:002:0 0 1 = fb
ffff8801f4df89c0 4079477257 S Ci:5:002:0 s 80 06 b504 2b19 0001 1 <
ffff8801f4df89c0 4079478116 C Ci:5:002:0 0 1 = fb
ffff8801f4df89c0 4079479196 S Ci:5:002:0 s 80 06 b504 fe1a 0001 1 <
ffff8801f4df89c0 4079480116 C Ci:5:002:0 0 1 = fb
ffff8801f4df89c0 4079481211 S Ci:5:002:0 s 80 06 b504 2b1b 0001 1 <
ffff8801f4df89c0 4079482116 C Ci:5:002:0 0 1 = fb
ffff8801f4df89c0 4079483227 S Ci:5:002:0 s 80 06 b504 fe1c 0001 1 <
ffff8801f4df89c0 4079484116 C Ci:5:002:0 0 1 = fb
ffff8801f4df89c0 4079485243 S Ci:5:002:0 s 80 06 b504 2b1d 0001 1 <
ffff8801f4df89c0 4079486115 C Ci:5:002:0 0 1 = fb
ffff8801f4df89c0 4079487262 S Ci:5:002:0 s 80 06 b504 fe1e 0001 1 <
ffff8801f4df89c0 4079488116 C Ci:5:002:0 0 1 = fb
ffff8801f4df89c0 4079489197 S Ci:5:002:0 s 80 06 b504 2b1f 0001 1 <
ffff8801f4df89c0 4079490116 C Ci:5:002:0 0 1 = fb
ffff8801f4df89c0 4079491211 S Ci:5:002:0 s 80 06 b504 fe20 0001 1 <
ffff8801f4df89c0 4079492117 C Ci:5:002:0 0 1 = fb
ffff8801f4df89c0 4079493226 S Ci:5:002:0 s 80 06 b504 2b21 0001 1 <
ffff8801f4df89c0 4079494116 C Ci:5:002:0 0 1 = fb
ffff8801f4df89c0 4079495242 S Ci:5:002:0 s 80 06 b504 fe22 0001 1 <
ffff8801f4df89c0 4079496116 C Ci:5:002:0 0 1 = fb
ffff8801f4df89c0 4079497261 S Ci:5:002:0 s 80 06 b504 2b23 0001 1 <
ffff8801f4df89c0 4079498117 C Ci:5:002:0 0 1 = fb
ffff8801f4df89c0 4079499197 S Ci:5:002:0 s 80 06 b504 0224 0001 1 <
ffff8801f4df89c0 4079500116 C Ci:5:002:0 0 1 = fb
ffff8801f4df89c0 4079501211 S Ci:5:002:0 s 80 06 b504 2525 0001 1 <
ffff8801f4df89c0 4079502116 C Ci:5:002:0 0 1 = fb
ffff8801f4df89c0 4079503226 S Ci:5:002:0 s 80 06 b504 0226 0001 1 <
ffff8801f4df89c0 4079504116 C Ci:5:002:0 0 1 = fb
ffff8801f4df89c0 4079505242 S Ci:5:002:0 s 80 06 b504 2427 0001 1 <
ffff8801f4df89c0 4079506116 C Ci:5:002:0 0 1 = fb
ffff8801f4df89c0 4079507261 S Ci:5:002:0 s 80 06 b504 0428 0001 1 <
ffff8801f4df89c0 4079508116 C Ci:5:002:0 0 1 = fb
ffff8801f4df89c0 4079509196 S Ci:5:002:0 s 80 06 b504 2529 0001 1 <
ffff8801f4df89c0 4079510117 C Ci:5:002:0 0 1 = fb
ffff8801f4df89c0 4079511210 S Ci:5:002:0 s 80 06 b504 042a 0001 1 <
ffff8801f4df89c0 4079512117 C Ci:5:002:0 0 1 = fb
ffff8801f4df89c0 4079513226 S Ci:5:002:0 s 80 06 b504 242b 0001 1 <
ffff8801f4df89c0 4079514117 C Ci:5:002:0 0 1 = fb
ffff8801f4df89c0 4079515242 S Ci:5:002:0 s 80 06 b504 082c 0001 1 <
ffff8801f4df89c0 4079516117 C Ci:5:002:0 0 1 = fb
ffff8801f4df89c0 4079517257 S Ci:5:002:0 s 80 06 b504 252d 0001 1 <
ffff8801f4df89c0 4079518117 C Ci:5:002:0 0 1 = fb
ffff8801f4df89c0 4079519196 S Ci:5:002:0 s 80 06 b504 082e 0001 1 <
ffff8801f4df89c0 4079520117 C Ci:5:002:0 0 1 = fb
ffff8801f4df89c0 4079521210 S Ci:5:002:0 s 80 06 b504 242f 0001 1 <
ffff8801f4df89c0 4079522117 C Ci:5:002:0 0 1 = fb
ffff8801f4df89c0 4079523226 S Ci:5:002:0 s 80 06 b504 1030 0001 1 <
ffff8801f4df89c0 4079524117 C Ci:5:002:0 0 1 = fb
ffff8801f4df89c0 4079525242 S Ci:5:002:0 s 80 06 b504 2531 0001 1 <
ffff8801f4df89c0 4079526117 C Ci:5:002:0 0 1 = fb
ffff8801f4df89c0 4079527261 S Ci:5:002:0 s 80 06 b504 1032 0001 1 <
ffff8801f4df89c0 4079528117 C Ci:5:002:0 0 1 = fb
ffff8801f4df89c0 4079529197 S Ci:5:002:0 s 80 06 b504 2433 0001 1 <
ffff8801f4df89c0 4079530118 C Ci:5:002:0 0 1 = fb
ffff8801f4df89c0 4079531211 S Ci:5:002:0 s 80 06 b504 f634 0001 1 <
ffff8801f4df89c0 4079532117 C Ci:5:002:0 0 1 = fb
ffff8801f4df89c0 4079533227 S Ci:5:002:0 s 80 06 b504 2b35 0001 1 <
ffff8801f4df89c0 4079534117 C Ci:5:002:0 0 1 = fb
ffff8801f4df89c0 4079535243 S Ci:5:002:0 s 80 06 b504 fe36 0001 1 <
ffff8801f4df89c0 4079536118 C Ci:5:002:0 0 1 = fb
ffff8801f4df89c0 4079537258 S Ci:5:002:0 s 80 06 b504 2b37 0001 1 <
ffff8801f4df89c0 4079538117 C Ci:5:002:0 0 1 = fb
ffff8801f4df89c0 4079539196 S Ci:5:002:0 s 80 06 b504 f938 0001 1 <
ffff8801f4df89c0 4079540118 C Ci:5:002:0 0 1 = fb
ffff8801f4df89c0 4079541210 S Ci:5:002:0 s 80 06 b504 e039 0001 1 <
ffff8801f4df89c0 4079542118 C Ci:5:002:0 0 1 = fb
ffff8801f4df89c0 4079543226 S Ci:5:002:0 s 80 06 b504 fe3a 0001 1 <
ffff8801f4df89c0 4079544118 C Ci:5:002:0 0 1 = fb
ffff8801f4df89c0 4079545242 S Ci:5:002:0 s 80 06 b504 2b3b 0001 1 <
ffff8801f4df89c0 4079546117 C Ci:5:002:0 0 1 = fb
ffff8801f4df89c0 4079547261 S Ci:5:002:0 s 80 06 b504 fe3c 0001 1 <
ffff8801f4df89c0 4079548118 C Ci:5:002:0 0 1 = fb
ffff8801f4df89c0 4079549196 S Ci:5:002:0 s 80 06 b504 2b3d 0001 1 <
ffff8801f4df89c0 4079550118 C Ci:5:002:0 0 1 = fb
ffff8801f4df89c0 4079551211 S Ci:5:002:0 s 80 06 b504 fe3e 0001 1 <
ffff8801f4df89c0 4079552118 C Ci:5:002:0 0 1 = fb
ffff8801f4df89c0 4079553226 S Ci:5:002:0 s 80 06 b504 2b3f 0001 1 <
ffff8801f4df89c0 4079554119 C Ci:5:002:0 0 1 = fb
ffff8801f4df89c0 4079555246 S Ci:5:002:0 s 80 06 b500 9a80 0001 1 <
ffff8801f4df89c0 4079557118 C Ci:5:002:0 0 1 = fb
ffff8801f4df89c0 4079559197 S Ci:5:002:0 s 80 06 b501 1a80 0002 2 <
ffff8801f4df89c0 4079560119 C Ci:5:002:0 0 2 = fe2b
ffff8801f4df89c0 4079561211 S Ci:5:002:0 s 80 06 b501 1a81 0002 2 <
ffff8801f4df89c0 4079562118 C Ci:5:002:0 0 2 = fe2b
ffff8801f4df89c0 4079563228 S Ci:5:002:0 s 80 06 b501 1a82 0002 2 <
ffff8801f4df89c0 4079564118 C Ci:5:002:0 0 2 = fe2b
ffff8801f4df89c0 4079565244 S Ci:5:002:0 s 80 06 b501 1a83 0002 2 <
ffff8801f4df89c0 4079566119 C Ci:5:002:0 0 2 = fe2b
ffff8801f4df89c0 4079567262 S Ci:5:002:0 s 80 06 b501 1a84 0002 2 <
ffff8801f4df89c0 4079568119 C Ci:5:002:0 0 2 = fe2b
ffff8801f4df89c0 4079569431 S Ci:5:002:0 s 80 06 b501 1a85 0002 2 <
ffff8801f4df89c0 4079570120 C Ci:5:002:0 0 2 = fe2b
ffff8801f4df89c0 4079574163 S Ci:5:002:0 s 80 06 b501 1a86 0002 2 <
ffff8801f4df89c0 4079575119 C Ci:5:002:0 0 2 = fe2b
ffff8801f4df89c0 4079579433 S Ci:5:002:0 s 80 06 b501 1a87 0002 2 <
ffff8801f4df89c0 4079580119 C Ci:5:002:0 0 2 = fe2b
ffff8801f4df89c0 4079584154 S Ci:5:002:0 s 80 06 b501 1a88 0002 2 <
ffff8801f4df89c0 4079585121 C Ci:5:002:0 0 2 = fe2b
ffff8801f4df89c0 4079600151 S Ci:5:002:0 s 80 06 b501 1a89 0002 2 <
ffff8801f4df89c0 4079602123 C Ci:5:002:0 0 2 = fe2b
ffff8801f4df89c0 4079605141 S Ci:5:002:0 s 80 06 b501 1a8a 0002 2 <
ffff8801f4df89c0 4079606119 C Ci:5:002:0 0 2 = fe2b
ffff8801f4df89c0 4079609065 S Ci:5:002:0 s 80 06 b501 1a8b 0002 2 <
ffff8801f4df89c0 4079610127 C Ci:5:002:0 0 2 = fe2b
ffff8801f4df89c0 4079611600 S Ci:5:002:0 s 80 06 b501 1a8c 0002 2 <
ffff8801f4df89c0 4079612121 C Ci:5:002:0 0 2 = fe2b
ffff8801f4df89c0 4079613597 S Ci:5:002:0 s 80 06 b501 1a8d 0002 2 <
ffff8801f4df89c0 4079614121 C Ci:5:002:0 0 2 = fe2b
ffff8801f4df89c0 4079615621 S Ci:5:002:0 s 80 06 b501 1a8e 0002 2 <
ffff8801f4df89c0 4079616121 C Ci:5:002:0 0 2 = fe2b
ffff8801f4df89c0 4079617637 S Ci:5:002:0 s 80 06 b501 1a8f 0002 2 <
ffff8801f4df89c0 4079618120 C Ci:5:002:0 0 2 = fe2b
ffff8801f4df89c0 4079619554 S Ci:5:002:0 s 80 06 b501 1a90 0002 2 <
ffff8801f4df89c0 4079620121 C Ci:5:002:0 0 2 = fe2b
ffff8801df479800 4079621572 S Ci:5:002:0 s 80 06 b501 1a91 0002 2 <
ffff8801df479800 4079622120 C Ci:5:002:0 0 2 = fe2b
ffff8801df479800 4079623631 S Ci:5:002:0 s 80 06 b501 1a92 0002 2 <
ffff8801df479800 4079624122 C Ci:5:002:0 0 2 = 0225
ffff8801df479800 4079625586 S Ci:5:002:0 s 80 06 b501 1a93 0002 2 <
ffff8801df479800 4079626120 C Ci:5:002:0 0 2 = 0224
ffff8801df479800 4079627567 S Ci:5:002:0 s 80 06 b501 1a94 0002 2 <
ffff8801df479800 4079628121 C Ci:5:002:0 0 2 = 0425
ffff8801df479800 4079629565 S Ci:5:002:0 s 80 06 b501 1a95 0002 2 <
ffff8801df479800 4079630121 C Ci:5:002:0 0 2 = 0424
ffff8801df479800 4079631578 S Ci:5:002:0 s 80 06 b501 1a96 0002 2 <
ffff8801df479800 4079632121 C Ci:5:002:0 0 2 = 0825
ffff8801df479800 4079633595 S Ci:5:002:0 s 80 06 b501 1a97 0002 2 <
ffff8801df479800 4079634121 C Ci:5:002:0 0 2 = 0824
ffff8801df479800 4079635612 S Ci:5:002:0 s 80 06 b501 1a98 0002 2 <
ffff8801df479800 4079636121 C Ci:5:002:0 0 2 = 1025
ffff8801f4df89c0 4079637630 S Ci:5:002:0 s 80 06 b501 1a99 0002 2 <
ffff8801f4df89c0 4079638121 C Ci:5:002:0 0 2 = 1024
ffff8801df479800 4079639563 S Ci:5:002:0 s 80 06 b501 1a9a 0002 2 <
ffff8801df479800 4079640121 C Ci:5:002:0 0 2 = f62b
ffff8801df479800 4079641575 S Ci:5:002:0 s 80 06 b501 1a9b 0002 2 <
ffff8801df479800 4079642121 C Ci:5:002:0 0 2 = fe2b
ffff8801df479800 4079643627 S Ci:5:002:0 s 80 06 b501 1a9c 0002 2 <
ffff8801df479800 4079644122 C Ci:5:002:0 0 2 = f9e0
ffff8801df479800 4079645602 S Ci:5:002:0 s 80 06 b501 1a9d 0002 2 <
ffff8801df479800 4079646121 C Ci:5:002:0 0 2 = fe2b
ffff8801df479800 4079647616 S Ci:5:002:0 s 80 06 b501 1a9e 0002 2 <
ffff8801df479800 4079648121 C Ci:5:002:0 0 2 = fe2b
ffff8801df479800 4079649563 S Ci:5:002:0 s 80 06 b501 1a9f 0002 2 <
ffff8801df479800 4079650122 C Ci:5:002:0 0 2 = fe2b
ffff8801df479800 4079651573 S Ci:5:002:0 s 80 06 b504 fe00 0001 1 <
ffff8801df479800 4079652122 C Ci:5:002:0 0 1 = fb
ffff8801df479800 4079653588 S Ci:5:002:0 s 80 06 b504 2b01 0001 1 <
ffff8801df479800 4079654122 C Ci:5:002:0 0 1 = fb
ffff8801df479e00 4079655612 S Ci:5:002:0 s 80 06 b504 fe02 0001 1 <
ffff8801df479e00 4079656123 C Ci:5:002:0 0 1 = fb
ffff8801df479e00 4079657616 S Ci:5:002:0 s 80 06 b504 2b03 0001 1 <
ffff8801df479e00 4079658122 C Ci:5:002:0 0 1 = fb
ffff8801df479e00 4079659564 S Ci:5:002:0 s 80 06 b504 fe04 0001 1 <
ffff8801df479e00 4079660122 C Ci:5:002:0 0 1 = fb
ffff8801df479e00 4079661577 S Ci:5:002:0 s 80 06 b504 2b05 0001 1 <
ffff8801df479e00 4079662122 C Ci:5:002:0 0 1 = fb
ffff8801df479e00 4079663593 S Ci:5:002:0 s 80 06 b504 fe06 0001 1 <
ffff8801df479e00 4079664122 C Ci:5:002:0 0 1 = fb
ffff8801df479e00 4079665609 S Ci:5:002:0 s 80 06 b504 2b07 0001 1 <
ffff8801df479e00 4079666123 C Ci:5:002:0 0 1 = fb
ffff8801df479e00 4079667625 S Ci:5:002:0 s 80 06 b504 fe08 0001 1 <
ffff8801df479e00 4079668121 C Ci:5:002:0 0 1 = fb
ffff8801df479e00 4079669564 S Ci:5:002:0 s 80 06 b504 2b09 0001 1 <
ffff8801df479e00 4079670122 C Ci:5:002:0 0 1 = fb
ffff8801df479e00 4079671577 S Ci:5:002:0 s 80 06 b504 fe0a 0001 1 <
ffff8801df479e00 4079672122 C Ci:5:002:0 0 1 = fb
ffff8801df479e00 4079673593 S Ci:5:002:0 s 80 06 b504 2b0b 0001 1 <
ffff8801df479e00 4079674122 C Ci:5:002:0 0 1 = fb
ffff8801df479e00 4079675609 S Ci:5:002:0 s 80 06 b504 fe0c 0001 1 <
ffff8801df479e00 4079676122 C Ci:5:002:0 0 1 = fb
ffff8801df479e00 4079677625 S Ci:5:002:0 s 80 06 b504 2b0d 0001 1 <
ffff8801df479e00 4079678122 C Ci:5:002:0 0 1 = fb
ffff8801df479800 4079679572 S Ci:5:002:0 s 80 06 b504 fe0e 0001 1 <
ffff8801df479800 4079680123 C Ci:5:002:0 0 1 = fb
ffff8801df479800 4079681577 S Ci:5:002:0 s 80 06 b504 2b0f 0001 1 <
ffff8801df479800 4079682122 C Ci:5:002:0 0 1 = fb
ffff8801df479800 4079683593 S Ci:5:002:0 s 80 06 b504 fe10 0001 1 <
ffff8801df479800 4079684122 C Ci:5:002:0 0 1 = fb
ffff8801df479800 4079685608 S Ci:5:002:0 s 80 06 b504 2b11 0001 1 <
ffff8801df479800 4079686123 C Ci:5:002:0 0 1 = fb
ffff8801df479800 4079687624 S Ci:5:002:0 s 80 06 b504 fe12 0001 1 <
ffff8801df479800 4079688122 C Ci:5:002:0 0 1 = fb
ffff8801df479800 4079689564 S Ci:5:002:0 s 80 06 b504 2b13 0001 1 <
ffff8801df479800 4079690123 C Ci:5:002:0 0 1 = fb
ffff8801df479800 4079691577 S Ci:5:002:0 s 80 06 b504 fe14 0001 1 <
ffff8801df479800 4079692123 C Ci:5:002:0 0 1 = fb
ffff8801df479800 4079693592 S Ci:5:002:0 s 80 06 b504 2b15 0001 1 <
ffff8801df479800 4079694123 C Ci:5:002:0 0 1 = fb
ffff8801df479800 4079695607 S Ci:5:002:0 s 80 06 b504 fe16 0001 1 <
ffff8801df479800 4079696123 C Ci:5:002:0 0 1 = fb
ffff8801df479800 4079697626 S Ci:5:002:0 s 80 06 b504 2b17 0001 1 <
ffff8801df479800 4079698123 C Ci:5:002:0 0 1 = fb
ffff8801df479800 4079699564 S Ci:5:002:0 s 80 06 b504 fe18 0001 1 <
ffff8801df479800 4079700123 C Ci:5:002:0 0 1 = fb
ffff8801df479800 4079701577 S Ci:5:002:0 s 80 06 b504 2b19 0001 1 <
ffff8801df479800 4079702123 C Ci:5:002:0 0 1 = fb
ffff8801df479800 4079703592 S Ci:5:002:0 s 80 06 b504 fe1a 0001 1 <
ffff8801df479800 4079704123 C Ci:5:002:0 0 1 = fb
ffff8801df479800 4079705608 S Ci:5:002:0 s 80 06 b504 2b1b 0001 1 <
ffff8801df479800 4079706124 C Ci:5:002:0 0 1 = fb
ffff8801df479800 4079707623 S Ci:5:002:0 s 80 06 b504 fe1c 0001 1 <
ffff8801df479800 4079708123 C Ci:5:002:0 0 1 = fb
ffff8801df479800 4079709676 S Ci:5:002:0 s 80 06 b504 2b1d 0001 1 <
ffff8801df479800 4079710123 C Ci:5:002:0 0 1 = fb
ffff8801df479800 4079711578 S Ci:5:002:0 s 80 06 b504 fe1e 0001 1 <
ffff8801df479800 4079712123 C Ci:5:002:0 0 1 = fb
ffff8801df479800 4079713592 S Ci:5:002:0 s 80 06 b504 2b1f 0001 1 <
ffff8801df479800 4079714123 C Ci:5:002:0 0 1 = fb
ffff8801df479800 4079715609 S Ci:5:002:0 s 80 06 b504 fe20 0001 1 <
ffff8801df479800 4079716123 C Ci:5:002:0 0 1 = fb
ffff8801df479800 4079717624 S Ci:5:002:0 s 80 06 b504 2b21 0001 1 <
ffff8801df479800 4079718123 C Ci:5:002:0 0 1 = fb
ffff8801df479800 4079719561 S Ci:5:002:0 s 80 06 b504 fe22 0001 1 <
ffff8801df479800 4079720124 C Ci:5:002:0 0 1 = fb
ffff8801df479800 4079721576 S Ci:5:002:0 s 80 06 b504 2b23 0001 1 <
ffff8801df479800 4079722124 C Ci:5:002:0 0 1 = fb
ffff8801df479800 4079723592 S Ci:5:002:0 s 80 06 b504 0224 0001 1 <
ffff8801df479800 4079724124 C Ci:5:002:0 0 1 = fb
ffff8801df479800 4079725608 S Ci:5:002:0 s 80 06 b504 2525 0001 1 <
ffff8801df479800 4079726124 C Ci:5:002:0 0 1 = fb
ffff8801df479800 4079727630 S Ci:5:002:0 s 80 06 b504 0226 0001 1 <
ffff8801df479800 4079728124 C Ci:5:002:0 0 1 = fb
ffff8801df479800 4079729562 S Ci:5:002:0 s 80 06 b504 2427 0001 1 <
ffff8801df479800 4079730124 C Ci:5:002:0 0 1 = fb
ffff8801df479800 4079731577 S Ci:5:002:0 s 80 06 b504 0428 0001 1 <
ffff8801df479800 4079732124 C Ci:5:002:0 0 1 = fb
ffff8801df479800 4079733593 S Ci:5:002:0 s 80 06 b504 2529 0001 1 <
ffff8801df479800 4079734124 C Ci:5:002:0 0 1 = fb
ffff8801df479800 4079735608 S Ci:5:002:0 s 80 06 b504 042a 0001 1 <
ffff8801df479800 4079736124 C Ci:5:002:0 0 1 = fb
ffff8801df479e00 4079737628 S Ci:5:002:0 s 80 06 b504 242b 0001 1 <
ffff8801df479e00 4079738125 C Ci:5:002:0 0 1 = fb
ffff8801df479e00 4079739564 S Ci:5:002:0 s 80 06 b504 082c 0001 1 <
ffff8801df479e00 4079740125 C Ci:5:002:0 0 1 = fb
ffff8801df479e00 4079741578 S Ci:5:002:0 s 80 06 b504 252d 0001 1 <
ffff8801df479e00 4079742125 C Ci:5:002:0 0 1 = fb
ffff8801df479e00 4079743593 S Ci:5:002:0 s 80 06 b504 082e 0001 1 <
ffff8801df479e00 4079744124 C Ci:5:002:0 0 1 = fb
ffff8801df479e00 4079745609 S Ci:5:002:0 s 80 06 b504 242f 0001 1 <
ffff8801df479e00 4079746124 C Ci:5:002:0 0 1 = fb
ffff8801df479e00 4079747625 S Ci:5:002:0 s 80 06 b504 1030 0001 1 <
ffff8801df479e00 4079748124 C Ci:5:002:0 0 1 = fb
ffff8801df479e00 4079749562 S Ci:5:002:0 s 80 06 b504 2531 0001 1 <
ffff8801df479e00 4079750125 C Ci:5:002:0 0 1 = fb
ffff8801df479e00 4079751578 S Ci:5:002:0 s 80 06 b504 1032 0001 1 <
ffff8801df479e00 4079752125 C Ci:5:002:0 0 1 = fb
ffff8801df479e00 4079753593 S Ci:5:002:0 s 80 06 b504 2433 0001 1 <
ffff8801df479e00 4079754125 C Ci:5:002:0 0 1 = fb
ffff8801df479800 4079755615 S Ci:5:002:0 s 80 06 b504 f634 0001 1 <
ffff8801df479800 4079756127 C Ci:5:002:0 0 1 = fb
ffff8801df479800 4079757626 S Ci:5:002:0 s 80 06 b504 2b35 0001 1 <
ffff8801df479800 4079758125 C Ci:5:002:0 0 1 = fb
ffff8801df479800 4079759562 S Ci:5:002:0 s 80 06 b504 fe36 0001 1 <
ffff8801df479800 4079760124 C Ci:5:002:0 0 1 = fb
ffff8801df479800 4079761577 S Ci:5:002:0 s 80 06 b504 2b37 0001 1 <
ffff8801df479800 4079762125 C Ci:5:002:0 0 1 = fb
ffff8801df479800 4079763592 S Ci:5:002:0 s 80 06 b504 f938 0001 1 <
ffff8801df479800 4079764125 C Ci:5:002:0 0 1 = fb
ffff8801df479800 4079765609 S Ci:5:002:0 s 80 06 b504 e039 0001 1 <
ffff8801df479800 4079766125 C Ci:5:002:0 0 1 = fb
ffff8801df479800 4079767625 S Ci:5:002:0 s 80 06 b504 fe3a 0001 1 <
ffff8801df479800 4079768125 C Ci:5:002:0 0 1 = fb
ffff8801df479800 4079769563 S Ci:5:002:0 s 80 06 b504 2b3b 0001 1 <
ffff8801df479800 4079770125 C Ci:5:002:0 0 1 = fb
ffff8801df479800 4079771577 S Ci:5:002:0 s 80 06 b504 fe3c 0001 1 <
ffff8801df479800 4079772126 C Ci:5:002:0 0 1 = fb
ffff8801df479800 4079773592 S Ci:5:002:0 s 80 06 b504 2b3d 0001 1 <
ffff8801df479800 4079774125 C Ci:5:002:0 0 1 = fb
ffff8801df479800 4079775608 S Ci:5:002:0 s 80 06 b504 fe3e 0001 1 <
ffff8801df479800 4079776125 C Ci:5:002:0 0 1 = fb
ffff8801df479800 4079777624 S Ci:5:002:0 s 80 06 b504 2b3f 0001 1 <
ffff8801df479800 4079778125 C Ci:5:002:0 0 1 = fb
ffff8801df479800 4079779562 S Ci:5:002:0 s 80 06 b500 9aa0 0001 1 <
ffff8801df479800 4079781125 C Ci:5:002:0 0 1 = fb
ffff8801df479800 4079782859 S Ci:5:002:0 s 80 06 b501 1aa0 0002 2 <
ffff8801df479800 4079783127 C Ci:5:002:0 0 2 = fe2b
ffff8801df479800 4079784602 S Ci:5:002:0 s 80 06 b501 1aa1 0002 2 <
ffff8801df479800 4079785126 C Ci:5:002:0 0 2 = fe2b
ffff8801df479800 4079786617 S Ci:5:002:0 s 80 06 b501 1aa2 0002 2 <
ffff8801df479800 4079787127 C Ci:5:002:0 0 2 = fe2b
ffff8801df479800 4079788638 S Ci:5:002:0 s 80 06 b501 1aa3 0002 2 <
ffff8801df479800 4079789125 C Ci:5:002:0 0 2 = fe2b
ffff8801df479800 4079790569 S Ci:5:002:0 s 80 06 b501 1aa4 0002 2 <
ffff8801df479800 4079791126 C Ci:5:002:0 0 2 = fe2b
ffff8801df479800 4079792583 S Ci:5:002:0 s 80 06 b501 1aa5 0002 2 <
ffff8801df479800 4079793126 C Ci:5:002:0 0 2 = fe2b
ffff8801df479800 4079794599 S Ci:5:002:0 s 80 06 b501 1aa6 0002 2 <
ffff8801df479800 4079795126 C Ci:5:002:0 0 2 = fe2b
ffff8801df479800 4079796614 S Ci:5:002:0 s 80 06 b501 1aa7 0002 2 <
ffff8801df479800 4079797126 C Ci:5:002:0 0 2 = fe2b
ffff8801df479800 4079798635 S Ci:5:002:0 s 80 06 b501 1aa8 0002 2 <
ffff8801df479800 4079799126 C Ci:5:002:0 0 2 = fe2b
ffff8801df479800 4079800569 S Ci:5:002:0 s 80 06 b501 1aa9 0002 2 <
ffff8801df479800 4079801126 C Ci:5:002:0 0 2 = fe2b
ffff8801df479800 4079802584 S Ci:5:002:0 s 80 06 b501 1aaa 0002 2 <
ffff8801df479800 4079803126 C Ci:5:002:0 0 2 = fe2b
ffff8801df479800 4079804599 S Ci:5:002:0 s 80 06 b501 1aab 0002 2 <
ffff8801df479800 4079805126 C Ci:5:002:0 0 2 = fe2b
ffff8801df479800 4079806615 S Ci:5:002:0 s 80 06 b501 1aac 0002 2 <
ffff8801df479800 4079807127 C Ci:5:002:0 0 2 = fe2b
ffff8801df479800 4079808634 S Ci:5:002:0 s 80 06 b501 1aad 0002 2 <
ffff8801df479800 4079809126 C Ci:5:002:0 0 2 = fe2b
ffff8801df479800 4079810569 S Ci:5:002:0 s 80 06 b501 1aae 0002 2 <
ffff8801df479800 4079811127 C Ci:5:002:0 0 2 = fe2b
ffff8801df479800 4079812584 S Ci:5:002:0 s 80 06 b501 1aaf 0002 2 <
ffff8801df479800 4079813127 C Ci:5:002:0 0 2 = fe2b
ffff8801df479800 4079814600 S Ci:5:002:0 s 80 06 b501 1ab0 0002 2 <
ffff8801df479800 4079815127 C Ci:5:002:0 0 2 = fe2b
ffff8801df479800 4079816615 S Ci:5:002:0 s 80 06 b501 1ab1 0002 2 <
ffff8801df479800 4079817128 C Ci:5:002:0 0 2 = fe2b
ffff8801df479800 4079818634 S Ci:5:002:0 s 80 06 b501 1ab2 0002 2 <
ffff8801df479800 4079819126 C Ci:5:002:0 0 2 = 0225
ffff8801df479800 4079820568 S Ci:5:002:0 s 80 06 b501 1ab3 0002 2 <
ffff8801df479800 4079821127 C Ci:5:002:0 0 2 = 0224
ffff8801df479800 4079822584 S Ci:5:002:0 s 80 06 b501 1ab4 0002 2 <
ffff8801df479800 4079823127 C Ci:5:002:0 0 2 = 0425
ffff8801df479800 4079824600 S Ci:5:002:0 s 80 06 b501 1ab5 0002 2 <
ffff8801df479800 4079825127 C Ci:5:002:0 0 2 = 0424
ffff8801df479800 4079826614 S Ci:5:002:0 s 80 06 b501 1ab6 0002 2 <
ffff8801df479800 4079827128 C Ci:5:002:0 0 2 = 0825
ffff8801df479800 4079828636 S Ci:5:002:0 s 80 06 b501 1ab7 0002 2 <
ffff8801df479800 4079829128 C Ci:5:002:0 0 2 = 0824
ffff8801df479800 4079830569 S Ci:5:002:0 s 80 06 b501 1ab8 0002 2 <
ffff8801df479800 4079831128 C Ci:5:002:0 0 2 = 1025
ffff8801df479800 4079832585 S Ci:5:002:0 s 80 06 b501 1ab9 0002 2 <
ffff8801df479800 4079833127 C Ci:5:002:0 0 2 = 1024
ffff8801df479800 4079834601 S Ci:5:002:0 s 80 06 b501 1aba 0002 2 <
ffff8801df479800 4079835127 C Ci:5:002:0 0 2 = f62b
ffff8801df479800 4079836618 S Ci:5:002:0 s 80 06 b501 1abb 0002 2 <
ffff8801df479800 4079837128 C Ci:5:002:0 0 2 = fe2b
ffff8801df479800 4079838638 S Ci:5:002:0 s 80 06 b501 1abc 0002 2 <
ffff8801df479800 4079839128 C Ci:5:002:0 0 2 = f9e0
ffff8801df479800 4079840569 S Ci:5:002:0 s 80 06 b501 1abd 0002 2 <
ffff8801df479800 4079841128 C Ci:5:002:0 0 2 = fe2b
ffff8801df479800 4079842585 S Ci:5:002:0 s 80 06 b501 1abe 0002 2 <
ffff8801df479800 4079843128 C Ci:5:002:0 0 2 = fe2b
ffff8801df479800 4079844602 S Ci:5:002:0 s 80 06 b501 1abf 0002 2 <
ffff8801df479800 4079845128 C Ci:5:002:0 0 2 = fe2b
ffff8801df479800 4079846617 S Ci:5:002:0 s 80 06 b504 fe00 0001 1 <
ffff8801df479800 4079847128 C Ci:5:002:0 0 1 = fb
ffff8801df479800 4079848638 S Ci:5:002:0 s 80 06 b504 2b01 0001 1 <
ffff8801df479800 4079849128 C Ci:5:002:0 0 1 = fb
ffff8801df479800 4079850569 S Ci:5:002:0 s 80 06 b504 fe02 0001 1 <
ffff8801df479800 4079851128 C Ci:5:002:0 0 1 = fb
ffff8801df479800 4079852583 S Ci:5:002:0 s 80 06 b504 2b03 0001 1 <
ffff8801df479800 4079853128 C Ci:5:002:0 0 1 = fb
ffff8801df479800 4079854599 S Ci:5:002:0 s 80 06 b504 fe04 0001 1 <
ffff8801df479800 4079855128 C Ci:5:002:0 0 1 = fb
ffff8801df479800 4079856619 S Ci:5:002:0 s 80 06 b504 2b05 0001 1 <
ffff8801df479800 4079857131 C Ci:5:002:0 0 1 = fb
ffff8801df479800 4079858636 S Ci:5:002:0 s 80 06 b504 fe06 0001 1 <
ffff8801df479800 4079859128 C Ci:5:002:0 0 1 = fb
ffff8801df479800 4079860569 S Ci:5:002:0 s 80 06 b504 2b07 0001 1 <
ffff8801df479800 4079861133 C Ci:5:002:0 0 1 = fb
ffff8801df479800 4079862587 S Ci:5:002:0 s 80 06 b504 fe08 0001 1 <
ffff8801df479800 4079863129 C Ci:5:002:0 0 1 = fb
ffff8801df479800 4079864600 S Ci:5:002:0 s 80 06 b504 2b09 0001 1 <
ffff8801df479800 4079865128 C Ci:5:002:0 0 1 = fb
ffff8801df479800 4079866617 S Ci:5:002:0 s 80 06 b504 fe0a 0001 1 <
ffff8801df479800 4079867128 C Ci:5:002:0 0 1 = fb
ffff8801df479800 4079868637 S Ci:5:002:0 s 80 06 b504 2b0b 0001 1 <
ffff8801df479800 4079869129 C Ci:5:002:0 0 1 = fb
ffff8801df479800 4079870569 S Ci:5:002:0 s 80 06 b504 fe0c 0001 1 <
ffff8801df479800 4079871129 C Ci:5:002:0 0 1 = fb
ffff8801df479800 4079872585 S Ci:5:002:0 s 80 06 b504 2b0d 0001 1 <
ffff8801df479800 4079873129 C Ci:5:002:0 0 1 = fb
ffff8801df479800 4079874609 S Ci:5:002:0 s 80 06 b504 fe0e 0001 1 <
ffff8801df479800 4079875131 C Ci:5:002:0 0 1 = fb
ffff8801df479800 4079876619 S Ci:5:002:0 s 80 06 b504 2b0f 0001 1 <
ffff8801df479800 4079877129 C Ci:5:002:0 0 1 = fb
ffff8801df479800 4079878638 S Ci:5:002:0 s 80 06 b504 fe10 0001 1 <
ffff8801df479800 4079879129 C Ci:5:002:0 0 1 = fb
ffff8801df479800 4079880569 S Ci:5:002:0 s 80 06 b504 2b11 0001 1 <
ffff8801df479800 4079881129 C Ci:5:002:0 0 1 = fb
ffff8801df479800 4079882585 S Ci:5:002:0 s 80 06 b504 fe12 0001 1 <
ffff8801df479800 4079883129 C Ci:5:002:0 0 1 = fb
ffff8801df479800 4079884600 S Ci:5:002:0 s 80 06 b504 2b13 0001 1 <
ffff8801df479800 4079885129 C Ci:5:002:0 0 1 = fb
ffff8801df479800 4079886617 S Ci:5:002:0 s 80 06 b504 fe14 0001 1 <
ffff8801df479800 4079887129 C Ci:5:002:0 0 1 = fb
ffff8801df479800 4079888637 S Ci:5:002:0 s 80 06 b504 2b15 0001 1 <
ffff8801df479800 4079889130 C Ci:5:002:0 0 1 = fb
ffff8801df479800 4079890569 S Ci:5:002:0 s 80 06 b504 fe16 0001 1 <
ffff8801df479800 4079891130 C Ci:5:002:0 0 1 = fb
ffff8801df479800 4079892584 S Ci:5:002:0 s 80 06 b504 2b17 0001 1 <
ffff8801df479800 4079893130 C Ci:5:002:0 0 1 = fb
ffff8801df479800 4079894599 S Ci:5:002:0 s 80 06 b504 fe18 0001 1 <
ffff8801df479800 4079895129 C Ci:5:002:0 0 1 = fb
ffff8801df479800 4079896617 S Ci:5:002:0 s 80 06 b504 2b19 0001 1 <
ffff8801df479800 4079897129 C Ci:5:002:0 0 1 = fb
ffff8801df479800 4079898635 S Ci:5:002:0 s 80 06 b504 fe1a 0001 1 <
ffff8801df479800 4079899130 C Ci:5:002:0 0 1 = fb
ffff8801df479800 4079900569 S Ci:5:002:0 s 80 06 b504 2b1b 0001 1 <
ffff8801df479800 4079901130 C Ci:5:002:0 0 1 = fb
ffff8801df479800 4079902584 S Ci:5:002:0 s 80 06 b504 fe1c 0001 1 <
ffff8801df479800 4079903130 C Ci:5:002:0 0 1 = fb
ffff8801df479800 4079904600 S Ci:5:002:0 s 80 06 b504 2b1d 0001 1 <
ffff8801df479800 4079905130 C Ci:5:002:0 0 1 = fb
ffff8801df479800 4079906656 S Ci:5:002:0 s 80 06 b504 fe1e 0001 1 <
ffff8801df479800 4079907131 C Ci:5:002:0 0 1 = fb
ffff8801df479800 4079908635 S Ci:5:002:0 s 80 06 b504 2b1f 0001 1 <
ffff8801df479800 4079909129 C Ci:5:002:0 0 1 = fb
ffff8801df479800 4079910569 S Ci:5:002:0 s 80 06 b504 fe20 0001 1 <
ffff8801df479800 4079911130 C Ci:5:002:0 0 1 = fb
ffff8801df479800 4079912584 S Ci:5:002:0 s 80 06 b504 2b21 0001 1 <
ffff8801df479800 4079913130 C Ci:5:002:0 0 1 = fb
ffff8801df479800 4079914599 S Ci:5:002:0 s 80 06 b504 fe22 0001 1 <
ffff8801df479800 4079915130 C Ci:5:002:0 0 1 = fb
ffff8801df479800 4079916615 S Ci:5:002:0 s 80 06 b504 2b23 0001 1 <
ffff8801df479800 4079917130 C Ci:5:002:0 0 1 = fb
ffff8801df479800 4079918635 S Ci:5:002:0 s 80 06 b504 0224 0001 1 <
ffff8801df479800 4079919130 C Ci:5:002:0 0 1 = fb
ffff8801df479800 4079920569 S Ci:5:002:0 s 80 06 b504 2525 0001 1 <
ffff8801df479800 4079921131 C Ci:5:002:0 0 1 = fb
ffff8801df479800 4079922584 S Ci:5:002:0 s 80 06 b504 0226 0001 1 <
ffff8801df479800 4079923131 C Ci:5:002:0 0 1 = fb
ffff8801df479800 4079924599 S Ci:5:002:0 s 80 06 b504 2427 0001 1 <
ffff8801df479800 4079925130 C Ci:5:002:0 0 1 = fb
ffff8801df479e00 4079926618 S Ci:5:002:0 s 80 06 b504 0428 0001 1 <
ffff8801df479e00 4079927131 C Ci:5:002:0 0 1 = fb
ffff8801df479e00 4079928635 S Ci:5:002:0 s 80 06 b504 2529 0001 1 <
ffff8801df479e00 4079929131 C Ci:5:002:0 0 1 = fb
ffff8801df479e00 4079930570 S Ci:5:002:0 s 80 06 b504 042a 0001 1 <
ffff8801df479e00 4079931131 C Ci:5:002:0 0 1 = fb
ffff8801df479e00 4079932585 S Ci:5:002:0 s 80 06 b504 242b 0001 1 <
ffff8801df479e00 4079933132 C Ci:5:002:0 0 1 = fb
ffff8801df479e00 4079934601 S Ci:5:002:0 s 80 06 b504 082c 0001 1 <
ffff8801df479e00 4079935131 C Ci:5:002:0 0 1 = fb
ffff8801df479e00 4079936616 S Ci:5:002:0 s 80 06 b504 252d 0001 1 <
ffff8801df479e00 4079937132 C Ci:5:002:0 0 1 = fb
ffff8801df479e00 4079938637 S Ci:5:002:0 s 80 06 b504 082e 0001 1 <
ffff8801df479e00 4079939130 C Ci:5:002:0 0 1 = fb
ffff8801df479e00 4079940569 S Ci:5:002:0 s 80 06 b504 242f 0001 1 <
ffff8801df479e00 4079941131 C Ci:5:002:0 0 1 = fb
ffff8801df479e00 4079942584 S Ci:5:002:0 s 80 06 b504 1030 0001 1 <
ffff8801df479e00 4079943131 C Ci:5:002:0 0 1 = fb
ffff8801df479e00 4079944600 S Ci:5:002:0 s 80 06 b504 2531 0001 1 <
ffff8801df479e00 4079945132 C Ci:5:002:0 0 1 = fb
ffff8801df479e00 4079946616 S Ci:5:002:0 s 80 06 b504 1032 0001 1 <
ffff8801df479e00 4079947132 C Ci:5:002:0 0 1 = fb
ffff8801df479e00 4079948636 S Ci:5:002:0 s 80 06 b504 2433 0001 1 <
ffff8801df479e00 4079949131 C Ci:5:002:0 0 1 = fb
ffff8801df479e00 4079950569 S Ci:5:002:0 s 80 06 b504 f634 0001 1 <
ffff8801df479e00 4079951131 C Ci:5:002:0 0 1 = fb
ffff8801df479e00 4079952584 S Ci:5:002:0 s 80 06 b504 2b35 0001 1 <
ffff8801df479e00 4079953132 C Ci:5:002:0 0 1 = fb
ffff8801df479e00 4079954599 S Ci:5:002:0 s 80 06 b504 fe36 0001 1 <
ffff8801df479e00 4079955131 C Ci:5:002:0 0 1 = fb
ffff8801df479e00 4079956615 S Ci:5:002:0 s 80 06 b504 2b37 0001 1 <
ffff8801df479e00 4079957132 C Ci:5:002:0 0 1 = fb
ffff8801df479e00 4079958642 S Ci:5:002:0 s 80 06 b504 f938 0001 1 <
ffff8801df479e00 4079959132 C Ci:5:002:0 0 1 = fb
ffff8801df479e00 4079960570 S Ci:5:002:0 s 80 06 b504 e039 0001 1 <
ffff8801df479e00 4079961132 C Ci:5:002:0 0 1 = fb
ffff8801df479e00 4079962585 S Ci:5:002:0 s 80 06 b504 fe3a 0001 1 <
ffff8801df479e00 4079963132 C Ci:5:002:0 0 1 = fb
ffff8801df479e00 4079964600 S Ci:5:002:0 s 80 06 b504 2b3b 0001 1 <
ffff8801df479e00 4079965132 C Ci:5:002:0 0 1 = fb
ffff8801df479e00 4079966616 S Ci:5:002:0 s 80 06 b504 fe3c 0001 1 <
ffff8801df479e00 4079967132 C Ci:5:002:0 0 1 = fb
ffff8801df479e00 4079968639 S Ci:5:002:0 s 80 06 b504 2b3d 0001 1 <
ffff8801df479e00 4079969132 C Ci:5:002:0 0 1 = fb
ffff8801df479e00 4079970570 S Ci:5:002:0 s 80 06 b504 fe3e 0001 1 <
ffff8801df479e00 4079971132 C Ci:5:002:0 0 1 = fb
ffff8801df479e00 4079972585 S Ci:5:002:0 s 80 06 b504 2b3f 0001 1 <
ffff8801df479e00 4079973132 C Ci:5:002:0 0 1 = fb
ffff8801df479e00 4079974600 S Ci:5:002:0 s 80 06 b500 9ac0 0001 1 <
ffff8801df479e00 4079976132 C Ci:5:002:0 0 1 = fb
ffff8801df479e00 4079978088 S Ci:5:002:0 s 80 06 b501 1ac0 0002 2 <
ffff8801df479e00 4079979132 C Ci:5:002:0 0 2 = fe2b
ffff8801df479e00 4079980570 S Ci:5:002:0 s 80 06 b501 1ac1 0002 2 <
ffff8801df479e00 4079981133 C Ci:5:002:0 0 2 = fe2b
ffff8801df479e00 4079982584 S Ci:5:002:0 s 80 06 b501 1ac2 0002 2 <
ffff8801df479e00 4079983133 C Ci:5:002:0 0 2 = fe2b
ffff8801df479e00 4079984599 S Ci:5:002:0 s 80 06 b501 1ac3 0002 2 <
ffff8801df479e00 4079985132 C Ci:5:002:0 0 2 = fe2b
ffff8801df479e00 4079986615 S Ci:5:002:0 s 80 06 b501 1ac4 0002 2 <
ffff8801df479e00 4079987133 C Ci:5:002:0 0 2 = fe2b
ffff8801df479e00 4079988637 S Ci:5:002:0 s 80 06 b501 1ac5 0002 2 <
ffff8801df479e00 4079989133 C Ci:5:002:0 0 2 = fe2b
ffff8801df479e00 4079990570 S Ci:5:002:0 s 80 06 b501 1ac6 0002 2 <
ffff8801df479e00 4079991133 C Ci:5:002:0 0 2 = fe2b
ffff8801df479e00 4079992584 S Ci:5:002:0 s 80 06 b501 1ac7 0002 2 <
ffff8801df479e00 4079993133 C Ci:5:002:0 0 2 = fe2b
ffff8801df479e00 4079994600 S Ci:5:002:0 s 80 06 b501 1ac8 0002 2 <
ffff8801df479e00 4079995133 C Ci:5:002:0 0 2 = fe2b
ffff8801df479e00 4079996616 S Ci:5:002:0 s 80 06 b501 1ac9 0002 2 <
ffff8801df479e00 4079997133 C Ci:5:002:0 0 2 = fe2b
ffff8801df479e00 4079998638 S Ci:5:002:0 s 80 06 b501 1aca 0002 2 <
ffff8801df479e00 4079999133 C Ci:5:002:0 0 2 = fe2b
ffff8801df479e00 4080000572 S Ci:5:002:0 s 80 06 b501 1acb 0002 2 <
ffff8801df479e00 4080001132 C Ci:5:002:0 0 2 = fe2b
ffff8801df479e00 4080002626 S Ci:5:002:0 s 80 06 b501 1acc 0002 2 <
ffff8801df479e00 4080003132 C Ci:5:002:0 0 2 = fe2b
ffff8801df479e00 4080004602 S Ci:5:002:0 s 80 06 b501 1acd 0002 2 <
ffff8801df479e00 4080005133 C Ci:5:002:0 0 2 = fe2b
ffff8801df479e00 4080006616 S Ci:5:002:0 s 80 06 b501 1ace 0002 2 <
ffff8801df479e00 4080007133 C Ci:5:002:0 0 2 = fe2b
ffff8801df479e00 4080008637 S Ci:5:002:0 s 80 06 b501 1acf 0002 2 <
ffff8801df479e00 4080009133 C Ci:5:002:0 0 2 = fe2b
ffff8801df479e00 4080010569 S Ci:5:002:0 s 80 06 b501 1ad0 0002 2 <
ffff8801df479e00 4080011134 C Ci:5:002:0 0 2 = fe2b
ffff8801df479e00 4080012583 S Ci:5:002:0 s 80 06 b501 1ad1 0002 2 <
ffff8801df479e00 4080013134 C Ci:5:002:0 0 2 = fe2b
ffff8801df479e00 4080014598 S Ci:5:002:0 s 80 06 b501 1ad2 0002 2 <
ffff8801df479e00 4080015134 C Ci:5:002:0 0 2 = 0225
ffff8801df479e00 4080016613 S Ci:5:002:0 s 80 06 b501 1ad3 0002 2 <
ffff8801df479e00 4080017134 C Ci:5:002:0 0 2 = 0224
ffff8801df479e00 4080018632 S Ci:5:002:0 s 80 06 b501 1ad4 0002 2 <
ffff8801df479e00 4080019134 C Ci:5:002:0 0 2 = 0425
ffff8801df479e00 4080020569 S Ci:5:002:0 s 80 06 b501 1ad5 0002 2 <
ffff8801df479e00 4080021134 C Ci:5:002:0 0 2 = 0424
ffff8801df479e00 4080022582 S Ci:5:002:0 s 80 06 b501 1ad6 0002 2 <
ffff8801df479e00 4080023134 C Ci:5:002:0 0 2 = 0825
ffff8801df479e00 4080024596 S Ci:5:002:0 s 80 06 b501 1ad7 0002 2 <
ffff8801df479e00 4080025134 C Ci:5:002:0 0 2 = 0824
ffff8801df479e00 4080026612 S Ci:5:002:0 s 80 06 b501 1ad8 0002 2 <
ffff8801df479e00 4080027134 C Ci:5:002:0 0 2 = 1025
ffff8801df479e00 4080028631 S Ci:5:002:0 s 80 06 b501 1ad9 0002 2 <
ffff8801df479e00 4080029134 C Ci:5:002:0 0 2 = 1024
ffff8801df479e00 4080030570 S Ci:5:002:0 s 80 06 b501 1ada 0002 2 <
ffff8801df479e00 4080031134 C Ci:5:002:0 0 2 = f62b
ffff8801df479e00 4080032585 S Ci:5:002:0 s 80 06 b501 1adb 0002 2 <
ffff8801df479e00 4080033134 C Ci:5:002:0 0 2 = fe2b
ffff8801df479e00 4080034608 S Ci:5:002:0 s 80 06 b501 1adc 0002 2 <
ffff8801df479e00 4080035137 C Ci:5:002:0 0 2 = f9e0
ffff8801df479e00 4080036617 S Ci:5:002:0 s 80 06 b501 1add 0002 2 <
ffff8801df479e00 4080037135 C Ci:5:002:0 0 2 = fe2b
ffff8801df479e00 4080038637 S Ci:5:002:0 s 80 06 b501 1ade 0002 2 <
ffff8801df479e00 4080039135 C Ci:5:002:0 0 2 = fe2b
ffff8801df479e00 4080040570 S Ci:5:002:0 s 80 06 b501 1adf 0002 2 <
ffff8801df479e00 4080041135 C Ci:5:002:0 0 2 = fe2b
ffff8801df479e00 4080042584 S Ci:5:002:0 s 80 06 b504 fe00 0001 1 <
ffff8801df479e00 4080043135 C Ci:5:002:0 0 1 = fb
ffff8801df479e00 4080044600 S Ci:5:002:0 s 80 06 b504 2b01 0001 1 <
ffff8801df479e00 4080045134 C Ci:5:002:0 0 1 = fb
ffff8801df479e00 4080046616 S Ci:5:002:0 s 80 06 b504 fe02 0001 1 <
ffff8801df479e00 4080047134 C Ci:5:002:0 0 1 = fb
ffff8801df479e00 4080048636 S Ci:5:002:0 s 80 06 b504 2b03 0001 1 <
ffff8801df479e00 4080049135 C Ci:5:002:0 0 1 = fb
ffff8801df479e00 4080050570 S Ci:5:002:0 s 80 06 b504 fe04 0001 1 <
ffff8801df479e00 4080051134 C Ci:5:002:0 0 1 = fb
ffff8801df479e00 4080052584 S Ci:5:002:0 s 80 06 b504 2b05 0001 1 <
ffff8801df479e00 4080053135 C Ci:5:002:0 0 1 = fb
ffff8801df479e00 4080054600 S Ci:5:002:0 s 80 06 b504 fe06 0001 1 <
ffff8801df479e00 4080055135 C Ci:5:002:0 0 1 = fb
ffff8801df479e00 4080056615 S Ci:5:002:0 s 80 06 b504 2b07 0001 1 <
ffff8801df479e00 4080057135 C Ci:5:002:0 0 1 = fb
ffff8801df479e00 4080058645 S Ci:5:002:0 s 80 06 b504 fe08 0001 1 <
ffff8801df479e00 4080059137 C Ci:5:002:0 0 1 = fb
ffff8801df479e00 4080060571 S Ci:5:002:0 s 80 06 b504 2b09 0001 1 <
ffff8801df479e00 4080061135 C Ci:5:002:0 0 1 = fb
ffff8801df479e00 4080062586 S Ci:5:002:0 s 80 06 b504 fe0a 0001 1 <
ffff8801df479e00 4080063135 C Ci:5:002:0 0 1 = fb
ffff8801df479e00 4080064602 S Ci:5:002:0 s 80 06 b504 2b0b 0001 1 <
ffff8801df479e00 4080065135 C Ci:5:002:0 0 1 = fb
ffff8801df479e00 4080066619 S Ci:5:002:0 s 80 06 b504 fe0c 0001 1 <
ffff8801df479e00 4080067135 C Ci:5:002:0 0 1 = fb
ffff8801df479e00 4080068642 S Ci:5:002:0 s 80 06 b504 2b0d 0001 1 <
ffff8801df479e00 4080069135 C Ci:5:002:0 0 1 = fb
ffff8801df479e00 4080070570 S Ci:5:002:0 s 80 06 b504 fe0e 0001 1 <
ffff8801df479e00 4080071136 C Ci:5:002:0 0 1 = fb
ffff8801df479e00 4080072584 S Ci:5:002:0 s 80 06 b504 2b0f 0001 1 <
ffff8801df479e00 4080073136 C Ci:5:002:0 0 1 = fb
ffff8801df479e00 4080074600 S Ci:5:002:0 s 80 06 b504 fe10 0001 1 <
ffff8801df479e00 4080075135 C Ci:5:002:0 0 1 = fb
ffff8801df479e00 4080076616 S Ci:5:002:0 s 80 06 b504 2b11 0001 1 <
ffff8801df479e00 4080077135 C Ci:5:002:0 0 1 = fb
ffff8801df479e00 4080078634 S Ci:5:002:0 s 80 06 b504 fe12 0001 1 <
ffff8801df479e00 4080079135 C Ci:5:002:0 0 1 = fb
ffff8801df479e00 4080080569 S Ci:5:002:0 s 80 06 b504 2b13 0001 1 <
ffff8801df479e00 4080081136 C Ci:5:002:0 0 1 = fb
ffff8801df479e00 4080082583 S Ci:5:002:0 s 80 06 b504 fe14 0001 1 <
ffff8801df479e00 4080083136 C Ci:5:002:0 0 1 = fb
ffff8801df479e00 4080084597 S Ci:5:002:0 s 80 06 b504 2b15 0001 1 <
ffff8801df479e00 4080085136 C Ci:5:002:0 0 1 = fb
ffff8801df479e00 4080086612 S Ci:5:002:0 s 80 06 b504 fe16 0001 1 <
ffff8801df479e00 4080087136 C Ci:5:002:0 0 1 = fb
ffff8801df479e00 4080088628 S Ci:5:002:0 s 80 06 b504 2b17 0001 1 <
ffff8801df479e00 4080089136 C Ci:5:002:0 0 1 = fb
ffff8801df479e00 4080090570 S Ci:5:002:0 s 80 06 b504 fe18 0001 1 <
ffff8801df479e00 4080091136 C Ci:5:002:0 0 1 = fb
ffff8801df479e00 4080092584 S Ci:5:002:0 s 80 06 b504 2b19 0001 1 <
ffff8801df479e00 4080093136 C Ci:5:002:0 0 1 = fb
ffff8801df479e00 4080094599 S Ci:5:002:0 s 80 06 b504 fe1a 0001 1 <
ffff8801df479e00 4080095136 C Ci:5:002:0 0 1 = fb
ffff8801df479e00 4080096615 S Ci:5:002:0 s 80 06 b504 2b1b 0001 1 <
ffff8801df479e00 4080097136 C Ci:5:002:0 0 1 = fb
ffff8801df479e00 4080098633 S Ci:5:002:0 s 80 06 b504 fe1c 0001 1 <
ffff8801df479e00 4080099137 C Ci:5:002:0 0 1 = fb
ffff8801df479740 4080100573 S Ci:5:002:0 s 80 06 b504 2b1d 0001 1 <
ffff8801df479740 4080101137 C Ci:5:002:0 0 1 = fb
ffff8801df479740 4080102584 S Ci:5:002:0 s 80 06 b504 fe1e 0001 1 <
ffff8801df479740 4080103137 C Ci:5:002:0 0 1 = fb
ffff8801df479740 4080104600 S Ci:5:002:0 s 80 06 b504 2b1f 0001 1 <
ffff8801df479740 4080105137 C Ci:5:002:0 0 1 = fb
ffff8801df479740 4080106616 S Ci:5:002:0 s 80 06 b504 0120 0001 1 <
ffff8801df479740 4080107137 C Ci:5:002:0 0 1 = fb
ffff8801df479740 4080108631 S Ci:5:002:0 s 80 06 b504 2521 0001 1 <
ffff8801df479740 4080109137 C Ci:5:002:0 0 1 = fb
ffff8801df479740 4080110570 S Ci:5:002:0 s 80 06 b504 1022 0001 1 <
ffff8801df479740 4080111137 C Ci:5:002:0 0 1 = fb
ffff8801df479740 4080112585 S Ci:5:002:0 s 80 06 b504 2823 0001 1 <
ffff8801df479740 4080113137 C Ci:5:002:0 0 1 = fb
ffff8801df479740 4080114602 S Ci:5:002:0 s 80 06 b504 0124 0001 1 <
ffff8801df479740 4080115137 C Ci:5:002:0 0 1 = fb
ffff8801df479740 4080116616 S Ci:5:002:0 s 80 06 b504 2425 0001 1 <
ffff8801df479740 4080117137 C Ci:5:002:0 0 1 = fb
ffff8801df479740 4080118645 S Ci:5:002:0 s 80 06 b504 1026 0001 1 <
ffff8801df479740 4080119141 C Ci:5:002:0 0 1 = fb
ffff8801df479740 4080120576 S Ci:5:002:0 s 80 06 b504 2827 0001 1 <
ffff8801df479740 4080121138 C Ci:5:002:0 0 1 = fb
ffff8801df479740 4080122588 S Ci:5:002:0 s 80 06 b504 0128 0001 1 <
ffff8801df479740 4080123139 C Ci:5:002:0 0 1 = fb
ffff8801df479740 4080124602 S Ci:5:002:0 s 80 06 b504 2529 0001 1 <
ffff8801df479740 4080125138 C Ci:5:002:0 0 1 = fb
ffff8801df479e00 4080126621 S Ci:5:002:0 s 80 06 b504 102a 0001 1 <
ffff8801df479e00 4080127138 C Ci:5:002:0 0 1 = fb
ffff8801df479e00 4080128634 S Ci:5:002:0 s 80 06 b504 282b 0001 1 <
ffff8801df479e00 4080129138 C Ci:5:002:0 0 1 = fb
ffff8801df479e00 4080130572 S Ci:5:002:0 s 80 06 b504 012c 0001 1 <
ffff8801df479e00 4080131138 C Ci:5:002:0 0 1 = fb
ffff8801df479e00 4080132585 S Ci:5:002:0 s 80 06 b504 242d 0001 1 <
ffff8801df479e00 4080133138 C Ci:5:002:0 0 1 = fb
ffff8801df479e00 4080134601 S Ci:5:002:0 s 80 06 b504 102e 0001 1 <
ffff8801df479e00 4080135137 C Ci:5:002:0 0 1 = fb
ffff8801df479e00 4080136616 S Ci:5:002:0 s 80 06 b504 282f 0001 1 <
ffff8801df479e00 4080137137 C Ci:5:002:0 0 1 = fb
ffff8801df479e00 4080138632 S Ci:5:002:0 s 80 06 b504 fd30 0001 1 <
ffff8801df479e00 4080139138 C Ci:5:002:0 0 1 = fb
ffff8801df479e00 4080140570 S Ci:5:002:0 s 80 06 b504 2b31 0001 1 <
ffff8801df479e00 4080141138 C Ci:5:002:0 0 1 = fb
ffff8801df479e00 4080142584 S Ci:5:002:0 s 80 06 b504 0132 0001 1 <
ffff8801df479e00 4080143138 C Ci:5:002:0 0 1 = fb
ffff8801df479800 4080144604 S Ci:5:002:0 s 80 06 b504 2533 0001 1 <
ffff8801df479800 4080145139 C Ci:5:002:0 0 1 = fb
ffff8801df479800 4080146616 S Ci:5:002:0 s 80 06 b504 4034 0001 1 <
ffff8801df479800 4080147138 C Ci:5:002:0 0 1 = fb
ffff8801df479800 4080148631 S Ci:5:002:0 s 80 06 b504 2835 0001 1 <
ffff8801df479800 4080149138 C Ci:5:002:0 0 1 = fb
ffff8801df479800 4080150570 S Ci:5:002:0 s 80 06 b504 0136 0001 1 <
ffff8801df479800 4080151137 C Ci:5:002:0 0 1 = fb
ffff8801df479800 4080152584 S Ci:5:002:0 s 80 06 b504 2437 0001 1 <
ffff8801df479800 4080153138 C Ci:5:002:0 0 1 = fb
ffff8801df479800 4080154599 S Ci:5:002:0 s 80 06 b504 4038 0001 1 <
ffff8801df479800 4080155138 C Ci:5:002:0 0 1 = fb
ffff8801df479800 4080156615 S Ci:5:002:0 s 80 06 b504 2839 0001 1 <
ffff8801df479800 4080157138 C Ci:5:002:0 0 1 = fb
ffff8801df479800 4080158630 S Ci:5:002:0 s 80 06 b504 013a 0001 1 <
ffff8801df479800 4080159139 C Ci:5:002:0 0 1 = fb
ffff8801df479800 4080160573 S Ci:5:002:0 s 80 06 b504 253b 0001 1 <
ffff8801df479800 4080161139 C Ci:5:002:0 0 1 = fb
ffff8801df479800 4080162585 S Ci:5:002:0 s 80 06 b504 403c 0001 1 <
ffff8801df479800 4080163139 C Ci:5:002:0 0 1 = fb
ffff8801df479800 4080164599 S Ci:5:002:0 s 80 06 b504 283d 0001 1 <
ffff8801df479800 4080165138 C Ci:5:002:0 0 1 = fb
ffff8801df479800 4080166615 S Ci:5:002:0 s 80 06 b504 013e 0001 1 <
ffff8801df479800 4080167138 C Ci:5:002:0 0 1 = fb
ffff8801df479800 4080168633 S Ci:5:002:0 s 80 06 b504 243f 0001 1 <
ffff8801df479800 4080169139 C Ci:5:002:0 0 1 = fb
ffff8801df479800 4080170578 S Ci:5:002:0 s 80 06 b500 9ae0 0001 1 <
ffff8801df479800 4080172139 C Ci:5:002:0 0 1 = fb
ffff8801df479800 4080173886 S Ci:5:002:0 s 80 06 b501 1ae0 0002 2 <
ffff8801df479800 4080174140 C Ci:5:002:0 0 2 = fe2b
ffff8801df479800 4080175611 S Ci:5:002:0 s 80 06 b501 1ae1 0002 2 <
ffff8801df479800 4080176139 C Ci:5:002:0 0 2 = fe2b
ffff8801df479800 4080177624 S Ci:5:002:0 s 80 06 b501 1ae2 0002 2 <
ffff8801df479800 4080178138 C Ci:5:002:0 0 2 = fe2b
ffff8801df479800 4080179565 S Ci:5:002:0 s 80 06 b501 1ae3 0002 2 <
ffff8801df479800 4080180139 C Ci:5:002:0 0 2 = fe2b
ffff8801df479800 4080181577 S Ci:5:002:0 s 80 06 b501 1ae4 0002 2 <
ffff8801df479800 4080182139 C Ci:5:002:0 0 2 = fe2b
ffff8801df479800 4080183593 S Ci:5:002:0 s 80 06 b501 1ae5 0002 2 <
ffff8801df479800 4080184139 C Ci:5:002:0 0 2 = fe2b
ffff8801df479800 4080185610 S Ci:5:002:0 s 80 06 b501 1ae6 0002 2 <
ffff8801df479800 4080186139 C Ci:5:002:0 0 2 = fe2b
ffff8801f4df89c0 4080187632 S Ci:5:002:0 s 80 06 b501 1ae7 0002 2 <
ffff8801f4df89c0 4080188139 C Ci:5:002:0 0 2 = fe2b
ffff8801f4df89c0 4080189564 S Ci:5:002:0 s 80 06 b501 1ae8 0002 2 <
ffff8801f4df89c0 4080190140 C Ci:5:002:0 0 2 = fe2b
ffff8801f4df89c0 4080191577 S Ci:5:002:0 s 80 06 b501 1ae9 0002 2 <
ffff8801f4df89c0 4080192140 C Ci:5:002:0 0 2 = fe2b
ffff8801f4df89c0 4080193592 S Ci:5:002:0 s 80 06 b501 1aea 0002 2 <
ffff8801f4df89c0 4080194140 C Ci:5:002:0 0 2 = fe2b
ffff8801f4df89c0 4080195609 S Ci:5:002:0 s 80 06 b501 1aeb 0002 2 <
ffff8801f4df89c0 4080196139 C Ci:5:002:0 0 2 = fe2b
ffff8801f4df89c0 4080197625 S Ci:5:002:0 s 80 06 b501 1aec 0002 2 <
ffff8801f4df89c0 4080198140 C Ci:5:002:0 0 2 = fe2b
ffff8801f4df89c0 4080199563 S Ci:5:002:0 s 80 06 b501 1aed 0002 2 <
ffff8801f4df89c0 4080200140 C Ci:5:002:0 0 2 = fe2b
ffff8801f4df89c0 4080201576 S Ci:5:002:0 s 80 06 b501 1aee 0002 2 <
ffff8801f4df89c0 4080202140 C Ci:5:002:0 0 2 = fe2b
ffff8801f4df89c0 4080203592 S Ci:5:002:0 s 80 06 b501 1aef 0002 2 <
ffff8801f4df89c0 4080204140 C Ci:5:002:0 0 2 = fe2b
ffff8801f4df89c0 4080205609 S Ci:5:002:0 s 80 06 b501 1af0 0002 2 <
ffff8801f4df89c0 4080206140 C Ci:5:002:0 0 2 = 0125
ffff8801f4df89c0 4080207623 S Ci:5:002:0 s 80 06 b501 1af1 0002 2 <
ffff8801f4df89c0 4080208140 C Ci:5:002:0 0 2 = 1028
ffff8801f4df89c0 4080209564 S Ci:5:002:0 s 80 06 b501 1af2 0002 2 <
ffff8801f4df89c0 4080210140 C Ci:5:002:0 0 2 = 0124
ffff8801f4df89c0 4080211577 S Ci:5:002:0 s 80 06 b501 1af3 0002 2 <
ffff8801f4df89c0 4080212140 C Ci:5:002:0 0 2 = 1028
ffff8801f4df89c0 4080213593 S Ci:5:002:0 s 80 06 b501 1af4 0002 2 <
ffff8801f4df89c0 4080214140 C Ci:5:002:0 0 2 = 0125
ffff8801f4df89c0 4080215610 S Ci:5:002:0 s 80 06 b501 1af5 0002 2 <
ffff8801f4df89c0 4080216140 C Ci:5:002:0 0 2 = 1028
ffff8801f4df89c0 4080217623 S Ci:5:002:0 s 80 06 b501 1af6 0002 2 <
ffff8801f4df89c0 4080218140 C Ci:5:002:0 0 2 = 0124
ffff8801f4df89c0 4080219564 S Ci:5:002:0 s 80 06 b501 1af7 0002 2 <
ffff8801f4df89c0 4080220141 C Ci:5:002:0 0 2 = 1028
ffff8801f4df89c0 4080221577 S Ci:5:002:0 s 80 06 b501 1af8 0002 2 <
ffff8801f4df89c0 4080222141 C Ci:5:002:0 0 2 = fd2b
ffff8801f4df89c0 4080223592 S Ci:5:002:0 s 80 06 b501 1af9 0002 2 <
ffff8801f4df89c0 4080224141 C Ci:5:002:0 0 2 = 0125
ffff8801f4df89c0 4080225610 S Ci:5:002:0 s 80 06 b501 1afa 0002 2 <
ffff8801f4df89c0 4080226140 C Ci:5:002:0 0 2 = 4028
ffff8801f4df89c0 4080227624 S Ci:5:002:0 s 80 06 b501 1afb 0002 2 <
ffff8801f4df89c0 4080228140 C Ci:5:002:0 0 2 = 0124
ffff8801f4df89c0 4080229561 S Ci:5:002:0 s 80 06 b501 1afc 0002 2 <
ffff8801f4df89c0 4080230141 C Ci:5:002:0 0 2 = 4028
ffff8801f4df89c0 4080231577 S Ci:5:002:0 s 80 06 b501 1afd 0002 2 <
ffff8801f4df89c0 4080232141 C Ci:5:002:0 0 2 = 0125
ffff8801f4df89c0 4080233592 S Ci:5:002:0 s 80 06 b501 1afe 0002 2 <
ffff8801f4df89c0 4080234141 C Ci:5:002:0 0 2 = 4028
ffff8801f4df89c0 4080235610 S Ci:5:002:0 s 80 06 b501 1aff 0002 2 <
ffff8801f4df89c0 4080236141 C Ci:5:002:0 0 2 = 0124
ffff8801f4df89c0 4080237624 S Ci:5:002:0 s 80 06 b502 1b00 0001 1 <
ffff8801f4df89c0 4080263146 C Ci:5:002:0 0 1 = fb
ffff8801f4df89c0 4080264602 S Ci:5:002:0 s 80 06 b504 4000 0001 1 <
ffff8801f4df89c0 4080265142 C Ci:5:002:0 0 1 = fb
ffff8801f4df89c0 4080266616 S Ci:5:002:0 s 80 06 b504 2801 0001 1 <
ffff8801f4df89c0 4080267142 C Ci:5:002:0 0 1 = fb
ffff8801f4df89c0 4080268631 S Ci:5:002:0 s 80 06 b504 0102 0001 1 <
ffff8801f4df89c0 4080269142 C Ci:5:002:0 0 1 = fb
ffff8801f4df89c0 4080270572 S Ci:5:002:0 s 80 06 b504 2503 0001 1 <
ffff8801f4df89c0 4080271142 C Ci:5:002:0 0 1 = fb
ffff8801f4df89c0 4080272584 S Ci:5:002:0 s 80 06 b504 4004 0001 1 <
ffff8801f4df89c0 4080273142 C Ci:5:002:0 0 1 = fb
ffff8801f4df89c0 4080274600 S Ci:5:002:0 s 80 06 b504 2805 0001 1 <
ffff8801f4df89c0 4080275142 C Ci:5:002:0 0 1 = fb
ffff8801f4df89c0 4080276616 S Ci:5:002:0 s 80 06 b504 0106 0001 1 <
ffff8801f4df89c0 4080277142 C Ci:5:002:0 0 1 = fb
ffff8801f4df89c0 4080278632 S Ci:5:002:0 s 80 06 b504 2407 0001 1 <
ffff8801f4df89c0 4080279142 C Ci:5:002:0 0 1 = fb
ffff8801f4df89c0 4080280571 S Ci:5:002:0 s 80 06 b504 fd08 0001 1 <
ffff8801f4df89c0 4080281143 C Ci:5:002:0 0 1 = fb
ffff8801f4df89c0 4080282585 S Ci:5:002:0 s 80 06 b504 2b09 0001 1 <
ffff8801f4df89c0 4080283142 C Ci:5:002:0 0 1 = fb
ffff8801f4df89c0 4080284600 S Ci:5:002:0 s 80 06 b504 ff0a 0001 1 <
ffff8801f4df89c0 4080285143 C Ci:5:002:0 0 1 = fb
ffff8801f4df89c0 4080286616 S Ci:5:002:0 s 80 06 b504 ff0b 0001 1 <
ffff8801f4df89c0 4080287142 C Ci:5:002:0 0 1 = fb
ffff8801f4df89c0 4080288632 S Ci:5:002:0 s 80 06 b504 ff0c 0001 1 <
ffff8801f4df89c0 4080289143 C Ci:5:002:0 0 1 = fb
ffff8801f4df89c0 4080290572 S Ci:5:002:0 s 80 06 b504 ff0d 0001 1 <
ffff8801f4df89c0 4080291143 C Ci:5:002:0 0 1 = fb
ffff8801f4df89c0 4080292585 S Ci:5:002:0 s 80 06 b504 ff0e 0001 1 <
ffff8801f4df89c0 4080293142 C Ci:5:002:0 0 1 = fb
ffff8801f4df89c0 4080294600 S Ci:5:002:0 s 80 06 b504 ff0f 0001 1 <
ffff8801f4df89c0 4080295143 C Ci:5:002:0 0 1 = fb
ffff8801f4df89c0 4080296616 S Ci:5:002:0 s 80 06 b504 ff10 0001 1 <
ffff8801f4df89c0 4080297143 C Ci:5:002:0 0 1 = fb
ffff8801f4df89c0 4080298632 S Ci:5:002:0 s 80 06 b504 ff11 0001 1 <
ffff8801f4df89c0 4080299143 C Ci:5:002:0 0 1 = fb
ffff8801f4df89c0 4080300571 S Ci:5:002:0 s 80 06 b504 ff12 0001 1 <
ffff8801f4df89c0 4080301143 C Ci:5:002:0 0 1 = fb
ffff8801f4df89c0 4080302584 S Ci:5:002:0 s 80 06 b504 ff13 0001 1 <
ffff8801f4df89c0 4080303143 C Ci:5:002:0 0 1 = fb
ffff8801f4df89c0 4080304600 S Ci:5:002:0 s 80 06 b504 ff14 0001 1 <
ffff8801f4df89c0 4080305143 C Ci:5:002:0 0 1 = fb
ffff8801f4df89c0 4080306616 S Ci:5:002:0 s 80 06 b504 ff15 0001 1 <
ffff8801f4df89c0 4080307143 C Ci:5:002:0 0 1 = fb
ffff8801f4df89c0 4080308631 S Ci:5:002:0 s 80 06 b504 ff16 0001 1 <
ffff8801f4df89c0 4080309143 C Ci:5:002:0 0 1 = fb
ffff8801f4df89c0 4080310571 S Ci:5:002:0 s 80 06 b504 ff17 0001 1 <
ffff8801f4df89c0 4080311144 C Ci:5:002:0 0 1 = fb
ffff8801f4df89c0 4080312585 S Ci:5:002:0 s 80 06 b504 ff18 0001 1 <
ffff8801f4df89c0 4080313144 C Ci:5:002:0 0 1 = fb
ffff8801f4df89c0 4080314600 S Ci:5:002:0 s 80 06 b504 ff19 0001 1 <
ffff8801f4df89c0 4080315144 C Ci:5:002:0 0 1 = fb
ffff8801f4df89c0 4080316615 S Ci:5:002:0 s 80 06 b504 ff1a 0001 1 <
ffff8801f4df89c0 4080317143 C Ci:5:002:0 0 1 = fb
ffff8801f4df89c0 4080318631 S Ci:5:002:0 s 80 06 b504 ff1b 0001 1 <
ffff8801f4df89c0 4080319144 C Ci:5:002:0 0 1 = fb
ffff8801f4df89c0 4080320571 S Ci:5:002:0 s 80 06 b504 ff1c 0001 1 <
ffff8801f4df89c0 4080321143 C Ci:5:002:0 0 1 = fb
ffff8801f4df89c0 4080322585 S Ci:5:002:0 s 80 06 b504 ff1d 0001 1 <
ffff8801f4df89c0 4080323144 C Ci:5:002:0 0 1 = fb
ffff8801f4df89c0 4080324600 S Ci:5:002:0 s 80 06 b504 ff1e 0001 1 <
ffff8801f4df89c0 4080325144 C Ci:5:002:0 0 1 = fb
ffff8801df479800 4080326619 S Ci:5:002:0 s 80 06 b504 ff1f 0001 1 <
ffff8801df479800 4080327144 C Ci:5:002:0 0 1 = fb
ffff8801df479800 4080328632 S Ci:5:002:0 s 80 06 b504 ff20 0001 1 <
ffff8801df479800 4080329144 C Ci:5:002:0 0 1 = fb
ffff8801df479800 4080330572 S Ci:5:002:0 s 80 06 b504 ff21 0001 1 <
ffff8801df479800 4080331144 C Ci:5:002:0 0 1 = fb
ffff8801df479800 4080332585 S Ci:5:002:0 s 80 06 b504 ff22 0001 1 <
ffff8801df479800 4080333144 C Ci:5:002:0 0 1 = fb
ffff8801df479800 4080334608 S Ci:5:002:0 s 80 06 b504 ff23 0001 1 <
ffff8801df479800 4080335145 C Ci:5:002:0 0 1 = fb
ffff8801df479800 4080336618 S Ci:5:002:0 s 80 06 b504 ff24 0001 1 <
ffff8801df479800 4080337144 C Ci:5:002:0 0 1 = fb
ffff8801df479800 4080338632 S Ci:5:002:0 s 80 06 b504 ff25 0001 1 <
ffff8801df479800 4080339144 C Ci:5:002:0 0 1 = fb
ffff8801df479800 4080340574 S Ci:5:002:0 s 80 06 b504 ff26 0001 1 <
ffff8801df479800 4080341145 C Ci:5:002:0 0 1 = fb
ffff8801df479800 4080342585 S Ci:5:002:0 s 80 06 b504 ff27 0001 1 <
ffff8801df479800 4080343145 C Ci:5:002:0 0 1 = fb
ffff8801df479800 4080344600 S Ci:5:002:0 s 80 06 b504 ff28 0001 1 <
ffff8801df479800 4080345145 C Ci:5:002:0 0 1 = fb
ffff8801df479800 4080346617 S Ci:5:002:0 s 80 06 b504 ff29 0001 1 <
ffff8801df479800 4080347144 C Ci:5:002:0 0 1 = fb
ffff8801df479800 4080348632 S Ci:5:002:0 s 80 06 b504 ff2a 0001 1 <
ffff8801df479800 4080349144 C Ci:5:002:0 0 1 = fb
ffff8801df479800 4080350572 S Ci:5:002:0 s 80 06 b504 ff2b 0001 1 <
ffff8801df479800 4080351144 C Ci:5:002:0 0 1 = fb
ffff8801f4df89c0 4080352589 S Ci:5:002:0 s 80 06 b504 ff2c 0001 1 <
ffff8801f4df89c0 4080353146 C Ci:5:002:0 0 1 = fb
ffff8801f4df89c0 4080354601 S Ci:5:002:0 s 80 06 b504 ff2d 0001 1 <
ffff8801f4df89c0 4080355145 C Ci:5:002:0 0 1 = fb
ffff8801f4df89c0 4080356616 S Ci:5:002:0 s 80 06 b504 ff2e 0001 1 <
ffff8801f4df89c0 4080357145 C Ci:5:002:0 0 1 = fb
ffff8801f4df89c0 4080358632 S Ci:5:002:0 s 80 06 b504 ff2f 0001 1 <
ffff8801f4df89c0 4080359145 C Ci:5:002:0 0 1 = fb
ffff8801f4df89c0 4080360572 S Ci:5:002:0 s 80 06 b504 ff30 0001 1 <
ffff8801f4df89c0 4080361145 C Ci:5:002:0 0 1 = fb
ffff8801f4df89c0 4080362590 S Ci:5:002:0 s 80 06 b504 ff31 0001 1 <
ffff8801f4df89c0 4080363145 C Ci:5:002:0 0 1 = fb
ffff8801f4df89c0 4080364600 S Ci:5:002:0 s 80 06 b504 ff32 0001 1 <
ffff8801f4df89c0 4080365145 C Ci:5:002:0 0 1 = fb
ffff8801f4df89c0 4080366615 S Ci:5:002:0 s 80 06 b504 ff33 0001 1 <
ffff8801f4df89c0 4080367145 C Ci:5:002:0 0 1 = fb
ffff8801f4df89c0 4080368630 S Ci:5:002:0 s 80 06 b504 ff34 0001 1 <
ffff8801f4df89c0 4080369145 C Ci:5:002:0 0 1 = fb
ffff8801f4df89c0 4080370572 S Ci:5:002:0 s 80 06 b504 ff35 0001 1 <
ffff8801f4df89c0 4080371145 C Ci:5:002:0 0 1 = fb
ffff8801f4df89c0 4080372587 S Ci:5:002:0 s 80 06 b504 ff36 0001 1 <
ffff8801f4df89c0 4080373146 C Ci:5:002:0 0 1 = fb
ffff8801f4df89c0 4080374600 S Ci:5:002:0 s 80 06 b504 ff37 0001 1 <
ffff8801f4df89c0 4080375146 C Ci:5:002:0 0 1 = fb
ffff8801f4df89c0 4080376616 S Ci:5:002:0 s 80 06 b504 ff38 0001 1 <
ffff8801f4df89c0 4080377145 C Ci:5:002:0 0 1 = fb
ffff8801f4df89c0 4080378631 S Ci:5:002:0 s 80 06 b504 ff39 0001 1 <
ffff8801f4df89c0 4080379145 C Ci:5:002:0 0 1 = fb
ffff8801f4df89c0 4080380572 S Ci:5:002:0 s 80 06 b504 ff3a 0001 1 <
ffff8801f4df89c0 4080381145 C Ci:5:002:0 0 1 = fb
ffff8801f4df89c0 4080382585 S Ci:5:002:0 s 80 06 b504 ff3b 0001 1 <
ffff8801f4df89c0 4080383146 C Ci:5:002:0 0 1 = fb
ffff8801f4df89c0 4080384600 S Ci:5:002:0 s 80 06 b504 ff3c 0001 1 <
ffff8801f4df89c0 4080385146 C Ci:5:002:0 0 1 = fb
ffff8801f4df89c0 4080386616 S Ci:5:002:0 s 80 06 b504 ff3d 0001 1 <
ffff8801f4df89c0 4080387146 C Ci:5:002:0 0 1 = fb
ffff8801f4df89c0 4080388631 S Ci:5:002:0 s 80 06 b504 ff3e 0001 1 <
ffff8801f4df89c0 4080389146 C Ci:5:002:0 0 1 = fb
ffff8801f4df80c0 4080390579 S Ci:5:002:0 s 80 06 b504 ff3f 0001 1 <
ffff8801f4df80c0 4080391148 C Ci:5:002:0 0 1 = fb
ffff8801f4df80c0 4080392584 S Ci:5:002:0 s 80 06 b500 9b00 0001 1 <
ffff8801f4df80c0 4080394146 C Ci:5:002:0 0 1 = fb
ffff8801f4df80c0 4080396077 S Ci:5:002:0 s 80 06 b501 1b00 0002 2 <
ffff8801f4df80c0 4080397146 C Ci:5:002:0 0 2 = 4028
ffff8801f4df80c0 4080398631 S Ci:5:002:0 s 80 06 b501 1b01 0002 2 <
ffff8801f4df80c0 4080399146 C Ci:5:002:0 0 2 = 0125
ffff8801f4df89c0 4080400617 S Ci:5:002:0 s 80 06 b501 1b02 0002 2 <
ffff8801f4df89c0 4080401146 C Ci:5:002:0 0 2 = 4028
ffff8801f4df89c0 4080402585 S Ci:5:002:0 s 80 06 b501 1b03 0002 2 <
ffff8801f4df89c0 4080403147 C Ci:5:002:0 0 2 = 0124
ffff8801f4df89c0 4080404600 S Ci:5:002:0 s 80 06 b501 1b04 0002 2 <
ffff8801f4df89c0 4080405147 C Ci:5:002:0 0 2 = fd2b
ffff8801f4df89c0 4080406615 S Ci:5:002:0 s 80 06 b501 1b05 0002 2 <
ffff8801f4df89c0 4080407147 C Ci:5:002:0 0 2 = ffff
ffff8801f4df89c0 4080408631 S Ci:5:002:0 s 80 06 b501 1b06 0002 2 <
ffff8801f4df89c0 4080409146 C Ci:5:002:0 0 2 = ffff
ffff8801f4df89c0 4080410570 S Ci:5:002:0 s 80 06 b501 1b07 0002 2 <
ffff8801f4df89c0 4080411146 C Ci:5:002:0 0 2 = ffff
ffff8801f4df89c0 4080412584 S Ci:5:002:0 s 80 06 b501 1b08 0002 2 <
ffff8801f4df89c0 4080413147 C Ci:5:002:0 0 2 = ffff
ffff8801f4df89c0 4080414600 S Ci:5:002:0 s 80 06 b501 1b09 0002 2 <
ffff8801f4df89c0 4080415147 C Ci:5:002:0 0 2 = ffff
ffff8801f4df89c0 4080416615 S Ci:5:002:0 s 80 06 b501 1b0a 0002 2 <
ffff8801f4df89c0 4080417147 C Ci:5:002:0 0 2 = ffff
ffff8801f4df89c0 4080418630 S Ci:5:002:0 s 80 06 b501 1b0b 0002 2 <
ffff8801f4df89c0 4080419147 C Ci:5:002:0 0 2 = ffff
ffff8801f4df89c0 4080420569 S Ci:5:002:0 s 80 06 b501 1b0c 0002 2 <
ffff8801f4df89c0 4080421147 C Ci:5:002:0 0 2 = ffff
ffff8801f4df89c0 4080422585 S Ci:5:002:0 s 80 06 b501 1b0d 0002 2 <
ffff8801f4df89c0 4080423147 C Ci:5:002:0 0 2 = ffff
ffff8801f4df89c0 4080424600 S Ci:5:002:0 s 80 06 b501 1b0e 0002 2 <
ffff8801f4df89c0 4080425147 C Ci:5:002:0 0 2 = ffff
ffff8801f4df89c0 4080426617 S Ci:5:002:0 s 80 06 b501 1b0f 0002 2 <
ffff8801f4df89c0 4080427146 C Ci:5:002:0 0 2 = ffff
ffff8801f4df89c0 4080428632 S Ci:5:002:0 s 80 06 b501 1b10 0002 2 <
ffff8801f4df89c0 4080429147 C Ci:5:002:0 0 2 = ffff
ffff8801f4df89c0 4080430569 S Ci:5:002:0 s 80 06 b501 1b11 0002 2 <
ffff8801f4df89c0 4080431147 C Ci:5:002:0 0 2 = ffff
ffff8801f4df89c0 4080432587 S Ci:5:002:0 s 80 06 b501 1b12 0002 2 <
ffff8801f4df89c0 4080433148 C Ci:5:002:0 0 2 = ffff
ffff8801f4df89c0 4080434600 S Ci:5:002:0 s 80 06 b501 1b13 0002 2 <
ffff8801f4df89c0 4080435148 C Ci:5:002:0 0 2 = ffff
ffff8801f4df80c0 4080436618 S Ci:5:002:0 s 80 06 b501 1b14 0002 2 <
ffff8801f4df80c0 4080437149 C Ci:5:002:0 0 2 = ffff
ffff8801f4df80c0 4080438632 S Ci:5:002:0 s 80 06 b501 1b15 0002 2 <
ffff8801f4df80c0 4080439148 C Ci:5:002:0 0 2 = ffff
ffff8801f4df80c0 4080440569 S Ci:5:002:0 s 80 06 b501 1b16 0002 2 <
ffff8801f4df80c0 4080441148 C Ci:5:002:0 0 2 = ffff
ffff8801f4df80c0 4080442586 S Ci:5:002:0 s 80 06 b501 1b17 0002 2 <
ffff8801f4df80c0 4080443148 C Ci:5:002:0 0 2 = ffff
ffff8801f4df80c0 4080444599 S Ci:5:002:0 s 80 06 b501 1b18 0002 2 <
ffff8801f4df80c0 4080445147 C Ci:5:002:0 0 2 = ffff
ffff8801f4df80c0 4080446615 S Ci:5:002:0 s 80 06 b501 1b19 0002 2 <
ffff8801f4df80c0 4080447148 C Ci:5:002:0 0 2 = ffff
ffff8801f4df80c0 4080448630 S Ci:5:002:0 s 80 06 b501 1b1a 0002 2 <
ffff8801f4df80c0 4080449149 C Ci:5:002:0 0 2 = ffff
ffff8801f4df80c0 4080450569 S Ci:5:002:0 s 80 06 b501 1b1b 0002 2 <
ffff8801f4df80c0 4080451148 C Ci:5:002:0 0 2 = ffff
ffff8801f4df80c0 4080452586 S Ci:5:002:0 s 80 06 b501 1b1c 0002 2 <
ffff8801f4df80c0 4080453149 C Ci:5:002:0 0 2 = ffff
ffff8801f4df80c0 4080454600 S Ci:5:002:0 s 80 06 b501 1b1d 0002 2 <
ffff8801f4df80c0 4080455148 C Ci:5:002:0 0 2 = ffff
ffff8801f4df80c0 4080456617 S Ci:5:002:0 s 80 06 b501 1b1e 0002 2 <
ffff8801f4df80c0 4080457148 C Ci:5:002:0 0 2 = ffff
ffff8801f4df80c0 4080458632 S Ci:5:002:0 s 80 06 b501 1b1f 0002 2 <
ffff8801f4df80c0 4080459149 C Ci:5:002:0 0 2 = ffff
ffff8801f4df80c0 4080460569 S Ci:5:002:0 s 80 06 b504 ff00 0001 1 <
ffff8801f4df80c0 4080461149 C Ci:5:002:0 0 1 = fb
ffff8801f4df80c0 4080462590 S Ci:5:002:0 s 80 06 b504 ff01 0001 1 <
ffff8801f4df80c0 4080463150 C Ci:5:002:0 0 1 = fb
ffff8801f4df80c0 4080464601 S Ci:5:002:0 s 80 06 b504 ff02 0001 1 <
ffff8801f4df80c0 4080465149 C Ci:5:002:0 0 1 = fb
ffff8801f4df80c0 4080466617 S Ci:5:002:0 s 80 06 b504 ff03 0001 1 <
ffff8801f4df80c0 4080467148 C Ci:5:002:0 0 1 = fb
ffff8801f4df80c0 4080468632 S Ci:5:002:0 s 80 06 b504 ff04 0001 1 <
ffff8801f4df80c0 4080469148 C Ci:5:002:0 0 1 = fb
ffff8801f4df80c0 4080470569 S Ci:5:002:0 s 80 06 b504 ff05 0001 1 <
ffff8801f4df80c0 4080471149 C Ci:5:002:0 0 1 = fb
ffff8801f4df80c0 4080472586 S Ci:5:002:0 s 80 06 b504 ff06 0001 1 <
ffff8801f4df80c0 4080473148 C Ci:5:002:0 0 1 = fb
ffff8801f4df80c0 4080474601 S Ci:5:002:0 s 80 06 b504 ff07 0001 1 <
ffff8801f4df80c0 4080475149 C Ci:5:002:0 0 1 = fb
ffff8801f4df80c0 4080476617 S Ci:5:002:0 s 80 06 b504 ff08 0001 1 <
ffff8801f4df80c0 4080477149 C Ci:5:002:0 0 1 = fb
ffff8801f4df8a80 4080478636 S Ci:5:002:0 s 80 06 b504 ff09 0001 1 <
ffff8801f4df8a80 4080479150 C Ci:5:002:0 0 1 = fb
ffff8801f4df8a80 4080480570 S Ci:5:002:0 s 80 06 b504 ff0a 0001 1 <
ffff8801f4df8a80 4080481149 C Ci:5:002:0 0 1 = fb
ffff8801f4df8a80 4080482585 S Ci:5:002:0 s 80 06 b504 ff0b 0001 1 <
ffff8801f4df8a80 4080483149 C Ci:5:002:0 0 1 = fb
ffff8801f4df8a80 4080484600 S Ci:5:002:0 s 80 06 b504 ff0c 0001 1 <
ffff8801f4df8a80 4080485149 C Ci:5:002:0 0 1 = fb
ffff8801f4df8a80 4080486617 S Ci:5:002:0 s 80 06 b504 ff0d 0001 1 <
ffff8801f4df8a80 4080487149 C Ci:5:002:0 0 1 = fb
ffff8801f4df8a80 4080488632 S Ci:5:002:0 s 80 06 b504 ff0e 0001 1 <
ffff8801f4df8a80 4080489149 C Ci:5:002:0 0 1 = fb
ffff8801f4df8a80 4080490570 S Ci:5:002:0 s 80 06 b504 ff0f 0001 1 <
ffff8801f4df8a80 4080491149 C Ci:5:002:0 0 1 = fb
ffff8801f4df8a80 4080492583 S Ci:5:002:0 s 80 06 b504 ff10 0001 1 <
ffff8801f4df8a80 4080493150 C Ci:5:002:0 0 1 = fb
ffff8801f4df8a80 4080494600 S Ci:5:002:0 s 80 06 b504 ff11 0001 1 <
ffff8801f4df8a80 4080495150 C Ci:5:002:0 0 1 = fb
ffff8801f4df8a80 4080496616 S Ci:5:002:0 s 80 06 b504 ff12 0001 1 <
ffff8801f4df8a80 4080497149 C Ci:5:002:0 0 1 = fb
ffff8801f4df8a80 4080498630 S Ci:5:002:0 s 80 06 b504 ff13 0001 1 <
ffff8801f4df8a80 4080499149 C Ci:5:002:0 0 1 = fb
ffff8801f4df8a80 4080500569 S Ci:5:002:0 s 80 06 b504 ff14 0001 1 <
ffff8801f4df8a80 4080501150 C Ci:5:002:0 0 1 = fb
ffff8801f4df8a80 4080502584 S Ci:5:002:0 s 80 06 b504 ff15 0001 1 <
ffff8801f4df8a80 4080503150 C Ci:5:002:0 0 1 = fb
ffff8801f4df8a80 4080504600 S Ci:5:002:0 s 80 06 b504 ff16 0001 1 <
ffff8801f4df8a80 4080505150 C Ci:5:002:0 0 1 = fb
ffff8801f4df8a80 4080506616 S Ci:5:002:0 s 80 06 b504 ff17 0001 1 <
ffff8801f4df8a80 4080507150 C Ci:5:002:0 0 1 = fb
ffff8801f4df8a80 4080508631 S Ci:5:002:0 s 80 06 b504 ff18 0001 1 <
ffff8801f4df8a80 4080509150 C Ci:5:002:0 0 1 = fb
ffff8801f4df8a80 4080510569 S Ci:5:002:0 s 80 06 b504 ff19 0001 1 <
ffff8801f4df8a80 4080511150 C Ci:5:002:0 0 1 = fb
ffff8801f4df8a80 4080512584 S Ci:5:002:0 s 80 06 b504 ff1a 0001 1 <
ffff8801f4df8a80 4080513150 C Ci:5:002:0 0 1 = fb
ffff8801f4df8a80 4080514600 S Ci:5:002:0 s 80 06 b504 ff1b 0001 1 <
ffff8801f4df8a80 4080515150 C Ci:5:002:0 0 1 = fb
ffff8801f4df8a80 4080516616 S Ci:5:002:0 s 80 06 b504 ff1c 0001 1 <
ffff8801f4df8a80 4080517151 C Ci:5:002:0 0 1 = fb
ffff8801f4df8a80 4080518631 S Ci:5:002:0 s 80 06 b504 ff1d 0001 1 <
ffff8801f4df8a80 4080519150 C Ci:5:002:0 0 1 = fb
ffff8801f4df8a80 4080520569 S Ci:5:002:0 s 80 06 b504 ff1e 0001 1 <
ffff8801f4df8a80 4080521151 C Ci:5:002:0 0 1 = fb
ffff8801f4df8a80 4080522584 S Ci:5:002:0 s 80 06 b504 ff1f 0001 1 <
ffff8801f4df8a80 4080523151 C Ci:5:002:0 0 1 = fb
ffff8801f4df8a80 4080524600 S Ci:5:002:0 s 80 06 b504 ff20 0001 1 <
ffff8801f4df8a80 4080525150 C Ci:5:002:0 0 1 = fb
ffff8801f4df80c0 4080526618 S Ci:5:002:0 s 80 06 b504 ff21 0001 1 <
ffff8801f4df80c0 4080527150 C Ci:5:002:0 0 1 = fb
ffff8801f4df80c0 4080528631 S Ci:5:002:0 s 80 06 b504 ff22 0001 1 <
ffff8801f4df80c0 4080529150 C Ci:5:002:0 0 1 = fb
ffff8801f4df80c0 4080530574 S Ci:5:002:0 s 80 06 b504 ff23 0001 1 <
ffff8801f4df80c0 4080531151 C Ci:5:002:0 0 1 = fb
ffff8801f4df80c0 4080532585 S Ci:5:002:0 s 80 06 b504 ff24 0001 1 <
ffff8801f4df80c0 4080533151 C Ci:5:002:0 0 1 = fb
ffff8801f4df80c0 4080534601 S Ci:5:002:0 s 80 06 b504 ff25 0001 1 <
ffff8801f4df80c0 4080535151 C Ci:5:002:0 0 1 = fb
ffff8801f4df80c0 4080536617 S Ci:5:002:0 s 80 06 b504 ff26 0001 1 <
ffff8801f4df80c0 4080537151 C Ci:5:002:0 0 1 = fb
ffff8801f4df80c0 4080538631 S Ci:5:002:0 s 80 06 b504 ff27 0001 1 <
ffff8801f4df80c0 4080539151 C Ci:5:002:0 0 1 = fb
ffff8801f4df80c0 4080540570 S Ci:5:002:0 s 80 06 b504 ff28 0001 1 <
ffff8801f4df80c0 4080541151 C Ci:5:002:0 0 1 = fb
ffff8801f4df80c0 4080542584 S Ci:5:002:0 s 80 06 b504 ff29 0001 1 <
ffff8801f4df80c0 4080543151 C Ci:5:002:0 0 1 = fb
ffff8801f4df80c0 4080544601 S Ci:5:002:0 s 80 06 b504 ff2a 0001 1 <
ffff8801f4df80c0 4080545151 C Ci:5:002:0 0 1 = fb
ffff8801f4df80c0 4080546618 S Ci:5:002:0 s 80 06 b504 ff2b 0001 1 <
ffff8801f4df80c0 4080547151 C Ci:5:002:0 0 1 = fb
ffff8801f4df80c0 4080548632 S Ci:5:002:0 s 80 06 b504 ff2c 0001 1 <
ffff8801f4df80c0 4080549151 C Ci:5:002:0 0 1 = fb
ffff8801f4df80c0 4080550569 S Ci:5:002:0 s 80 06 b504 ff2d 0001 1 <
ffff8801f4df80c0 4080551151 C Ci:5:002:0 0 1 = fb
ffff8801f4df80c0 4080552585 S Ci:5:002:0 s 80 06 b504 ff2e 0001 1 <
ffff8801f4df80c0 4080553153 C Ci:5:002:0 0 1 = fb
ffff8801f4df80c0 4080554600 S Ci:5:002:0 s 80 06 b504 ff2f 0001 1 <
ffff8801f4df80c0 4080555152 C Ci:5:002:0 0 1 = fb
ffff8801f4df80c0 4080556617 S Ci:5:002:0 s 80 06 b504 ff30 0001 1 <
ffff8801f4df80c0 4080557151 C Ci:5:002:0 0 1 = fb
ffff8801f4df80c0 4080558631 S Ci:5:002:0 s 80 06 b504 ff31 0001 1 <
ffff8801f4df80c0 4080559151 C Ci:5:002:0 0 1 = fb
ffff8801f4df80c0 4080560570 S Ci:5:002:0 s 80 06 b504 ff32 0001 1 <
ffff8801f4df80c0 4080561152 C Ci:5:002:0 0 1 = fb
ffff8801f4df80c0 4080562584 S Ci:5:002:0 s 80 06 b504 ff33 0001 1 <
ffff8801f4df80c0 4080563153 C Ci:5:002:0 0 1 = fb
ffff8801f4df80c0 4080564602 S Ci:5:002:0 s 80 06 b504 ff34 0001 1 <
ffff8801f4df80c0 4080565153 C Ci:5:002:0 0 1 = fb
ffff8801f4df80c0 4080566617 S Ci:5:002:0 s 80 06 b504 ff35 0001 1 <
ffff8801f4df80c0 4080567152 C Ci:5:002:0 0 1 = fb
ffff8801f4df80c0 4080568632 S Ci:5:002:0 s 80 06 b504 ff36 0001 1 <
ffff8801f4df80c0 4080569152 C Ci:5:002:0 0 1 = fb
ffff8801f4df80c0 4080570569 S Ci:5:002:0 s 80 06 b504 ff37 0001 1 <
ffff8801f4df80c0 4080571152 C Ci:5:002:0 0 1 = fb
ffff8801f4df80c0 4080572584 S Ci:5:002:0 s 80 06 b504 ff38 0001 1 <
ffff8801f4df80c0 4080573152 C Ci:5:002:0 0 1 = fb
ffff8801f4df80c0 4080574604 S Ci:5:002:0 s 80 06 b504 ff39 0001 1 <
ffff8801f4df80c0 4080575153 C Ci:5:002:0 0 1 = fb
ffff8801f4df80c0 4080576617 S Ci:5:002:0 s 80 06 b504 ff3a 0001 1 <
ffff8801f4df80c0 4080577152 C Ci:5:002:0 0 1 = fb
ffff8801f4df80c0 4080578632 S Ci:5:002:0 s 80 06 b504 ff3b 0001 1 <
ffff8801f4df80c0 4080579152 C Ci:5:002:0 0 1 = fb
ffff8801f4df80c0 4080580569 S Ci:5:002:0 s 80 06 b504 ff3c 0001 1 <
ffff8801f4df80c0 4080581152 C Ci:5:002:0 0 1 = fb
ffff8801f4df80c0 4080582584 S Ci:5:002:0 s 80 06 b504 ff3d 0001 1 <
ffff8801f4df80c0 4080583153 C Ci:5:002:0 0 1 = fb
ffff8801f4df80c0 4080584599 S Ci:5:002:0 s 80 06 b504 ff3e 0001 1 <
ffff8801f4df80c0 4080585153 C Ci:5:002:0 0 1 = fb
ffff8801f4df80c0 4080586617 S Ci:5:002:0 s 80 06 b504 ff3f 0001 1 <
ffff8801f4df80c0 4080587153 C Ci:5:002:0 0 1 = fb
ffff8801f4df80c0 4080588631 S Ci:5:002:0 s 80 06 b500 9b20 0001 1 <
ffff8801f4df80c0 4080590152 C Ci:5:002:0 0 1 = fb
ffff8801f4df80c0 4080591578 S Ci:5:002:0 s 80 06 b501 1b20 0002 2 <
ffff8801f4df80c0 4080592152 C Ci:5:002:0 0 2 = ffff
ffff8801f4df80c0 4080593591 S Ci:5:002:0 s 80 06 b501 1b21 0002 2 <
ffff8801f4df80c0 4080594153 C Ci:5:002:0 0 2 = ffff
ffff8801f4df80c0 4080595607 S Ci:5:002:0 s 80 06 b501 1b22 0002 2 <
ffff8801f4df80c0 4080596153 C Ci:5:002:0 0 2 = ffff
ffff8801f4df80c0 4080597623 S Ci:5:002:0 s 80 06 b501 1b23 0002 2 <
ffff8801f4df80c0 4080598153 C Ci:5:002:0 0 2 = ffff
ffff8801f4df80c0 4080599569 S Ci:5:002:0 s 80 06 b501 1b24 0002 2 <
ffff8801f4df80c0 4080600154 C Ci:5:002:0 0 2 = ffff
ffff8801f4df89c0 4080601586 S Ci:5:002:0 s 80 06 b501 1b25 0002 2 <
ffff8801f4df89c0 4080602154 C Ci:5:002:0 0 2 = ffff
ffff8801f4df89c0 4080603642 S Ci:5:002:0 s 80 06 b501 1b26 0002 2 <
ffff8801f4df89c0 4080604153 C Ci:5:002:0 0 2 = ffff
ffff8801f4df89c0 4080605609 S Ci:5:002:0 s 80 06 b501 1b27 0002 2 <
ffff8801f4df89c0 4080606153 C Ci:5:002:0 0 2 = ffff
ffff8801f4df89c0 4080607624 S Ci:5:002:0 s 80 06 b501 1b28 0002 2 <
ffff8801f4df89c0 4080608152 C Ci:5:002:0 0 2 = ffff
ffff8801f4df89c0 4080609566 S Ci:5:002:0 s 80 06 b501 1b29 0002 2 <
ffff8801f4df89c0 4080610153 C Ci:5:002:0 0 2 = ffff
ffff8801f4df89c0 4080611578 S Ci:5:002:0 s 80 06 b501 1b2a 0002 2 <
ffff8801f4df89c0 4080612153 C Ci:5:002:0 0 2 = ffff
ffff8801f4df89c0 4080613592 S Ci:5:002:0 s 80 06 b501 1b2b 0002 2 <
ffff8801f4df89c0 4080614154 C Ci:5:002:0 0 2 = ffff
ffff8801f4df89c0 4080615608 S Ci:5:002:0 s 80 06 b501 1b2c 0002 2 <
ffff8801f4df89c0 4080616154 C Ci:5:002:0 0 2 = ffff
ffff8801f4df89c0 4080617623 S Ci:5:002:0 s 80 06 b501 1b2d 0002 2 <
ffff8801f4df89c0 4080618153 C Ci:5:002:0 0 2 = ffff
ffff8801f4df89c0 4080619566 S Ci:5:002:0 s 80 06 b501 1b2e 0002 2 <
ffff8801f4df89c0 4080620153 C Ci:5:002:0 0 2 = ffff
ffff8801f4df89c0 4080621578 S Ci:5:002:0 s 80 06 b501 1b2f 0002 2 <
ffff8801f4df89c0 4080622153 C Ci:5:002:0 0 2 = ffff
ffff8801f4df89c0 4080623592 S Ci:5:002:0 s 80 06 b501 1b30 0002 2 <
ffff8801f4df89c0 4080624154 C Ci:5:002:0 0 2 = ffff
ffff8801f4df89c0 4080625607 S Ci:5:002:0 s 80 06 b501 1b31 0002 2 <
ffff8801f4df89c0 4080626153 C Ci:5:002:0 0 2 = ffff
ffff8801f4df89c0 4080627623 S Ci:5:002:0 s 80 06 b501 1b32 0002 2 <
ffff8801f4df89c0 4080628153 C Ci:5:002:0 0 2 = ffff
ffff8801f4df89c0 4080629566 S Ci:5:002:0 s 80 06 b501 1b33 0002 2 <
ffff8801f4df89c0 4080630155 C Ci:5:002:0 0 2 = ffff
ffff8801f4df89c0 4080631579 S Ci:5:002:0 s 80 06 b501 1b34 0002 2 <
ffff8801f4df89c0 4080632154 C Ci:5:002:0 0 2 = ffff
ffff8801f4df89c0 4080633592 S Ci:5:002:0 s 80 06 b501 1b35 0002 2 <
ffff8801f4df89c0 4080634154 C Ci:5:002:0 0 2 = ffff
ffff8801f4df89c0 4080635608 S Ci:5:002:0 s 80 06 b501 1b36 0002 2 <
ffff8801f4df89c0 4080636154 C Ci:5:002:0 0 2 = ffff
ffff8801f4df89c0 4080637624 S Ci:5:002:0 s 80 06 b501 1b37 0002 2 <
ffff8801f4df89c0 4080638154 C Ci:5:002:0 0 2 = ffff
ffff8801f4df89c0 4080639565 S Ci:5:002:0 s 80 06 b501 1b38 0002 2 <
ffff8801f4df89c0 4080640155 C Ci:5:002:0 0 2 = ffff
ffff8801f4df89c0 4080641578 S Ci:5:002:0 s 80 06 b501 1b39 0002 2 <
ffff8801f4df89c0 4080642154 C Ci:5:002:0 0 2 = ffff
ffff8801f4df89c0 4080643592 S Ci:5:002:0 s 80 06 b501 1b3a 0002 2 <
ffff8801f4df89c0 4080644155 C Ci:5:002:0 0 2 = ffff
ffff8801f4df89c0 4080645609 S Ci:5:002:0 s 80 06 b501 1b3b 0002 2 <
ffff8801f4df89c0 4080646155 C Ci:5:002:0 0 2 = ffff
ffff8801f4df89c0 4080647624 S Ci:5:002:0 s 80 06 b501 1b3c 0002 2 <
ffff8801f4df89c0 4080648154 C Ci:5:002:0 0 2 = ffff
ffff8801f4df89c0 4080649566 S Ci:5:002:0 s 80 06 b501 1b3d 0002 2 <
ffff8801f4df89c0 4080650154 C Ci:5:002:0 0 2 = ffff
ffff8801f4df89c0 4080651578 S Ci:5:002:0 s 80 06 b501 1b3e 0002 2 <
ffff8801f4df89c0 4080652155 C Ci:5:002:0 0 2 = ffff
ffff8801f4df89c0 4080653592 S Ci:5:002:0 s 80 06 b501 1b3f 0002 2 <
ffff8801f4df89c0 4080654155 C Ci:5:002:0 0 2 = ffff
ffff8801f4df89c0 4080655607 S Ci:5:002:0 s 80 06 b504 ff00 0001 1 <
ffff8801f4df89c0 4080656155 C Ci:5:002:0 0 1 = fb
ffff8801f4df89c0 4080657622 S Ci:5:002:0 s 80 06 b504 ff01 0001 1 <
ffff8801f4df89c0 4080658154 C Ci:5:002:0 0 1 = fb
ffff8801f4df89c0 4080659566 S Ci:5:002:0 s 80 06 b504 ff02 0001 1 <
ffff8801f4df89c0 4080660154 C Ci:5:002:0 0 1 = fb
ffff8801f4df89c0 4080661579 S Ci:5:002:0 s 80 06 b504 ff03 0001 1 <
ffff8801f4df89c0 4080662155 C Ci:5:002:0 0 1 = fb
ffff8801df479800 4080663595 S Ci:5:002:0 s 80 06 b504 ff04 0001 1 <
ffff8801df479800 4080664154 C Ci:5:002:0 0 1 = fb
ffff8801df479800 4080665610 S Ci:5:002:0 s 80 06 b504 ff05 0001 1 <
ffff8801df479800 4080666155 C Ci:5:002:0 0 1 = fb
ffff8801df479800 4080667624 S Ci:5:002:0 s 80 06 b504 ff06 0001 1 <
ffff8801df479800 4080668155 C Ci:5:002:0 0 1 = fb
ffff8801df479800 4080669567 S Ci:5:002:0 s 80 06 b504 ff07 0001 1 <
ffff8801df479800 4080670155 C Ci:5:002:0 0 1 = fb
ffff8801df479800 4080671579 S Ci:5:002:0 s 80 06 b504 ff08 0001 1 <
ffff8801df479800 4080672155 C Ci:5:002:0 0 1 = fb
ffff8801df479800 4080673593 S Ci:5:002:0 s 80 06 b504 ff09 0001 1 <
ffff8801df479800 4080674155 C Ci:5:002:0 0 1 = fb
ffff8801df479800 4080675608 S Ci:5:002:0 s 80 06 b504 ff0a 0001 1 <
ffff8801df479800 4080676156 C Ci:5:002:0 0 1 = fb
ffff8801df479800 4080677624 S Ci:5:002:0 s 80 06 b504 ff0b 0001 1 <
ffff8801df479800 4080678155 C Ci:5:002:0 0 1 = fb
ffff8801df479800 4080679566 S Ci:5:002:0 s 80 06 b504 ff0c 0001 1 <
ffff8801df479800 4080680155 C Ci:5:002:0 0 1 = fb
ffff8801df479800 4080681579 S Ci:5:002:0 s 80 06 b504 ff0d 0001 1 <
ffff8801df479800 4080682155 C Ci:5:002:0 0 1 = fb
ffff8801df479800 4080683592 S Ci:5:002:0 s 80 06 b504 ff0e 0001 1 <
ffff8801df479800 4080684155 C Ci:5:002:0 0 1 = fb
ffff8801df479800 4080685607 S Ci:5:002:0 s 80 06 b504 ff0f 0001 1 <
ffff8801df479800 4080686156 C Ci:5:002:0 0 1 = fb
ffff8801df479800 4080687623 S Ci:5:002:0 s 80 06 b504 ff10 0001 1 <
ffff8801df479800 4080688156 C Ci:5:002:0 0 1 = fb
ffff8801df479800 4080689566 S Ci:5:002:0 s 80 06 b504 ff11 0001 1 <
ffff8801df479800 4080690157 C Ci:5:002:0 0 1 = fb
ffff8801df479800 4080691578 S Ci:5:002:0 s 80 06 b504 ff12 0001 1 <
ffff8801df479800 4080692156 C Ci:5:002:0 0 1 = fb
ffff8801df479800 4080693592 S Ci:5:002:0 s 80 06 b504 ff13 0001 1 <
ffff8801df479800 4080694155 C Ci:5:002:0 0 1 = fb
ffff8801df479800 4080695607 S Ci:5:002:0 s 80 06 b504 ff14 0001 1 <
ffff8801df479800 4080696156 C Ci:5:002:0 0 1 = fb
ffff8801df479800 4080697623 S Ci:5:002:0 s 80 06 b504 ff15 0001 1 <
ffff8801df479800 4080698156 C Ci:5:002:0 0 1 = fb
ffff8801df479800 4080699566 S Ci:5:002:0 s 80 06 b504 ff16 0001 1 <
ffff8801df479800 4080700157 C Ci:5:002:0 0 1 = fb
ffff8801df479800 4080701578 S Ci:5:002:0 s 80 06 b504 ff17 0001 1 <
ffff8801df479800 4080702156 C Ci:5:002:0 0 1 = fb
ffff8801df479800 4080703593 S Ci:5:002:0 s 80 06 b504 ff18 0001 1 <
ffff8801df479800 4080704156 C Ci:5:002:0 0 1 = fb
ffff8801df479800 4080705608 S Ci:5:002:0 s 80 06 b504 ff19 0001 1 <
ffff8801df479800 4080706157 C Ci:5:002:0 0 1 = fb
ffff8801df479800 4080707624 S Ci:5:002:0 s 80 06 b504 ff1a 0001 1 <
ffff8801df479800 4080708155 C Ci:5:002:0 0 1 = fb
ffff8801df479800 4080709566 S Ci:5:002:0 s 80 06 b504 ff1b 0001 1 <
ffff8801df479800 4080710157 C Ci:5:002:0 0 1 = fb
ffff8801df479800 4080711579 S Ci:5:002:0 s 80 06 b504 ff1c 0001 1 <
ffff8801df479800 4080712156 C Ci:5:002:0 0 1 = fb
ffff8801df479800 4080713593 S Ci:5:002:0 s 80 06 b504 ff1d 0001 1 <
ffff8801df479800 4080714156 C Ci:5:002:0 0 1 = fb
ffff8801df479800 4080715643 S Ci:5:002:0 s 80 06 b504 ff1e 0001 1 <
ffff8801df479800 4080716157 C Ci:5:002:0 0 1 = fb
ffff8801df479800 4080717624 S Ci:5:002:0 s 80 06 b504 ff1f 0001 1 <
ffff8801df479800 4080718156 C Ci:5:002:0 0 1 = fb
ffff8801df479800 4080719561 S Ci:5:002:0 s 80 06 b504 ff20 0001 1 <
ffff8801df479800 4080720157 C Ci:5:002:0 0 1 = fb
ffff8801df479800 4080721579 S Ci:5:002:0 s 80 06 b504 ff21 0001 1 <
ffff8801df479800 4080722157 C Ci:5:002:0 0 1 = fb
ffff8801df479800 4080723592 S Ci:5:002:0 s 80 06 b504 ff22 0001 1 <
ffff8801df479800 4080724157 C Ci:5:002:0 0 1 = fb
ffff8801df479800 4080725608 S Ci:5:002:0 s 80 06 b504 ff23 0001 1 <
ffff8801df479800 4080726156 C Ci:5:002:0 0 1 = fb
ffff8801df479800 4080727624 S Ci:5:002:0 s 80 06 b504 ff24 0001 1 <
ffff8801df479800 4080728156 C Ci:5:002:0 0 1 = fb
ffff8801df479800 4080729561 S Ci:5:002:0 s 80 06 b504 ff25 0001 1 <
ffff8801df479800 4080730157 C Ci:5:002:0 0 1 = fb
ffff8801df479800 4080731579 S Ci:5:002:0 s 80 06 b504 ff26 0001 1 <
ffff8801df479800 4080732158 C Ci:5:002:0 0 1 = fb
ffff8801df479800 4080733592 S Ci:5:002:0 s 80 06 b504 ff27 0001 1 <
ffff8801df479800 4080734157 C Ci:5:002:0 0 1 = fb
ffff8801df479800 4080735608 S Ci:5:002:0 s 80 06 b504 ff28 0001 1 <
ffff8801df479800 4080736158 C Ci:5:002:0 0 1 = fb
ffff8801df479800 4080737623 S Ci:5:002:0 s 80 06 b504 ff29 0001 1 <
ffff8801df479800 4080738157 C Ci:5:002:0 0 1 = fb
ffff8801df479800 4080739562 S Ci:5:002:0 s 80 06 b504 ff2a 0001 1 <
ffff8801df479800 4080740157 C Ci:5:002:0 0 1 = fb
ffff8801df479800 4080741579 S Ci:5:002:0 s 80 06 b504 ff2b 0001 1 <
ffff8801df479800 4080742157 C Ci:5:002:0 0 1 = fb
ffff8801df479800 4080743592 S Ci:5:002:0 s 80 06 b504 ff2c 0001 1 <
ffff8801df479800 4080744157 C Ci:5:002:0 0 1 = fb
ffff8801df479800 4080745607 S Ci:5:002:0 s 80 06 b504 ff2d 0001 1 <
ffff8801df479800 4080746158 C Ci:5:002:0 0 1 = fb
ffff8801df479800 4080747623 S Ci:5:002:0 s 80 06 b504 ff2e 0001 1 <
ffff8801df479800 4080748158 C Ci:5:002:0 0 1 = fb
ffff8801df479800 4080749561 S Ci:5:002:0 s 80 06 b504 ff2f 0001 1 <
ffff8801df479800 4080750158 C Ci:5:002:0 0 1 = fb
ffff8801df479800 4080751579 S Ci:5:002:0 s 80 06 b504 ff30 0001 1 <
ffff8801df479800 4080752158 C Ci:5:002:0 0 1 = fb
ffff8801df479800 4080753592 S Ci:5:002:0 s 80 06 b504 ff31 0001 1 <
ffff8801df479800 4080754157 C Ci:5:002:0 0 1 = fb
ffff8801df479800 4080755607 S Ci:5:002:0 s 80 06 b504 ff32 0001 1 <
ffff8801df479800 4080756158 C Ci:5:002:0 0 1 = fb
ffff8801df479800 4080757623 S Ci:5:002:0 s 80 06 b504 ff33 0001 1 <
ffff8801df479800 4080758158 C Ci:5:002:0 0 1 = fb
ffff8801df479800 4080759562 S Ci:5:002:0 s 80 06 b504 ff34 0001 1 <
ffff8801df479800 4080760158 C Ci:5:002:0 0 1 = fb
ffff8801df479800 4080761579 S Ci:5:002:0 s 80 06 b504 ff35 0001 1 <
ffff8801df479800 4080762158 C Ci:5:002:0 0 1 = fb
ffff8801df479800 4080763592 S Ci:5:002:0 s 80 06 b504 ff36 0001 1 <
ffff8801df479800 4080764141 C Ci:5:002:0 0 1 = fb
ffff8801df479800 4080765614 S Ci:5:002:0 s 80 06 b504 ff37 0001 1 <
ffff8801df479800 4080766159 C Ci:5:002:0 0 1 = fb
ffff8801df479800 4080767625 S Ci:5:002:0 s 80 06 b504 ff38 0001 1 <
ffff8801df479800 4080768158 C Ci:5:002:0 0 1 = fb
ffff8801df479800 4080769561 S Ci:5:002:0 s 80 06 b504 ff39 0001 1 <
ffff8801df479800 4080770159 C Ci:5:002:0 0 1 = fb
ffff8801df479800 4080771579 S Ci:5:002:0 s 80 06 b504 ff3a 0001 1 <
ffff8801df479800 4080772158 C Ci:5:002:0 0 1 = fb
ffff8801df479800 4080773593 S Ci:5:002:0 s 80 06 b504 ff3b 0001 1 <
ffff8801df479800 4080774159 C Ci:5:002:0 0 1 = fb
ffff8801df479e00 4080775613 S Ci:5:002:0 s 80 06 b504 ff3c 0001 1 <
ffff8801df479e00 4080776159 C Ci:5:002:0 0 1 = fb
ffff8801df479e00 4080777624 S Ci:5:002:0 s 80 06 b504 ff3d 0001 1 <
ffff8801df479e00 4080778158 C Ci:5:002:0 0 1 = fb
ffff8801df479e00 4080779561 S Ci:5:002:0 s 80 06 b504 ff3e 0001 1 <
ffff8801df479e00 4080780159 C Ci:5:002:0 0 1 = fb
ffff8801df479e00 4080781579 S Ci:5:002:0 s 80 06 b504 ff3f 0001 1 <
ffff8801df479e00 4080782159 C Ci:5:002:0 0 1 = fb
ffff8801df479e00 4080783592 S Ci:5:002:0 s 80 06 b500 9b40 0001 1 <
ffff8801df479e00 4080785158 C Ci:5:002:0 0 1 = fb
ffff8801df479e00 4080786618 S Ci:5:002:0 s 80 06 b501 1b40 0002 2 <
ffff8801df479e00 4080787159 C Ci:5:002:0 0 2 = ffff
ffff8801df479e00 4080788631 S Ci:5:002:0 s 80 06 b501 1b41 0002 2 <
ffff8801df479e00 4080789159 C Ci:5:002:0 0 2 = ffff
ffff8801df479e00 4080790570 S Ci:5:002:0 s 80 06 b501 1b42 0002 2 <
ffff8801df479e00 4080791159 C Ci:5:002:0 0 2 = ffff
ffff8801df479e00 4080792584 S Ci:5:002:0 s 80 06 b501 1b43 0002 2 <
ffff8801df479e00 4080793159 C Ci:5:002:0 0 2 = ffff
ffff8801df479e00 4080794601 S Ci:5:002:0 s 80 06 b501 1b44 0002 2 <
ffff8801df479e00 4080795159 C Ci:5:002:0 0 2 = ffff
ffff8801df479e00 4080796619 S Ci:5:002:0 s 80 06 b501 1b45 0002 2 <
ffff8801df479e00 4080797160 C Ci:5:002:0 0 2 = ffff
ffff8801df479e00 4080798632 S Ci:5:002:0 s 80 06 b501 1b46 0002 2 <
ffff8801df479e00 4080799159 C Ci:5:002:0 0 2 = ffff
ffff8801df479e00 4080800570 S Ci:5:002:0 s 80 06 b501 1b47 0002 2 <
ffff8801df479e00 4080801159 C Ci:5:002:0 0 2 = ffff
ffff8801df479e00 4080802584 S Ci:5:002:0 s 80 06 b501 1b48 0002 2 <
ffff8801df479e00 4080803159 C Ci:5:002:0 0 2 = ffff
ffff8801df479e00 4080804600 S Ci:5:002:0 s 80 06 b501 1b49 0002 2 <
ffff8801df479e00 4080805159 C Ci:5:002:0 0 2 = ffff
ffff8801df479e00 4080806618 S Ci:5:002:0 s 80 06 b501 1b4a 0002 2 <
ffff8801df479e00 4080807160 C Ci:5:002:0 0 2 = ffff
ffff8801df479e00 4080808631 S Ci:5:002:0 s 80 06 b501 1b4b 0002 2 <
ffff8801df479e00 4080809160 C Ci:5:002:0 0 2 = ffff
ffff8801df479e00 4080810570 S Ci:5:002:0 s 80 06 b501 1b4c 0002 2 <
ffff8801df479e00 4080811160 C Ci:5:002:0 0 2 = ffff
ffff8801df479e00 4080812584 S Ci:5:002:0 s 80 06 b501 1b4d 0002 2 <
ffff8801df479e00 4080813160 C Ci:5:002:0 0 2 = ffff
ffff8801df479800 4080814604 S Ci:5:002:0 s 80 06 b501 1b4e 0002 2 <
ffff8801df479800 4080815159 C Ci:5:002:0 0 2 = ffff
ffff8801df479800 4080816618 S Ci:5:002:0 s 80 06 b501 1b4f 0002 2 <
ffff8801df479800 4080817160 C Ci:5:002:0 0 2 = ffff
ffff8801df479800 4080818633 S Ci:5:002:0 s 80 06 b501 1b50 0002 2 <
ffff8801df479800 4080819159 C Ci:5:002:0 0 2 = ffff
ffff8801df479800 4080820570 S Ci:5:002:0 s 80 06 b501 1b51 0002 2 <
ffff8801df479800 4080821160 C Ci:5:002:0 0 2 = ffff
ffff8801df479800 4080822585 S Ci:5:002:0 s 80 06 b501 1b52 0002 2 <
ffff8801df479800 4080823160 C Ci:5:002:0 0 2 = ffff
ffff8801df479800 4080824600 S Ci:5:002:0 s 80 06 b501 1b53 0002 2 <
ffff8801df479800 4080825160 C Ci:5:002:0 0 2 = ffff
ffff8801df479800 4080826618 S Ci:5:002:0 s 80 06 b501 1b54 0002 2 <
ffff8801df479800 4080827161 C Ci:5:002:0 0 2 = ffff
ffff8801df479800 4080828630 S Ci:5:002:0 s 80 06 b501 1b55 0002 2 <
ffff8801df479800 4080829160 C Ci:5:002:0 0 2 = ffff
ffff8801df479800 4080830569 S Ci:5:002:0 s 80 06 b501 1b56 0002 2 <
ffff8801df479800 4080831160 C Ci:5:002:0 0 2 = ffff
ffff8801df479800 4080832585 S Ci:5:002:0 s 80 06 b501 1b57 0002 2 <
ffff8801df479800 4080833160 C Ci:5:002:0 0 2 = ffff
ffff8801df479800 4080834600 S Ci:5:002:0 s 80 06 b501 1b58 0002 2 <
ffff8801df479800 4080835160 C Ci:5:002:0 0 2 = ffff
ffff8801df479800 4080836618 S Ci:5:002:0 s 80 06 b501 1b59 0002 2 <
ffff8801df479800 4080837161 C Ci:5:002:0 0 2 = ffff
ffff8801df479800 4080838631 S Ci:5:002:0 s 80 06 b501 1b5a 0002 2 <
ffff8801df479800 4080839161 C Ci:5:002:0 0 2 = ffff
ffff8801df479800 4080840569 S Ci:5:002:0 s 80 06 b501 1b5b 0002 2 <
ffff8801df479800 4080841161 C Ci:5:002:0 0 2 = ffff
ffff8801df479800 4080842585 S Ci:5:002:0 s 80 06 b501 1b5c 0002 2 <
ffff8801df479800 4080843161 C Ci:5:002:0 0 2 = ffff
ffff8801df479800 4080844600 S Ci:5:002:0 s 80 06 b501 1b5d 0002 2 <
ffff8801df479800 4080845161 C Ci:5:002:0 0 2 = ffff
ffff8801df479800 4080846620 S Ci:5:002:0 s 80 06 b501 1b5e 0002 2 <
ffff8801df479800 4080847161 C Ci:5:002:0 0 2 = ffff
ffff8801df479800 4080848632 S Ci:5:002:0 s 80 06 b501 1b5f 0002 2 <
ffff8801df479800 4080849161 C Ci:5:002:0 0 2 = ffff
ffff8801df479800 4080850569 S Ci:5:002:0 s 80 06 b504 ff00 0001 1 <
ffff8801df479800 4080851161 C Ci:5:002:0 0 1 = fb
ffff8801df479800 4080852585 S Ci:5:002:0 s 80 06 b504 ff01 0001 1 <
ffff8801df479800 4080853161 C Ci:5:002:0 0 1 = fb
ffff8801df479800 4080854600 S Ci:5:002:0 s 80 06 b504 ff02 0001 1 <
ffff8801df479800 4080855161 C Ci:5:002:0 0 1 = fb
ffff8801df479800 4080856619 S Ci:5:002:0 s 80 06 b504 ff03 0001 1 <
ffff8801df479800 4080857161 C Ci:5:002:0 0 1 = fb
ffff8801df479800 4080858632 S Ci:5:002:0 s 80 06 b504 ff04 0001 1 <
ffff8801df479800 4080859161 C Ci:5:002:0 0 1 = fb
ffff8801df479800 4080860570 S Ci:5:002:0 s 80 06 b504 ff05 0001 1 <
ffff8801df479800 4080861161 C Ci:5:002:0 0 1 = fb
ffff8801df479800 4080862585 S Ci:5:002:0 s 80 06 b504 ff06 0001 1 <
ffff8801df479800 4080863162 C Ci:5:002:0 0 1 = fb
ffff8801df479800 4080864601 S Ci:5:002:0 s 80 06 b504 ff07 0001 1 <
ffff8801df479800 4080865161 C Ci:5:002:0 0 1 = fb
ffff8801df479800 4080866621 S Ci:5:002:0 s 80 06 b504 ff08 0001 1 <
ffff8801df479800 4080867162 C Ci:5:002:0 0 1 = fb
ffff8801df479800 4080868631 S Ci:5:002:0 s 80 06 b504 ff09 0001 1 <
ffff8801df479800 4080869162 C Ci:5:002:0 0 1 = fb
ffff8801df479800 4080870569 S Ci:5:002:0 s 80 06 b504 ff0a 0001 1 <
ffff8801df479800 4080871162 C Ci:5:002:0 0 1 = fb
ffff8801df479800 4080872585 S Ci:5:002:0 s 80 06 b504 ff0b 0001 1 <
ffff8801df479800 4080873162 C Ci:5:002:0 0 1 = fb
ffff8801df479800 4080874600 S Ci:5:002:0 s 80 06 b504 ff0c 0001 1 <
ffff8801df479800 4080875161 C Ci:5:002:0 0 1 = fb
ffff8801f4df89c0 4080876630 S Ci:5:002:0 s 80 06 b504 ff0d 0001 1 <
ffff8801f4df89c0 4080877164 C Ci:5:002:0 0 1 = fb
ffff8801f4df89c0 4080878633 S Ci:5:002:0 s 80 06 b504 ff0e 0001 1 <
ffff8801f4df89c0 4080879162 C Ci:5:002:0 0 1 = fb
ffff8801f4df89c0 4080880570 S Ci:5:002:0 s 80 06 b504 ff0f 0001 1 <
ffff8801f4df89c0 4080881162 C Ci:5:002:0 0 1 = fb
ffff8801f4df89c0 4080882585 S Ci:5:002:0 s 80 06 b504 ff10 0001 1 <
ffff8801f4df89c0 4080883162 C Ci:5:002:0 0 1 = fb
ffff8801f4df89c0 4080884601 S Ci:5:002:0 s 80 06 b504 ff11 0001 1 <
ffff8801f4df89c0 4080885162 C Ci:5:002:0 0 1 = fb
ffff8801f4df89c0 4080886620 S Ci:5:002:0 s 80 06 b504 ff12 0001 1 <
ffff8801f4df89c0 4080887163 C Ci:5:002:0 0 1 = fb
ffff8801f4df89c0 4080888633 S Ci:5:002:0 s 80 06 b504 ff13 0001 1 <
ffff8801f4df89c0 4080889162 C Ci:5:002:0 0 1 = fb
ffff8801f4df89c0 4080890570 S Ci:5:002:0 s 80 06 b504 ff14 0001 1 <
ffff8801f4df89c0 4080891162 C Ci:5:002:0 0 1 = fb
ffff8801f4df89c0 4080892584 S Ci:5:002:0 s 80 06 b504 ff15 0001 1 <
ffff8801f4df89c0 4080893162 C Ci:5:002:0 0 1 = fb
ffff8801f4df89c0 4080894599 S Ci:5:002:0 s 80 06 b504 ff16 0001 1 <
ffff8801f4df89c0 4080895162 C Ci:5:002:0 0 1 = fb
ffff8801f4df89c0 4080896618 S Ci:5:002:0 s 80 06 b504 ff17 0001 1 <
ffff8801f4df89c0 4080897163 C Ci:5:002:0 0 1 = fb
ffff8801f4df89c0 4080898630 S Ci:5:002:0 s 80 06 b504 ff18 0001 1 <
ffff8801f4df89c0 4080899162 C Ci:5:002:0 0 1 = fb
ffff8801f4df89c0 4080900572 S Ci:5:002:0 s 80 06 b504 ff19 0001 1 <
ffff8801f4df89c0 4080901164 C Ci:5:002:0 0 1 = fb
ffff8801f4df89c0 4080902584 S Ci:5:002:0 s 80 06 b504 ff1a 0001 1 <
ffff8801f4df89c0 4080903163 C Ci:5:002:0 0 1 = fb
ffff8801f4df89c0 4080904599 S Ci:5:002:0 s 80 06 b504 ff1b 0001 1 <
ffff8801f4df89c0 4080905163 C Ci:5:002:0 0 1 = fb
ffff8801f4df89c0 4080906618 S Ci:5:002:0 s 80 06 b504 ff1c 0001 1 <
ffff8801f4df89c0 4080907163 C Ci:5:002:0 0 1 = fb
ffff8801f4df89c0 4080908630 S Ci:5:002:0 s 80 06 b504 ff1d 0001 1 <
ffff8801f4df89c0 4080909163 C Ci:5:002:0 0 1 = fb
ffff8801f4df89c0 4080910570 S Ci:5:002:0 s 80 06 b504 ff1e 0001 1 <
ffff8801f4df89c0 4080911163 C Ci:5:002:0 0 1 = fb
ffff8801f4df89c0 4080912585 S Ci:5:002:0 s 80 06 b504 ff1f 0001 1 <
ffff8801f4df89c0 4080913163 C Ci:5:002:0 0 1 = fb
ffff8801f4df89c0 4080914600 S Ci:5:002:0 s 80 06 b504 ff20 0001 1 <
ffff8801f4df89c0 4080915163 C Ci:5:002:0 0 1 = fb
ffff8801f4df89c0 4080916619 S Ci:5:002:0 s 80 06 b504 ff21 0001 1 <
ffff8801f4df89c0 4080917164 C Ci:5:002:0 0 1 = fb
ffff8801f4df89c0 4080918632 S Ci:5:002:0 s 80 06 b504 ff22 0001 1 <
ffff8801f4df89c0 4080919164 C Ci:5:002:0 0 1 = fb
ffff8801f4df89c0 4080920569 S Ci:5:002:0 s 80 06 b504 ff23 0001 1 <
ffff8801f4df89c0 4080921163 C Ci:5:002:0 0 1 = fb
ffff8801f4df89c0 4080922584 S Ci:5:002:0 s 80 06 b504 ff24 0001 1 <
ffff8801f4df89c0 4080923163 C Ci:5:002:0 0 1 = fb
ffff8801f4df89c0 4080924600 S Ci:5:002:0 s 80 06 b504 ff25 0001 1 <
ffff8801f4df89c0 4080925163 C Ci:5:002:0 0 1 = fb
ffff8801df479800 4080926620 S Ci:5:002:0 s 80 06 b504 ff26 0001 1 <
ffff8801df479800 4080927164 C Ci:5:002:0 0 1 = fb
ffff8801df479800 4080928631 S Ci:5:002:0 s 80 06 b504 ff27 0001 1 <
ffff8801df479800 4080929164 C Ci:5:002:0 0 1 = fb
ffff8801df479800 4080930569 S Ci:5:002:0 s 80 06 b504 ff28 0001 1 <
ffff8801df479800 4080931164 C Ci:5:002:0 0 1 = fb
ffff8801df479800 4080932584 S Ci:5:002:0 s 80 06 b504 ff29 0001 1 <
ffff8801df479800 4080933164 C Ci:5:002:0 0 1 = fb
ffff8801df479800 4080934600 S Ci:5:002:0 s 80 06 b504 ff2a 0001 1 <
ffff8801df479800 4080935163 C Ci:5:002:0 0 1 = fb
ffff8801df479800 4080936619 S Ci:5:002:0 s 80 06 b504 ff2b 0001 1 <
ffff8801df479800 4080937164 C Ci:5:002:0 0 1 = fb
ffff8801df479800 4080938632 S Ci:5:002:0 s 80 06 b504 ff2c 0001 1 <
ffff8801df479800 4080939164 C Ci:5:002:0 0 1 = fb
ffff8801f4df89c0 4080940572 S Ci:5:002:0 s 80 06 b504 ff2d 0001 1 <
ffff8801f4df89c0 4080941164 C Ci:5:002:0 0 1 = fb
ffff8801f4df89c0 4080942585 S Ci:5:002:0 s 80 06 b504 ff2e 0001 1 <
ffff8801f4df89c0 4080943164 C Ci:5:002:0 0 1 = fb
ffff8801f4df89c0 4080944601 S Ci:5:002:0 s 80 06 b504 ff2f 0001 1 <
ffff8801f4df89c0 4080945164 C Ci:5:002:0 0 1 = fb
ffff8801f4df89c0 4080946619 S Ci:5:002:0 s 80 06 b504 ff30 0001 1 <
ffff8801f4df89c0 4080947165 C Ci:5:002:0 0 1 = fb
ffff8801f4df89c0 4080948632 S Ci:5:002:0 s 80 06 b504 ff31 0001 1 <
ffff8801f4df89c0 4080949165 C Ci:5:002:0 0 1 = fb
ffff8801f4df89c0 4080950569 S Ci:5:002:0 s 80 06 b504 ff32 0001 1 <
ffff8801f4df89c0 4080951163 C Ci:5:002:0 0 1 = fb
ffff8801f4df89c0 4080952584 S Ci:5:002:0 s 80 06 b504 ff33 0001 1 <
ffff8801f4df89c0 4080953164 C Ci:5:002:0 0 1 = fb
ffff8801f4df89c0 4080954600 S Ci:5:002:0 s 80 06 b504 ff34 0001 1 <
ffff8801f4df89c0 4080955164 C Ci:5:002:0 0 1 = fb
ffff8801f4df89c0 4080956619 S Ci:5:002:0 s 80 06 b504 ff35 0001 1 <
ffff8801f4df89c0 4080957165 C Ci:5:002:0 0 1 = fb
ffff8801f4df89c0 4080958631 S Ci:5:002:0 s 80 06 b504 ff36 0001 1 <
ffff8801f4df89c0 4080959164 C Ci:5:002:0 0 1 = fb
ffff8801f4df89c0 4080960570 S Ci:5:002:0 s 80 06 b504 ff37 0001 1 <
ffff8801f4df89c0 4080961165 C Ci:5:002:0 0 1 = fb
ffff8801f4df89c0 4080962584 S Ci:5:002:0 s 80 06 b504 ff38 0001 1 <
ffff8801f4df89c0 4080963165 C Ci:5:002:0 0 1 = fb
ffff8801f4df89c0 4080964600 S Ci:5:002:0 s 80 06 b504 ff39 0001 1 <
ffff8801f4df89c0 4080965164 C Ci:5:002:0 0 1 = fb
ffff8801df479800 4080966625 S Ci:5:002:0 s 80 06 b504 ff3a 0001 1 <
ffff8801df479800 4080967166 C Ci:5:002:0 0 1 = fb
ffff8801df479800 4080968632 S Ci:5:002:0 s 80 06 b504 ff3b 0001 1 <
ffff8801df479800 4080969165 C Ci:5:002:0 0 1 = fb
ffff8801df479800 4080970570 S Ci:5:002:0 s 80 06 b504 ff3c 0001 1 <
ffff8801df479800 4080971165 C Ci:5:002:0 0 1 = fb
ffff8801df479800 4080972584 S Ci:5:002:0 s 80 06 b504 ff3d 0001 1 <
ffff8801df479800 4080973165 C Ci:5:002:0 0 1 = fb
ffff8801df479800 4080974600 S Ci:5:002:0 s 80 06 b504 ff3e 0001 1 <
ffff8801df479800 4080975165 C Ci:5:002:0 0 1 = fb
ffff8801df479800 4080976619 S Ci:5:002:0 s 80 06 b504 ff3f 0001 1 <
ffff8801df479800 4080977166 C Ci:5:002:0 0 1 = fb
ffff8801df479800 4080978631 S Ci:5:002:0 s 80 06 b500 9b60 0001 1 <
ffff8801df479800 4080980165 C Ci:5:002:0 0 1 = fb
ffff8801df479800 4080981580 S Ci:5:002:0 s 80 06 b501 1b60 0002 2 <
ffff8801df479800 4080982165 C Ci:5:002:0 0 2 = ffff
ffff8801df479800 4080983593 S Ci:5:002:0 s 80 06 b501 1b61 0002 2 <
ffff8801df479800 4080984166 C Ci:5:002:0 0 2 = ffff
ffff8801df479800 4080985609 S Ci:5:002:0 s 80 06 b501 1b62 0002 2 <
ffff8801df479800 4080986165 C Ci:5:002:0 0 2 = ffff
ffff8801df479800 4080987626 S Ci:5:002:0 s 80 06 b501 1b63 0002 2 <
ffff8801df479800 4080988165 C Ci:5:002:0 0 2 = ffff
ffff8801df479800 4080989562 S Ci:5:002:0 s 80 06 b501 1b64 0002 2 <
ffff8801df479800 4080990169 C Ci:5:002:0 0 2 = ffff
ffff8801df479800 4080991581 S Ci:5:002:0 s 80 06 b501 1b65 0002 2 <
ffff8801df479800 4080992166 C Ci:5:002:0 0 2 = ffff
ffff8801df479800 4080993592 S Ci:5:002:0 s 80 06 b501 1b66 0002 2 <
ffff8801df479800 4080994166 C Ci:5:002:0 0 2 = ffff
ffff8801df479800 4080995609 S Ci:5:002:0 s 80 06 b501 1b67 0002 2 <
ffff8801df479800 4080996165 C Ci:5:002:0 0 2 = ffff
ffff8801df479800 4080997625 S Ci:5:002:0 s 80 06 b501 1b68 0002 2 <
ffff8801df479800 4080998165 C Ci:5:002:0 0 2 = ffff
ffff8801df479800 4080999562 S Ci:5:002:0 s 80 06 b501 1b69 0002 2 <
ffff8801df479800 4081000165 C Ci:5:002:0 0 2 = ffff
ffff8801df479800 4081001580 S Ci:5:002:0 s 80 06 b501 1b6a 0002 2 <
ffff8801df479800 4081002166 C Ci:5:002:0 0 2 = ffff
ffff8801df479800 4081003592 S Ci:5:002:0 s 80 06 b501 1b6b 0002 2 <
ffff8801df479800 4081004166 C Ci:5:002:0 0 2 = ffff
ffff8801df479800 4081005608 S Ci:5:002:0 s 80 06 b501 1b6c 0002 2 <
ffff8801df479800 4081006166 C Ci:5:002:0 0 2 = ffff
ffff8801df479800 4081007626 S Ci:5:002:0 s 80 06 b501 1b6d 0002 2 <
ffff8801df479800 4081008166 C Ci:5:002:0 0 2 = ffff
ffff8801df479800 4081009562 S Ci:5:002:0 s 80 06 b501 1b6e 0002 2 <
ffff8801df479800 4081010170 C Ci:5:002:0 0 2 = ffff
ffff8801df479800 4081011575 S Ci:5:002:0 s 80 06 b501 1b6f 0002 2 <
ffff8801df479800 4081012166 C Ci:5:002:0 0 2 = ffff
ffff8801df479800 4081013592 S Ci:5:002:0 s 80 06 b501 1b70 0002 2 <
ffff8801df479800 4081014141 C Ci:5:002:0 0 2 = ffff
ffff8801df479800 4081015608 S Ci:5:002:0 s 80 06 b501 1b71 0002 2 <
ffff8801df479800 4081016165 C Ci:5:002:0 0 2 = ffff
ffff8801f4df89c0 4081017626 S Ci:5:002:0 s 80 06 b501 1b72 0002 2 <
ffff8801f4df89c0 4081018167 C Ci:5:002:0 0 2 = ffff
ffff8801f4df89c0 4081019561 S Ci:5:002:0 s 80 06 b501 1b73 0002 2 <
ffff8801f4df89c0 4081020166 C Ci:5:002:0 0 2 = ffff
ffff8801f4df89c0 4081021578 S Ci:5:002:0 s 80 06 b501 1b74 0002 2 <
ffff8801f4df89c0 4081022167 C Ci:5:002:0 0 2 = ffff
ffff8801f4df89c0 4081023592 S Ci:5:002:0 s 80 06 b501 1b75 0002 2 <
ffff8801f4df89c0 4081024167 C Ci:5:002:0 0 2 = ffff
ffff8801f4df89c0 4081025607 S Ci:5:002:0 s 80 06 b501 1b76 0002 2 <
ffff8801f4df89c0 4081026166 C Ci:5:002:0 0 2 = ffff
ffff8801f4df89c0 4081027623 S Ci:5:002:0 s 80 06 b501 1b77 0002 2 <
ffff8801f4df89c0 4081028166 C Ci:5:002:0 0 2 = ffff
ffff8801f4df89c0 4081029562 S Ci:5:002:0 s 80 06 b501 1b78 0002 2 <
ffff8801f4df89c0 4081030171 C Ci:5:002:0 0 2 = ffff
ffff8801f4df89c0 4081031577 S Ci:5:002:0 s 80 06 b501 1b79 0002 2 <
ffff8801f4df89c0 4081032167 C Ci:5:002:0 0 2 = ffff
ffff8801f4df89c0 4081033592 S Ci:5:002:0 s 80 06 b501 1b7a 0002 2 <
ffff8801f4df89c0 4081034167 C Ci:5:002:0 0 2 = ffff
ffff8801f4df89c0 4081035608 S Ci:5:002:0 s 80 06 b501 1b7b 0002 2 <
ffff8801f4df89c0 4081036167 C Ci:5:002:0 0 2 = ffff
ffff8801f4df89c0 4081037623 S Ci:5:002:0 s 80 06 b501 1b7c 0002 2 <
ffff8801f4df89c0 4081038167 C Ci:5:002:0 0 2 = ffff
ffff8801f4df89c0 4081039562 S Ci:5:002:0 s 80 06 b501 1b7d 0002 2 <
ffff8801f4df89c0 4081040170 C Ci:5:002:0 0 2 = ffff
ffff8801f4df89c0 4081041576 S Ci:5:002:0 s 80 06 b501 1b7e 0002 2 <
ffff8801f4df89c0 4081042167 C Ci:5:002:0 0 2 = ffff
ffff8801f4df89c0 4081043592 S Ci:5:002:0 s 80 06 b501 1b7f 0002 2 <
ffff8801f4df89c0 4081044167 C Ci:5:002:0 0 2 = ffff
ffff8801f4df89c0 4081045608 S Ci:5:002:0 s 80 06 b504 a400 0001 1 <
ffff8801f4df89c0 4081046167 C Ci:5:002:0 0 1 = fb
ffff8801f4df89c0 4081047624 S Ci:5:002:0 s 80 06 b504 a401 0001 1 <
ffff8801f4df89c0 4081048167 C Ci:5:002:0 0 1 = fb
ffff8801f4df89c0 4081049562 S Ci:5:002:0 s 80 06 b500 1a03 0001 1 <
ffff8801f4df89c0 4081050167 C Ci:5:002:0 0 1 = fb
ffff8801f4df89c0 4081051830 S Ci:5:002:0 s 80 06 b501 1a03 0002 2 <
ffff8801f4df89c0 4081052168 C Ci:5:002:0 0 2 = a4a4
ffff8801f4df89c0 4081053593 S Ci:5:002:0 s 80 06 b60e 0001 0001 1 <
ffff8801f4df89c0 4081054168 C Ci:5:002:0 0 1 = fb
ffff8801f4df89c0 4081055608 S Ci:5:002:0 s 80 06 b613 0010 0001 1 <
ffff8801f4df89c0 4081056167 C Ci:5:002:0 0 1 = fb
ffff8801f4df89c0 4081057623 S Ci:5:002:0 s 80 06 b60f 0002 0001 1 <
ffff8801f4df89c0 4081058167 C Ci:5:002:0 0 1 = fb
ffff8801f4df89c0 4081059562 S Ci:5:002:0 s 80 06 bf01 0002 0001 1 <
ffff8801f4df89c0 4081060167 C Ci:5:002:0 0 1 = fb
